 179 | دَرْ کُلْ زِنْدِگی اَشْ  | dˈar kˈol zˈendeɡˌi ˈaʃ
 180 | بِ اینْ دِلْخوْشْ باشَدْ  | beː iːn dˈelxoʃ bˈɑʃad
 181 | کِ دَرْ حُضورْ نِظارِ‌گَری خیالی دَرْ خیابانْ  | kˈeː dˈar hˈozuːr nezˈɑreːɡˌari xiˈɑli dˈar xiˈɑbɑn
 182 | دَرْ شِرْکَتْ وَ بَرْ رویِ صَنْدَلی کِناری دَرْ هَواپِیْما  | dˈar ʃˈerkat vˈa bar rˈuje sandˈali kenˈɑːri dˈar hˈavɑpˌejmɑ
 183 | کَمالاتی اَزْ خوْدْ بِروزْ دادِ اَسْتْ  | kˌamɑlˈɑti az xod berˈuːz dˈɑdeː ˈast
 184 | بَرایِ رَبیعْ سالْها طولْ خواْهَدْ کِشیدْ  | barˈɑje rˈabiʔ sˈɑlhɑ tˈuːl xˈɑhad kˈeʃid
 185 | وَ چَنْدینْ جَسْتارْ دَرْ بابْ عِشْقْ نیازْ خواْهَدْ بودْ  | vˈa tʃˈandin dʒastˈɑr dˈar bˈɑb ˈeːʃq1 nˈijɑz xˈɑhad bˈuːd
 186 | تا بِ نَتایِجی مُتَفاوِتْ بِرِسَدْ  | tɑː beː nˈatˈɑjedʒˌi mˌotafˈɑvet berˈesad
 187 | تا مُتِوَجِّ شَوَدْ  | tɑː mˌotevˈadʒdʒeː ʃavˈad
 188 | کِ دُرُسْتْ هَمانْ چیزی کِ روزی رومانْتیکْ می اِنْگاشْتْ، اَعَمْ  | kˈeː dˈorost hamˈɑn tʃˈizi kˈeː rˈuːzi ruːmˈɑntik mi ˈenɡɑʃt ˈaʔam
 189 | اَزْ شَمْ دَرونی بَیانْ ناپَذیرْ،  | az ʃˈam darˈuni bˈajɑn nɑpˈazir
 190 | تَمایُلاتْ آنی  | tˌamɑjˈolɑt ˈɑni
 191 | وَ اِعْتِمادْ بِ مَعْشوقْ،  | vˈa eʔtˈemɑd beː mˈaʔʃuq1
 192 | دَقیقَاْ مانِعی اَسْتْ بَرْ سَرْ راهْ یادْگیری  | daq1ˈiq1an mˈɑneʔˈi ˈast bar sˈar rˈɑh jɑdɡˈiri
 193 | چِگونِگی حِفْظْ رَوابِطْ  | tʃˌeɡunˈeɡi hˈefz ravˈɑbet
 194 | او بِ اینْ نَتیجِ می‌رِسَدْ کِ عِشْقْ زَمانی دَوامْ می‌آوَرْدْ  | ˈuː beː iːn nˈatidʒˌeː mirˈesad kˈeː ˈeːʃq1 zamˈɑni davˈɑm miˈɑvard
 195 | کِ شَخْصْ بِ جاهْ طَلَبی هایی اَفْسونْ کُنَنْدِ اَوَّلیِ آنْ  | kˈeː ʃˈaxs beː dʒˈɑːh talˈabi hˈɑiː ˈaːfsuːn konˈandeː ˈavvalˌije ˈɑn
 196 | تَوَجُّهْ نَکُنَدْ  | tˈavadʒdʒˌoh nakˈonad
 197 | وَ بِ اینْ نَتیجِ می‌رِسَدْ کِ بَرایِ بِهْبودْ رَوابِطَشْ  | vˈa beː iːn nˈatidʒˌeː mirˈesad kˈeː barˈɑje behbˈuːd rˌavɑbˈetaʃ
 198 | بایَدْ بَرْ اِحْساساتی کِ دَرْ وَهْلِ اَوَّلْ  | bˈɑjad bar ˌehsɑsˈɑti kˈeː dˈar vˈahleː ˈavval
 199 | او را بِ سَمْتْ آنْ رَوابِطْ سوْقْ دادِ  | ˈuː rɑ beː sˈamt ɑn ravˈɑbet sˈoq1 dˈɑdeː
 200 | غَلَبِ کُنَدْ  | q1alˈabeː kˈonad
 201 | بایَدْ بیاموزَدْ کِ عِشْقْ  | bˈɑjad bˌijɑmˈuzad kˈeː ˈeːʃq1
 202 | تَنْها شورْ وَ شوْقْ نیسْتْ  | tˈanhɑ ʃˈuːr vˈa ʃˈoːq1 nˈist
 203 | بَلْکِ مَهارَتْ اَسْتْ  | bˈalkeː mahˈɑrat ˈast
