 000 | "صَفْحِ یِ چِهِلْ وَ نه  | sˈafheː jˈeː tʃˈehel vˈa nˈa
 001 | اِدامِ دَرْخواسْتْ اِزْدِواجْ  | edˈɑmeː dˈarxɑst ezdˈevɑdʒ
 002 | او اَزْ کُرْسِتَنْ دَرْخواسْتْ اِزْدِواجْ می‌کُنَدْ  | ˈuː az korsˈetan dˈarxɑst ezdˈevɑdʒ mikˈonad
 003 | چوْنْ کارْ بِسیارْ خَطَرْناکی بِ نَظَرْ می‌رِسَدْ  | tʃˈon kˈɑr besˈijɑr xˌatarnˈɑki beː nˈazar mirˈesad
 004 | اَگَرْ اینْ اِزْدِواجْ  | ˌaɡˈar iːn ezdˈevɑdʒ
 005 | با شِکَسْتْ مواجِهْ شَوَدْ  | bɑ ʃˈekast movˈɑdʒeh ʃavˈad
 006 | زِنْدِگی هَرْ دوْیْ آنْها تَباهْ می‌شَوَدْ  | zˈendeɡˌi har dˈoj ˌɑnhɑ tabˈɑh miʃavˈad
 007 | رَبیعْ تَصْدیقْ می‌کُنَدْ  | rˈabiʔ tˈasdiq1 mikˈonad
 008 | آنْهایی کِ می‌گویَنْدْ اِمْروزِ دیگَرْ  | ɑnhˌɑiː kˈeː miɡˈujand emrˈuzeː dˈiɡar
 009 | نیازی بِ اِزْدِواجْ کَرْدَنْ نیسْتْ  | nijˈɑzi beː ezdˈevɑdʒ kˈardan nˈist
 010 | وَ مُطْمَئِنْ تَرْ اَسْتْ کِ فَقَطْ با هَمْ زِنْدِگی کُنیمْ  | vˈa mˈotmˌaen tar ˈast kˈeː fˈaq1at bɑ hˈam zˈendeɡˌi kˈonim
 011 | عَمَلَاْ دُرُسْتْ می‌گویَنْدْ  | amˈalan dˈorost miɡˈujand
 012 | اَمّا آنْها  | ˈammˌɑ ˈɑnhɑ
 013 | اَزْ جَذّابیَتْ عاطِفی اینْ خَطَرْ بی خَبَرَنْدْ  | az dʒˌazzɑbˈiːjat ˈɑtefˌi iːn xˈatar bi xˈabarˌand
 014 | اَزْ قَرارْ دادَنْ خوْدْ وَ مَعْشوقْ خوْدْ  | az q1arˈɑr dˈɑdan xod vˈa mˈaʔʃuq1 xˈod
 015 | دَرْ تَجْرُبِ‌ای کِ تَنْها کَمی پیچْ وَ خَمْ دَرْ مَسیرْ  | dˈar tadʒrˈobeiː kˈeː tˈanhɑ kˈami pˈitʃ vˈa xˈam dˈar mˈasir
 016 | مُمْکِنْ اَسْتْ بِ تَباهی هَرْ دوْ مُنْجَرْ شَوَدْ  | mˈomken ˈast beː tabˈɑhi har dˈo mˈondʒar ʃavˈad
 017 | رَبیعْ  | rˈabiʔ
 018 | بَرایِ اِثْباتْ سَرْسِپُرْدِگی اَشْ  | barˈɑje ˈesbɑt sarsˈepordˌeɡi ˈaʃ
 019 | حاضِرْ اَسْتْ با تَمامْ وُجودْ  | hˈɑzer ˈast bɑ tˈamɑm vˈodʒuːd
 020 | دَرْ راهْ عِشْقْ تَباهْ شَوَدْ  | dˈar rˈɑh ˈeːʃq1 tabˈɑh ʃavˈad
 021 | اینْکِ عَمَلَاْ نیازی نیسْتْ اِزْدِواجْ کُنیمْ  | ˈinkeː amˈalan nijˈɑzi nˈist ezdˈevɑdʒ kˈonim
 022 | ضَرورَتْ اِزْدِواجْ را اَزْ نَظَرْ عاطِفی  | zarˈuːrat ezdˈevɑdʒ rɑ az nˈazar ˈɑtefˌi
 023 | بیشْتَرْ نِشانْ می‌دَهَدْ  | bˈiʃtar nˈeʃɑn midˈahad
 024 | مُزْدَوَجْ بودَنْ شایَدْ با اِحْتیاطْ مُحافِظِ کاری  | mozdˈavadʒ bˈuːdan ʃˈɑjad bɑ ehtˈijɑt mˌohɑfˈezeː kˈɑri
 025 | وَ تَرْسْ هَمْراهْ باشَدْ  | vˈa tˈars hamrˈɑh bˈɑʃad
 026 | اَمّا اِزْدِواجْ کَرْدَنْ تَمامَاْ مُتَفاوِتْ اَسْتْ  | ˈammˌɑ ezdˈevɑdʒ kˈardan tamˈɑman mˌotafˈɑvet ˈast
 027 | هَرْ چِ بیپْرْوا تَرْ  | har tʃeː biprvˈɑ tˈar
 028 | دَرْخواسْتْ اِزْدِواجْ جَذّابْتَرْ وَ رومانْتیکْ تَرْ  | dˈarxɑst ezdˈevɑdʒ dʒazzˈɑbtar vˈa ruːmˈɑntik tˈar
 029 | اِزْدِواجْ اَزْ نَظَرْ رَبیعْ  | ezdˈevɑdʒ az nˈazar rˈabiʔ
 030 | نُقْطِ اُجْ مَسیری تَهَوُّرْ آمیزْ  | nˈoq1teː ˈoːdʒ masˈiri tahˈavvor ˈɑmiz
 031 | بِسویِ صَمیمیَتْ مُطْلَقْ اَسْتْ  | besˈuje sˌamimˈiːjat mˈotlaq1 ˈast
 032 | دَرْخواسْتْ اِزْدِواجْ  | dˈarxɑst ezdˈevɑdʒ
 033 | دارایِ تَمامْ جَذّابیَتیسْتْ  | dˈɑrˈɑje tˈamɑm dʒˌazzɑbiːjˈatist
 034 | کِ پَریدَنْ اَزْ پُرْتَگاهی مُرْتَفَعْ  | kˈeː parˈidan az portaɡˈɑhi mortˈafaʔ
 035 | با چَشْمانْ بَسْتِ دارَدْ  | bɑ tʃˈaʃmɑn bˈasteː dˈɑrad
 036 | بِ اینْ اُمیدْ وَ با اینْ اِطْمینانْ  | beː iːn ˈomid vˈa bɑ iːn etmˈinɑn
 037 | کِ دیگَری آنْ پایینْ باشَدْ  | kˈeː dˈiɡarˌi ɑn pˈɑjin bˈɑʃad
 038 | وَ ما را بِگیرَدْ  | vˈa mɑ rɑ beɡˈirad
 039 | او دَرْخواسْتْ اِزْدِواجْ می‌دَهَدْ  | ˈuː dˈarxɑst ezdˈevɑdʒ midˈahad
 040 | چوْنْ می‌خواهَدْ  | tʃˈon mixˈɑhad
 041 | آنْچِ بِیْنْ او وَ کُرْسِتَنْ اَسْتْ حِفْظْ شَوَدْ  | ˌɑntʃe bˈejn ˈuː vˈa korsˈetan ˈast hˈefz ʃavˈad
 042 | تَسْبیطْ شَوَدْ  | tˈasbit ʃavˈad
 043 | او اُمیدْوارْ اَسْتْ با اِزْدِواجْ  | ˈuː ʔomˈidvɑr ˈast bɑ ezdˈevɑdʒ
 044 | اینْ حِسْ شوریدِگی جاوِدانِ  | iːn hˈes ʃˌuːridˈeɡi dʒˈɑvedˌɑneː
 045 | شَوَدْ  | ʃavˈad
 046 | خاطِرِ ای وُجودْ دارَدْ  | xˈɑterˌeː iː vˈodʒuːd dˈɑrad
 047 | کِ او بَرایِ یادآوَری آنْ حالْ وَ هَوایِ فَراموشْ نَشُدَنی  | kˈeː ˈuː barˈɑje jɑdˈɑvarˌi ɑn hˈɑl vˈa hˈavɑjˌe farˈɑmuʃ nˈaʃodˌani
 048 | بارْها وَ بارْها  | bˈɑrhɑ vˈa bˈɑrhɑ
 049 | آنْ را مُرورْ خواهَدْ کَرْدْ  | ɑn rɑ mˈorur xˈɑhad kˈard
 050 | آنْها  | ˈɑnhɑ
 051 | دَرْ باشْگاهْ شَبانِ ای دَرْ خیابانْ جوْرْجْ هَسْتَنْدْ  | dˈar bˈɑʃɡˈɑh ʃabˈɑneː iː dˈar xiˈɑbɑn dʒˈordʒ hˈastand
 052 | شَنْبِ شَبْ اَسْتْ  | ʃˈanbeː ʃˈab ˈast
 053 | رویِ پِیْسْتْ رَقْصَنْدْ  | rˈuje pˈejst rˈaq1sand
 054 | غَرْقْ دَرْ نورْهایِ رَقْصانْ اَرْغَوانی وَ زَرْدْ  | q1ˈarq1 dˈar nurhˈɑje rˈaq1sɑn ˌarq1avˈɑni vˈa zˈard
 055 | آهَنْگْ هیپْ هاپْ  | ˈɑhanɡ hˈip hˈɑp
 056 | وَ هَمْخوانی شورْ اَنْگیزْ شُعارْ هایِ وَرْزِشْگاهی  | vˈa hamxˈɑni ʃˈuːr ˈaːnɡiz ʃˈoʔɑr hˈɑje vˌarzeʃɡˈɑhi
 057 | کِ یِکی دَرْ میانْ پَخْشْ می‌شَوَنْدْ  | kˈeː jˈeki dˈar mˈiɑn pˈaxʃ miʃˈavand
 058 | کُرْسِتَنْ  | korsˈetan
 059 | کَفْشْ وَرْزِشی پوشیدِ  | kˈafʃ varzˈeʃi puːʃˈideː
 060 | با شُرْتْ مَخْمَلی مِشْکی  | bɑ ʃˈort maxmˈali mˈeʃki
 061 | وَ تاپْ توری مِشْکی  | vˈa tˈɑp tˈuːri mˈeʃki
 062 | رَبیعْ می‌خواهَدْ  | rˈabiʔ mixˈɑhad
 063 | عَرَقْ رویِ شَقیقه‌هایِ او را پاکْ کُنَدْ  | ˈaraq1 rˈuje ʃaq1ˈiq1eːhˈɑje ˈuː rɑ pˈɑk kˈonad
 064 | وَ او را دَرْ آغوشْ خوْدْ بِچَرْخانْدْ  | vˈa ˈuː rɑ dˈar ˈɑq1uːʃ xod betʃarxˈɑnd
 065 | موسیقی وَ هَمْدِلی رَقْصَنْدِ ها  | muːsˈiq1i vˈa hamdˈeli raq1sˈande hˈɑ
 066 | نَویدْبَخْشْ پایانْ هَمیشِگی  | navˈidbaxʃ pˈɑjɑn hˌamiʃˈeɡi
 067 | رَنْجْ وَ جُدایی اَسْتْ  | rˈandʒ vˈa dʒodˈɑiː ˈast
 068 | اَزْ آنْجا خارِجْ می‌شَوَنْدْ  | az ˈɑndʒˈɑ xˈɑredʒ miʃˈavand
 069 | وَ بِ تِراسی می‌رَوَنْدْ  | vˈa beː terˈɑsi mirˈavand
 070 | کِ فَقَطْ با نورْ تِعْدادی شَمْعْ بُزُرْگْ  | kˈeː fˈaq1at bɑ nˈur tˈeʔdɑdˌi ʃˈamʔ bozˈorɡ
 071 | واقِعْ دَرْ اَطْرافْ نَرْدِ ها روْشَنْ شُدِ اَسْتْ  | vˈɑq1eʔ dˈar ˈaːtrˈɑf nˈardeː hɑ rˈoʃan ʃˈodeː ˈast
 072 | شَبْ آرامی اَسْتْ وَ کائِناتْ گَرْدْ آنْها آمَدَنْدْ  | ʃˈab ˈɑrˈɑmi ˈast vˈa kˈɑʔenˌɑt ɡˈard ˌɑnhɑ ɑmˈadand
 073 | کُرْسِتَنْ بِ کَهْکِشانْ آنَدَرومْدا اِشارِ می‌کُنَدْ  | korsˈetan beː kahkˈeʃɑn ˈɑnadˌaruːmdˈɑ eʃˈɑreː mikˈonad
 074 | هَواپِیْمایی  | hˈavɑpˌejmɑˌiː
 075 | بَرْ فَرازْ کاخْ اَدینْبَرو مُتِمایِلْ می‌شَوَدْ  | bar farˈɑz kˈɑx ˈaːdinbˌaruː mˌotemˈɑjel miʃavˈad
 076 | بَعْدْ صافْ می‌شَوَدْ  | bˈaʔd sˈɑf miʃavˈad
 077 | تا دَرْ فُرودْگاهْ فُرودْ بیایَدْ  | tɑː dˈar fˌoruːdɡˈɑh fˈoruːd bijˈɑjad
 078 | دَرْ آنْ لَحْظِ رَبیعْ اِحْساسْ می‌کُنَدْ  | dˈar ɑn lˈahzeː rˈabiʔ ˈehsɑs mikˈonad
 079 | کِ بِدونْ تَرْدیدْ  | kˈeː bedˈuːn tˈardid
 080 | اینْ هَمانْ زَنی اَسْتْ کِ میخواهَدْ پا بِ پایَشْ پیرْ شَوَدْ  | iːn hamˈɑn zˈani ˈast kˈeː mixˈɑhad pˈɑ beː pˈɑjaʃ pˈir ʃavˈad
 081 | اَلْبَتِّ چَنْدْ جَنْبِ اَزْ اینْ موْقِعیَتْ را  | albˈatteː tʃˈand dʒˈanbeː az iːn mˌoq1eʔˈiːjat rˈɑ
 082 | نِمی‌تَوانَدْ با اِزْدِواجْ حِفْظْ یا تَسْبیطْ کُنَدْ  | nˌemitavˈɑnad bɑ ezdˈevɑdʒ hˈefz jɑː tˈasbit kˈonad
 083 | آرامِشْ اینْ شَبْ عَظیمْ وَ پُرْسِتارِ  | ɑrˈɑmeʃ iːn ʃˈab ˈaːzim vˈa porsetˈɑre
 084 | لِذَّتْ جَوییْ وافِرْ اینْ باشْگاهْ پُرْشورْ  | lˈezzat dʒˈaviː vˈɑfer iːn bˈɑʃɡˈɑh pˈorʃur
 085 | نَداشْتَنْ مَسْئولیَتْ  | nˈadˈɑʃtan mˌasʔuːlˈiːjat
 086 | یِکْشَنْبِ تَنْ پَرْوَری کِ پیشْ رو اَسْتْ کِ تا ظُهْرْ میخوابَنْدْ  | jekʃˈanbeː tˈan parvˈari kˈeː pˈiʃ rˈu ˈast kˈeː tɑː zˈohr mixˈɑband
 087 | سَرْحالی کُرْسِتَنْ  | sarhˈɑli korsˈetan
 088 | وَ رِضایَتْ خاطِرْ رَبیعْ  | vˈa rezˈɑjat xˈɑter rˈabiʔ
 089 | او تَنْها  | ˈuː tˈanhɑ
 090 | با یِکْ اِحْساسْ اِزْدِواجْ نِمی‌کُنَدْ  | bɑ jˈek ˈehsɑs ezdˈevɑdʒ nˌemikˈonad
 091 | کِ بِخواهَدْ تا اَبَدْ حِفْظَشْ کُنَدْ  | kˈeː bexˈɑhad tɑː ˈabad hˈefzaʃ kˈonad
 092 | بَلْکِ با یِکْ شَخْصْ اِزْدِواجْ می‌کُنَدْ  | bˈalkeː bɑ jˈek ʃˈaxs ezdˈevɑdʒ mikˈonad
 093 | کِ دَرْ کَمالْ خوْشْ شانْسی  | kˈeː dˈar kˈamɑl xˈoʃ ʃˈɑnsi
 094 | تَوانِسْتِ اِحْساسَشْ را با او  | tˈavɑnˌesteː ehsˈɑsaʃ rɑ bɑ ˈuː
 095 | دَرْ شَرایِطی بِسیارْ خاصْ  | dˈar ʃarˈɑjetˌi besˈijɑr xˈɑs
 096 | ویژِ وَ ناپایْدارْ شَریکْ شَوَدْ  | vˈiʒeː vˈa nɑpˈɑjdɑr ʃˈarik ʃavˈad
 097 | دَرْخواسْتْ اِزْدِواجْ  | dˈarxɑst ezdˈevɑdʒ
 098 | دَرْ یِکْ سَطْحْ  | dˈar jˈek sˈath
 099 | بِ آنْچِ رَبیعْ دُنْبالَشْ میدودْ مَرْبوطْ می‌شَوَدْ  | beː ˌɑntʃe rˈabiʔ donbˈɑlaʃ midˈuːd mˈarbut miʃavˈad
 100 | وَ اَلْبَتِّ دَرْ سَطْحی دیگَرْ  | vˈa albˈatteː dˈar sˈathi dˈiɡar
 101 | وَ شایَدْ بِ هَمانْ اَنْدازِ  | vˈa ʃˈɑjad beː hamˈɑn ˈaːndˈɑzeː
 102 | بِ آنْچِ اَزْ آنْ میگُریزَدْ  | beː ˌɑntʃe az ɑn miɡorˈizad
 103 | چَنْدْ ماهْ قَبْلْ اَزْ مُلاقاتَشْ با کُرْسِتَنْ  | tʃˈand mˈɑh q1ˈabl az mˌolɑq1ˈɑtaʃ bɑ korsˈetan
 104 | با زوْجی شامْ خوْرْدْ کِ دوسْتانْ قَدیمی اَشْ  | bɑ zˈoːdʒi ʃˈɑm xˈord kˈeː dˈustɑn q1adˈimi ˈaʃ
 105 | اَزْ دوْرانْ دانِشْگاهْ سالامانْکا بودَنْدْ  | az dˈoːrɑn dˈɑneʃɡˈɑh sˈɑlˈɑmˈɑnkˈɑ bˈuːdand
 106 | سَرْ شامْ سَرْحالْ وَ شادابْ بودَنْدْ  | sˈar ʃˈɑm sˈarhɑl vˈa ʃˈɑdˈɑb bˈuːdand
 107 | وَ راجِعْ بِ اَخْبارْ گَپْ میزَدَنْدْ  | vˈa rˈɑdʒeʔ beː ˈaːxbɑr ɡˈap mizˈadand
 108 | وَقْتی هَرْ سِ نَفَرْ شانْ  | vˈaq1ti har sˈeː nˈafar ʃˈɑn
 109 | اَزْ رِسْتورانْ خیابانْ ویکْتوْریا بیرونْ آمَدَنْدْ  | az restˈurɑn xiˈɑbɑn vˌiktorˈijɑ bˈiruːn ɑmˈadand
 110 | مارْتا  | mˈɑrtˈɑ
 111 | یَقِ کُتْ شُتُری رَنْگْ ژَوانْ را رو  | jˈaq1eː kˈot ʃotˈori rˈanɡ ʒavˈɑn rɑ rˈu
 112 | بِ پایینْ صافْ کَرْدْ  | beː pˈɑjin sˈɑf kˈard
 113 | وَ شالْ گَرْدَنْ سُرْخْ رَنْگَشْ را  | vˈa ʃˈɑl ɡˈardan sˈorx rˈanɡaʃ rˈɑ
 114 | بَرایَشْ دورْ گَرْدَنَشْ پیچیدْ  | barˈɑjaʃ dˈuːr ɡardˈanaʃ pˈitʃid
 115 | اینْ رَفْتارْ چِنانْ تواَمْ با تَوَجُّهْ صادِقانِ وَ مِهْرْ آمیزْ بودْ  | iːn raftˈɑr tʃenˈɑn tˈoːʔam bɑ tˈavadʒdʒˌoh sˈɑdeq1ˌɑneː vˈa mˈeːhr ˈɑmiz bˈuːd
 116 | کِ بِ طَبْعْ آنْ  | kˈeː beː tˈabʔ ˈɑn
 117 | رَبیعْ ناگَهانْ  | rˈabiʔ nɑɡˈahɑn
 118 | اِنْگارْ کِ مُشْتی دَرْ شِکَمَشْ فُرو رَفْتِ باشَدْ  | ˈenɡɑr kˈeː mˈoʃti dˈar ʃekˈamaʃ fˈoru rˈafteː bˈɑʃad
 119 | اِحْساسْ کَرْدْ چِقَدْرْ تَنْهایِ تَنْها اَسْتْ  | ˈehsɑs kˈard tʃˈeq1adr tanhˈɑje tˈanhɑ ˈast
 120 | دَرْ دُنْیایی کِ وُجودْ وَ سَرْنِوِشْتَشْ  | dˈar donjˈɑiː kˈeː vˈodʒuːd vˈa sarnevˈeʃtaʃ
 121 | بَرایِ اَهالی آنْ  | barˈɑje ˈaːhˈɑli ˈɑn
 122 | عَلی اَلْسویِ اَسْتْ  | ˈaːli ˈaːlsuːjˌe ˈast
 123 | آنْ زَمانْ بودْ کِ مُتِوَجِّ شُدْ  | ɑn zamˈɑn bˈuːd kˈeː mˌotevˈadʒdʒeː ʃˈod
 124 | زِنْدِگی دَرْ تَنْهایی  | zˈendeɡˌi dˈar tanhˈɑiː
 125 | توْجیهْ ناپَذیرْ اَسْتْ  | tˈodʒih nɑpˌazir ˈast
 126 | دیگَرْ بَرایَشْ بَسْ بودْ  | dˈiɡar barˈɑjaʃ bˈas bˈuːd
 127 | آنَهَمِ پیادِ رویِ تا خانِ  | ˈɑnahˌameː piˈɑdeː rˈuje tɑː xˈɑneː
 128 | بَعْدْ اَزْ مِهْمانیهایِ بی هَدَفْ  | bˈaʔd az mˌehmɑnihˈɑje bi hˈadaf
 129 | خَسْتِ شُدِ بودْ  | xˈasteː ʃˈodeː bˈuːd
 130 | اَزْ یِکْشَنْبِ هایی کِ بِدونْ اینْکِ  | az jekʃˈanbeː hˈɑiː kˈeː bedˈuːn ˈinkeː
 131 | حَتّی یِکْ کَلَمِ با شَخْصی حَرْفْ بِزَنَدْ گُذَرانْدِ بودْ  | hˌattˈɑ jˈek kˈalamˌeː bɑ ʃˈaxsi hˈarf bezˈanad ɡˌozarˈɑndeː bˈuːd
 132 | اَزْ تَعْطیلاتی  | az tˌaʔtilˈɑti
 133 | کِ با راهْ اُفْتادَنْ دُنْبالْ زوْجْ هایِ مُسْتَأْصَلی گُذَرانْدِ بودْ  | kˈeː bɑ rˈɑh oftˈɑdan dˈonbɑl zˈoːdʒ hˈɑje mˌostaʔsali ɡˌozarˈɑndeː bˈuːd
 134 | کِ فَرْزَنْدانِشانْ  | kˈeː fˌarzandɑnˈeʃɑn
 135 | تَوانْ گُفْتُگو بَرایِشانْ باقی نَگُذاشْتْ بودَنْدْ  | tˈavɑn ɡoftˈoɡu barˈɑjeʃˌɑn bˈɑq1i nˈaɡˈozɑʃt bˈuːdand
 136 | اَزْ دانِسْتَنْ اینْ کِ  | az dɑnˈestan iːn kˈeː
 137 | او هیچْ جایْگاهْ مُهِمی  | ˈuː hˈitʃ dʒɑjɡˌɑh mˈohemˌi
 138 | دَرْ قَلْبْ هیچْکَسْ نَداشْتْ  | dˈar q1ˈalb hˈitʃkas nˈadˈɑʃt
 139 | او اَزْ صَمیمْ قَلْبْ عاشِقْ کُرْسِتَنْ اَسْتْ  | ˈuː az sˈamim q1ˈalb ˈɑʃeq1 korsˈetan ˈast
 140 | وَ بِ هَمانْ اَنْدازِ  | vˈa beː hamˈɑn ˈaːndˈɑzeː
 141 | اَزْ تَنْها بودَنْ مُتِنَفِّرْ  | az tˈanhɑ bˈuːdan mˌotenˈaffer
 142 | تا حَدّ شَرْمْ آوَری  | tɑː hˈadd ʃˈarm ˈɑvarˌi
 143 | جَذّابیَتْ اِزْدِواجْ خُلاصِ میشَوَدْ  | dʒˌazzɑbˈiːjat ezdˈevɑdʒ xolˈɑseː miʃavˈad
 144 | دَرْ ناخوْشایَنْدْ بودَنْ تَنْهایی  | dˈar nɑxˈoʃɑjˌand bˈuːdan tanhˈɑiː
 145 | لُزومَاْ تَقْصیرْ شَخْصْ ما نیسْتْ  | lozˈuman tˈaq1sir ʃˈaxs mɑ nˈist
 146 | ظاهِرَاْ کُلْ جامِعِ  | zɑhˈeran kˈol dʒˈɑmeʔˈeː
 147 | مُصَمّمْ اَسْتْ تَجَرُّدْ را تا حَدّ مُمْکِنْ  | mosˈammam ˈast tadʒˈarrod rɑ tɑː hˈadd mˈomken
 148 | رَنْجْ آوَرْ وَ یاسْ آوَرْ جِلْوِ دَهَدْ  | rˈandʒ ˈɑvar vˈa jˈɑs ˈɑvar dʒˈelveː dˈahad
 149 | بِ مَحْضْ اینْکِ  | beː mˈahz ˈinkeː
 150 | دوْرانْ بی قِیْدْ وَ بَنْدی مَدْرِسِ وَ دانِشْگاهْ تَمامْ می‌شَوَدْ  | dˈoːrɑn bi q1ˈejd vˈa bˈandi madrˈese vˈa dˈɑneʃɡˈɑh tˈamɑm miʃavˈad
 151 | پِیْدا کَرْدَنْ هَمْدَمْ وَ صَمیمیَتْ  | pˈejdɑ kˈardan hˈamdam vˈa sˌamimˈiːjat
 152 | بِ طَرْزْ دِلْسَرْدْ کُنَنْدِ ای سَخْتْ می‌شَوَدْ  | beː tˈarz delsˈard konˈandeː iː sˈaxt miʃavˈad
 153 | زِنْدِگی اِجْتِماعی  | zˈendeɡˌi ˌedʒtemˈɑʔˈi
 154 | ظالِمانِ هوْلْ مِحْوَرْ زوْجْ ها میچَرْخَدْ  | zˈɑlemˌɑneː hˈoːl mˈehvar zˈoːdʒ hɑ mitʃˈarxad
 155 | دیگَرْ کَسی نِمی مانْدْ کِ بِ او زَنْگْ بِزَنیمْ  | dˈiɡar kˈasi nˌemi mˈɑnd kˈeː beː ˈuː zˈanɡ bezˈanim
 156 | یا با هَمْ بیرونْ بِرَویمْ  | jɑː bɑ hˈam bˈiruːn berˈavim
 157 | پَسْ چَنْدانْ تَعَجُّبی نَدارَدْ  | pˈas tʃˈandɑn tˌaʔadʒdʒˈobi nˈadɑrˌad
 158 | کِ اَگَرْ کَسی را بیابیمْ کِ اَنْدَکی مَعْقولْ باشَدْ  | kˈeː ˌaɡˈar kˈasi rɑ biˈɑbim kˈeː andˌaki mˈaʔq1uːl bˈɑʃad
 159 | دوْ دَسْتی بِ او بِچَسْبیمْ  | dˈo dˈasti beː ˈuː betʃˈasbim
 160 | دَرْ زَمانْهایِ قَدیمْ  | dˈar zamˈɑnhˈɑje q1ˈadim
 161 | وَقْتی اِنْسان‌ها دَرْ عالَمْ نَظَرْ  | vˈaq1ti ensˈɑnhɑ dˈar ˈɑlam nˈazar
 162 | فَقَطْ بَعْدْ اَزْ اِزْدِواجْ میتَوانِسْتَنْدْ هَمْ آغوشی کُنَنْدْ  | fˈaq1at bˈaʔd az ezdˈevɑdʒ mitˈavɑnˌestand hˈam ˈɑq1uːʃˌi kˈonand
 163 | شاهِدانْ خِرَدْمَنْدْ میدانِسْتَنْدْ  | ʃɑhˈedɑn xerˈadmand midɑnˈestand
 164 | کِ مُمْکِنْ اَسْتْ کَسی  | kˈeː mˈomken ˈast kˈasi
 165 | بِ دَلایِلْ غَلَطْ  | beː dalˈɑjel q1ˈalat
 166 | وَسْوَسِ شَوَدْ اِزْدِواجْ کُنَدْ  | vasvˈaseː ʃavˈad ezdˈevɑdʒ kˈonad
 167 | وَ اِعْتِقادْ داشْتَنْدْ  | vˈa ˌeʔteq1ˈɑd dˈɑʃtand
 168 | کِ تابوْ هایِ موْجودْ راجِعْ بِ هَمْ آغوشی قَبْلْ اَزْ اِزْدِواجْ  | kˈeː tˈɑbo hˈɑje mˈodʒuːd rˈɑdʒeʔ beː hˈam ˈɑq1uːʃˌi q1ˈabl az ezdˈevɑdʒ
 169 | بایَدْ اَزْ بِیْنْ بِرَوَدْ  | bˈɑjad az bˈejn berˈavad
 170 | تا جَوانانْ  | tɑː dʒavˈɑnɑn
 171 | با آرامِشْ بیشْتَرْ  | bɑ ɑrˈɑmeʃ bˈiʃtar
 172 | وَ فارِغْ اَزْ هَوا وَ هَوَسْ تَصْمیمْ بِگیرَنْدْ  | vˈa fˈɑreq1 az hˈavɑ vˈa hˈavas tˈasmim beɡˈirand
 173 | اَمّا اَگَرْ آنْ مانِعْ خاصْ  | ˈammˌɑ ˌaɡˈar ɑn mˈɑneʔ xˈɑs
 174 | اَزْ سَرْ راهْ تَصْمیمْ گیری دُرُسْتْ  | az sˈar rˈɑh tˈasmim ɡˈiri dˈorost
 175 | کِنارْ رَفْتِ باشَدْ  | kenˈɑːr rˈafteː bˈɑʃad
 176 | بِ نَظَرْ می‌رِسَدْ  | beː nˈazar mirˈesad
 177 | عَطَشْ دیگَری جایْگُزینْ آنْ شُدِ اَسْتْ  | ˈataʃ dˈiɡarˌi dʒɑjɡˈozin ɑn ʃˈodeː ˈast
 178 | تَأْثیرْ تَمَنّایِ داشْتَنْ هَمْدَمْ  | tˈaʔsir tˌamannˈɑje dˈɑʃtan hˈamdam
 179 | ضَعیفْ تَرْ  | zˈaʔif tˈar
 180 | یا نامُعْتَبَرْ تَرْ اَزْ اَنْگیزه‌هایِ سابِقْ جِنْسی نیسْتْ  | jɑː nɑmˈoʔtabˌar tar az ˈaːnɡizˌeːhˈɑje sˈɑbeq1 dʒˈensi nˈist
 181 | گُذَرانْدَنْ پَنْجاهْ وَ دوْ آخَرْ هَفْتِ تَمامْ دَرْ تَنْهایی  | ɡˌozarˈɑndan pandʒˈɑh vˈa dˈo ˈɑxar hˈafteː tˈamɑm dˈar tanhˈɑiː
 182 | مُمْکِنْ اَسْتْ مَصْلَحَتْ اَنْدیشی فَرْدْ را  | mˈomken ˈast maslˈahat andˈiʃi fˈard rˈɑ
 183 | بِ کُلّی نابودْ کُنَدْ  | beː kollˈi nɑbˈuːd kˈonad
 184 | تَنْهایی می‌تَوانَدْ  | tanhˈɑiː mitavˈɑnad
 185 | موْجِبْ شِتابی دَرْدِسَرْ سازْ  | mˈodʒeb ʃetˈɑbi dardˈesar sˈɑz
 186 | بِسویِ هَمْسَری مُحْتَمِلْ  | besˈuje hamsˈari mohtˈamel
 187 | وَ سَرْکوبْ هَرْ گونِ شَکْ وَ تَرْدیدْ راجِعْ بِ او شَوَدْ  | vˈa sarkˈuːb har ɡˈuneː ʃˈak vˈa tˈardid rˈɑdʒeʔ beː ˈuː ʃavˈad
 188 | موَفَّقیَتْ هَرْ رابِطِ‌ای را  | mˌovaffaq1ˈiːjat har rˈɑbetˌeːiː rˈɑ
 189 | نَبایَدْ فَقَطْ اَزْ رویِ میزانْ شادْ بودَنْ یِکْ زوْجْ  | nˈabˈɑjad fˈaq1at az rˈuje mˈizɑn ʃˈɑd bˈuːdan jˈek zˈoːdʒ
 190 | اَزْ باهَمْ بودَنْ تَعییْنْ کَرْدْ  | az bˈɑham bˈuːdan tˈaʔiːn kˈard
 191 | بَلْکِ بایَدْ دیدْ هَرْ کُدامْ چِ قَدْرْ مُمْکِنْ اَسْتْ  | bˈalkeː bˈɑjad dˈid har kˈodɑm tʃeː q1ˈadr mˈomken ˈast
 192 | اَزْ اینْکِ کُلَّاْ با کَسی رابِطِ نَداشْتِ باشَدْ  | az ˈinkeː kˈollan bɑ kˈasi rˈɑbetˌeː nˈadˈɑʃteː bˈɑʃad
 193 | نِگَرانْ شَوَدْ  | neɡˈarɑn ʃavˈad
 194 | او  | ˈuː
 195 | با اِعْتِمادْ بِ نَفَسْ وَ اِطْمینانْ  | bɑ eʔtˈemɑd beː nˈafas vˈa etmˈinɑn
 196 | دَرْخواسْتْ اِزْدِواجْ را مَطْرَحْ می‌کُنَدْ  | dˈarxɑst ezdˈevɑdʒ rɑ mˈatrah mikˈonad
 197 | چوْنْ خوْدَشْ را  | tʃˈon xˌodaʃ rˈɑ
 198 | اِنْسانْ صافْ وَ سادِ ای دَرْ زِنْدِگی می‌دانَدْ  | ensˈɑn sˈɑf vˈa sˈɑdeː iː dˈar zˈendeɡˌi midˈɑnad
 199 | اینْ نیزْ یِکی دیگَرْ اَزْ پَیامَدْهایِ فَریبَنْدِ ضِمْنی  | iːn nˈiz jˈeki dˈiɡar az pˌajɑmadhˈɑje fˌaribˈande zˈemni
 200 | ناشی اَزْ تَنْهایی طولانی مُدَّتْ اَسْتْ  | nˈɑʃi az tanhˈɑiː tuːlˈɑni mˌoddˈat ˈast
 201 | دَرْ تَجَرُّدْ  | dˈar tadʒˈarrod
 202 | مَعْمولَاْ شَخْصْ بِ اِشْتِباهْ  | maʔmˈulan ʃˈaxs beː eʃtˈebɑh
 203 | تَصْویری بِهَنْجارْ اَزْ خوْدْ  | tasvˈiri behˈandʒɑr az xˈod
 204 | دَرْ ذِهْنْ میپَرْوَرانْدْ  | dˈar zˈehn miparvˈarɑnd
 205 | تَمایُلْ رَبیعْ  | tamˈɑjol rˈabiʔ
 206 | بِ مُرَتَّبْ کَرْدَنْ وَسْواسْ گونِ اَطْرافَشْ  | beː morˈattab kˈardan vasvˈɑs ɡˈuneː ˈaːtrˈɑfaʃ
 207 | دَرْ مَواقِعی کِ اَزْ دَرونْ آشُفْتِ اَسْتْ  | dˈar mavˈɑq1eʔˌi kˈeː az dˈarun ɑʃˈofteː ˈast
 208 | عادَتْ پَناهْ بُرْدَنْ بِ کارْ  | ˈɑdat panˈɑh bˈordan beː kˈɑr
 209 | بَرایِ اَزْ بِیْنْ بُرْدَنْ اِضْطِرابْ  | barˈɑje az bˈejn bˈordan eztˈerɑb
 210 | دَرْمانْدِگی او  | darmɑndˈeɡi ˈuː
 211 | دَرْ بِ زَبانْ آوَرْدَنْ ذِهْنیاتَشْ  | dˈar beː zabˈɑn ɑvˈardan zˌehniˈɑtaʃ
 212 | دَرْ مَواقِعْ نِگَرانی  | dˈar mavˈɑq1eʔ nˌeɡarˈɑni
 213 | عَصَبانیَتْ اَشْ  | ˌasabɑnˈijjat ˈaʃ
 214 | اَزْ پِیْدا نَکَرْدَنْ تی شُرْتْ مَحْبوبْ اَشْ  | az pˈejdɑ nakˈardan tˈi ʃˈort mˈahbuːb ˈaʃ
 215 | تَمامْ اینْ رَفْتارْهایِ غِیْرْ عادی  | tˈamɑm iːn raftˈɑrhˈɑje q1ˈejr ˈɑdi
 216 | کامِلَاْ پِنْهانْ می‌مانَنْدْ  | kɑmˈelan pˈenhɑn mimˈɑnand
 217 | اَلْبَتِّ تا زَمانی  | albˈatteː tɑː zamˈɑni
 218 | کِ کَسْ دیگَری اَطْرافَشْ نیسْتْ تا او را بِبینَدْ  | kˈeː kˈas dˈiɡarˌi ˈaːtrˈɑfaʃ nˈist tɑː ˈuː rɑ bebinad
 219 | چِ بِرِسَدْ بِ اینْکِ  | tʃeː berˈesad beː ˈinkeː
