 220 | جَنْجالْ بِ پا کُنَدْ  | dʒandʒˈɑl beː pˈɑ kˈonad
 221 | اَزْ او بِخواهَدْ بیایَدْ وَ شامَشْ را بِخوْرْدْ  | az ˈuː bexˈɑhad bijˈɑjad vˈa ʃˈɑmaʃ rɑ bexˈord
 222 | راجِعْ بِ عادَتْ تَمیزْ کَرْدَنْ کُنْتُرُلْ تِلْویزیوْنْ  | rˈɑdʒeʔ beː ˈɑdat tˈamiz kˈardan kˈontorˌol tˌelvizˈijon
 223 | اَزْ او ایرادْ بِگیرَدْ  | az ˈuː iːrˈɑd beɡˈirad
 224 | یا اَزْ او بِخواهَدْ توْضیحْ دَهَدْ  | jɑː az ˈuː bexˈɑhad tˈozih dˈahad
 225 | کِ چِ چیزی آزُرْدِ اَشْ کَرْدِ اَسْتْ  | kˈeː tʃeː tʃˈizi ɑzˈordeː aʃ kˈardeː ˈast
 226 | بِدونْ حُضورْ شاهِدْ  | bedˈuːn hˈozuːr ʃˈɑhed
 227 | می‌تَوانَدْ با اینْ خوْشْ خیالی سَرْ کُنَدْ  | mitavˈɑnad bɑ iːn xˈoʃ xiˈɑli sˈar kˈonad
 228 | کِ اَگَرْ طَرَفَشْ شَخْصْ مُناسِبی باشَدْ  | kˈeː ˌaɡˈar tarˈafaʃ ʃˈaxs mˌonɑsˈebi bˈɑʃad
 229 | خوْدَشْ مُشْکِلْ خاصی نَخواهَدْ داشْتْ  | xˌodaʃ mˈoʃkel xˈɑsi nˈaxɑhˌad dˈɑʃt
 230 | چَنْدْ قَرْنْ بَعْدْ  | tʃˈand q1ˈarn bˈaʔd
 231 | اینْ تَفَکُّرْ کِ سِنِمانْ ایجابْ می‌کُنَدْ اِزْدِواجْ کُنیمْ  | iːn tafˈakkor kˈeː senˈemɑn iːdʒˈɑb mikˈonad ezdˈevɑdʒ kˈonim
 232 | بِ نَظَرْ عَجیبْ خواهَدْ آمَدْ  | beː nˈazar ˈaːdʒib xˈɑhad ˈɑmad
 233 | اَگَرْ کُلَّاْ بِ دورْ اَزْ تَمَدُّنْ بِ حِسابْ نَیایَدْ  | ˌaɡˈar kˈollan beː dˈuːr az tamˈaddon beː hˈesɑb najˈɑjad
 234 | تا آنْ زَمانْ سوالْ اِسْتانْدارْدْ کامِلَاْ بی طَرَفانِ ای  | tɑː ɑn zamˈɑn sˈoɑl estˈɑndɑrd kɑmˈelan bi tˌarafˈɑneː ˈiː
 235 | کِ هَرْکَسی بایَدْ  | kˈeː harkˈasi bˈɑjad
 236 | پاسُخی مُدارا گِرانِ رُئوفانِ  | pɑsˈoxi modˈɑrɑ ɡerˈɑneː rˌoʔuːfˈɑneː
 237 | وَ غِیْرْ  | vˈa q1ˈejr
 238 | تَدافُعی بَرایَشْ داشْتِ باشَدْ  | tadˈɑfoʔˌi barˈɑjaʃ dˈɑʃteː bˈɑʃad
 239 | وَ حَتّی بَرایِ اَوَّلینْ مُلاقاتْ هَمْ مُناسِبْ اَسْتْ  | vˈa hˌattˈɑ barˈɑje avvˈalin molˈɑq1ɑt hˈam monˈɑseb ˈast
 240 | صِرْفَاْ اینْ سوالْ خواهَدْ بودْ  | sˈerfan iːn sˈoɑl xˈɑhad bˈuːd
 241 | شُما چِطوْرْ عَصَبانی می‌شَویدْ  | ʃˈomɑ tʃˈetor ˌasabˈɑni miʃˈavid
 242 | کُرْسِتَنْ بِ رَبیعْ می‌گویَدْ  | korsˈetan beː rˈabiʔ miɡˈujad
 243 | کِ دَرْ نوْجَوانی شادْ نَبودِ  | kˈeː dˈar nˌoːdʒavˈɑni ʃˈɑd nˈabuːdˌeː
 244 | نِمی‌تَوانِسْتِ با دیگَرانْ اِرْتِباطْ بَرْقَرارْ کُنَدْ  | nˌemitˈavɑnˌesteː bɑ diɡˈarɑn ˌertebˈɑt barq1arˈɑr kˈonad
 245 | وَ بِ مَرْحَلِ ای رِسیدِ  | vˈa beː marhˈaleː iː rˈesidˌeː
 246 | کِ بِ خوْدَشْ آسیبْ میرِسانْدِ  | kˈeː beː xˌodaʃ ˈɑsib miresˈɑnde
 247 | او می‌گویَدْ  | ˈuː miɡˈujad
 248 | آنْقَدْرْ دَسْتَشْ را می‌خارانْدِ تا خونْ بیایَدْ  | ˈɑnq1adr dˈastaʃ rɑ mixˈɑrˈɑndeː tɑː xˈuːn bijˈɑjad
 249 | وَ اینْ کارْ تَنْها آرامْ بَخْشی بودِ  | vˈa iːn kˈɑr tˈanhɑ ˈɑrˈɑm bˈaxʃi bˈuːdeː
 250 | کِ می‌تَوانِسْتِ بیابَدْ  | kˈeː mitˈavɑnˌesteː biˈɑbad
 251 | اینْ اِقْرارْ او بَرایِ رَبیعْ تِکانْ دَهَنْدِ اَسْتْ  | iːn ˈeq1rɑr ˈuː barˈɑje rˈabiʔ tˈekɑn dahˈandeː ˈast
 252 | اَمّا قَضیِ اَزْ اینْ فَراتَرْ اَسْتْ  | ˈammˌɑ q1azˈije az iːn farˈɑtar ˈast
 253 | رَبیعْ قَطْعَاْ  | rˈabiʔ q1atʔˈan
 254 | بِ خاطِرْ مُشْکِلاتْ کُرْسِتَنْ اَسْتْ کِ بِ سَمْتَشْ کِشیدِ شُدِ  | beː xˈɑter mˈoʃkelˌɑt korsˈetan ˈast kˈeː beː sˈamtaʃ keʃˈideː ʃˈodeː
 255 | او کُرْسِتَنْ را  | ˈuː korsˈetan rˈɑ
 256 | گُزینِ خوبی بَرایِ اِزْدِواجْ می‌دانَدْ  | ɡozˈineː xˈuːbi barˈɑje ezdˈevɑdʒ midˈɑnad
 257 | زیرا بِ اَفْرادی کِ هَمیشِ  | zirˈɑ beː ˈaːfrˈɑdi kˈeː hamˈiʃeː
 258 | زِنْدِگی بَرْ وِفْقْ مُرادْ نِشانْ بودِ  | zˈendeɡˌi bar vˈefq1 mˈorɑd nˈeʃɑn bˈuːdeː
 259 | سوءِ ظَنْ دارَدْ  | sˈuʔe zˈan dˈɑrad
 260 | او دَرْ جَمْعْ اَفْرادْ شادْ وَ پُرْ شورْ  | ˈuː dˈar dʒˈamʔ ˈaːfrˈɑd ʃˈɑd vˈa pˈor ʃˈuːr
 261 | مُنْزَوی می‌شَوَدْ  | monzˈavi miʃavˈad
 262 | وَ اِحْساسْ قُدْرَتْ می‌کُنَدْ  | vˈa ˈehsɑs q1odrˈat mikˈonad
 263 | اَزْ آدَمْهایِ بی غَمْ شَدیدَاْ بیزارْ اَسْتْ  | az ˌɑdamhˈɑje bi q1ˈam ʃadˈidan bˌizɑr ˈast
 264 | دَرْ گُذَشْتِ خانُمْ هایی را کِ مُلاقاتْ می‌کَرْدِ  | dˈar ɡozˈaʃteː xˈɑnom hˈɑiː rɑ kˈeː molˈɑq1ɑt mikˈardeː
 265 | کِسِلْ کُنَنْدِ توْصیفْ می‌کَرْدِ  | kˈesel konˈandeː tˈosif mikˈardeː
 266 | دَرْصورَتی کِ اِحْتِمالَاْ  | darsurˈati kˈeː ˌehtemˈɑlan
 267 | هَرْ کَسْ دیگَری آنْها را با بُلَنْدْ نَظَری بیشْتَرْ میدیدِ  | har kˈas dˈiɡarˌi ˌɑnhɑ rɑ bɑ bˈoland nˈazarˌi bˈiʃtar midˈideː
 268 | بِ دُرُسْتی سالِمْ می دانِسْتِ  | beː dorˈosti sˈɑlem mi dɑnˈesteː
 269 | رَبیعْ با دَرْ نَظَرْ گِرِفْتَنْ تَروما بِ عُنْوانْ راهْ اَصْلی رُشْدْ کَرْدَنْ وَ عَمیقْ شُدَنْ  | rˈabiʔ bɑ dˈar nˈazar ɡerˈeftan tˌaruːmˈɑ beː ˈonvɑn rˈɑh ˈaːsli rˈoʃd kˈardan vˈa ˈaːmiq1 ʃˈodan
 270 | می‌خواهَدْ بَرایِ اَنْدوهْ خوْدَشْ  | mixˈɑhad barˈɑje ˈaːnduːh xˈodaʃ
 271 | دَرْ شَخْصیَتْ شَریکْ زِنْدِگی اَشْ نیزْ  | dˈar ʃaxsˈiːjat ʃˈarik zˈendeɡˌi aʃ nˈiz
 272 | بازْتابی پِیْدا کُنَدْ  | bɑztˈɑbi pˈejdɑ kˈonad
 273 | توْضیحْ پا وَرَقی  | tˈozih pˈɑ varˈaq1i
 274 | تَروما  | tˌaruːmˈɑ
 275 | رَوانْ گَزیدِگی  | ravˈɑn ɡˌazidˈeɡi
 276 | آسیبْ رَوانی  | ˈɑsib ravˈɑni
 277 | اِدامِ مَتْنْ  | edˈɑmeː mˈatn
 278 | بَنابَراینْ  | bˌanɑbˈarin
 279 | اَصْلَاْ بَرایِ او مُهِمْ نیسْتْ کِ کُرْسِتَنْ  | ˈaslan barˈɑje ˈuː mˈohem nˈist kˈeː korsˈetan
 280 | گاهی دَرْ خوْدَشْ فُرو می‌رَوَدْ  | ɡˈɑhi dˈar xˌodaʃ fˈoru mirˈavad
 281 | وَ سَخْتْ می‌تَوانْ بِ اَفْکارَشْ پِیْ بُرْدْ  | vˈa sˈaxt mitˈavɑn beː ˈaːfkɑrˌaʃ pˈej bˈord
 282 | یا اینْکِ مَعْمولَاْ بَعْدْ اَزْ مُشاجِرِ  | jɑː ˈinkeː maʔmˈulan bˈaʔd az mˌoʃɑdʒˈereː
 283 | شَدیدَاْ مُنْزَوی می‌شَوَدْ  | ʃadˈidan monzˈavi miʃavˈad
 284 | وَ حالَتْ تَدافُعی بِ خوْدْ می‌گیرَدْ  | vˈa hˈɑlat tadˈɑfoʔˌi beː xod miɡˈirad
 285 | او دَرْ خیالْ خوْدَشْ  | ˈuː dˈar xiˈɑl xˈodaʃ
 286 | سَراسیمِ می‌خواهَدْ بِ کُرْسِتَنْ کُمَکْ کُنَدْ  | sarˈɑsimˌeː mixˈɑhad beː korsˈetan kˈomak kˈonad
 287 | بِدونْ اینْکِ بِدانَدْ  | bedˈuːn ˈinkeː bedˈɑnad
 288 | کُمَکْ کَرْدَنْ مُمْکِنْ اَسْتْ  | kˈomak kˈardan mˈomken ˈast
 289 | بَرایِ آنْهایی کِ کَمْتَرْ نیازْمَنْدْ آنْ هَسْتَنْدْ  | barˈɑje ɑnhˌɑiː kˈeː kˈamtar nijˈɑzmand ɑn hˈastand
 290 | هِدیِ‌ای آزارْدَهَنْدِ باشَدْ  | hedˈijeiː ˈɑzˈɑrdahˌandeː bˈɑʃad
 291 | او  | ˈuː
 292 | آسیبْ هایِ کُرْسِتَنْ را  | ˈɑsib hˈɑje korsˈetan rˈɑ
 293 | بِ بَدیهی تَرینْ  | beː badˈihi tˈarin
 294 | وَ شاعِرانِ تَرینْ شِکْلْ مُمْکِنْ تَعْبیرْ می‌کُنَدْ  | vˈa ʃˈɑʔerˌɑneː tˈarin ʃˈekl mˈomken tˈaʔbir mikˈonad
 295 | بِ عُنْوانْ فُرْصَتی بَرایِ او  | beː ˈonvɑn forsˈati barˈɑje ˈuː
 296 | تا نَقْشْ مُفیدی ایفا کُنَدْ  | tɑː nˈaq1ʃ mofˈidi iːfˈɑ kˈonad
 297 | ما مُعْتَقِدیمْ  | mɑ mˌoʔtaq1ˈedim
 298 | دَرْ عِشْقْ بِ دُنْبالْ شادی هَسْتیمْ  | dˈar ˈeːʃq1 beː dˈonbɑl ʃˈɑdi hˈastim
 299 | اَمّا آنْچِ حَقیقَتَاْ دَرْ پِیْ اَشْ هَسْتیمْ  | ˈammˌɑ ˌɑntʃe hˌaq1iq1ˈatan dˈar pˈej aʃ hˈastim
 300 | آشْنایی اَسْتْ  | ˈɑʃnˈɑiː ˈast
 301 | بِ دُنْبالْ اینْ هَسْتیمْ کِ دَرْ رَوابِطْ بُزُرْگْسالی مانْ  | beː dˈonbɑl iːn hˈastim kˈeː dˈar ravˈɑbet bozorɡsˈɑli mˈɑn
 302 | هَمانْ اِحْساساتی را بازْسازی کُنیمْ  | hamˈɑn ˌehsɑsˈɑti rɑ bɑzsˈɑzi kˈonim
 303 | کِ دَرْ کودَکی خوبْ میشِناخْتیمْ  | kˈeː dˈar kuːdˈaki xˈuːb miʃenˈɑxtim
 304 | وَ اَغْلَبْ تَنْها بِ مِهْرْبانی وَ تَوَجُّهْ مَحْدودْ نِمیشُدَنْدْ  | vˈa ˈaːq1lab tˈanhɑ beː meːhrbˈɑni vˈa tˈavadʒdʒˌoh mˈahdud nˈemiʃˌodand
 305 | عِشْقی کِ اَکْثَرْ ما  | ˈeːʃq1i kˈeː ˈaːksar mˈɑ
 306 | دَرْ آیَنْدِ ای نَزْدیکْ تَجْرُبِ می‌کَرْدیمْ  | dˈar ɑjˈandeː iː nˈazdik tadʒrˈobe mikˈardim
 307 | هَمْراهْ بودْ با دیگَرْ نیروهایِ مُخَرِّبْ تَرْ  | hamrˈɑh bˈuːd bɑ dˈiɡar nˌiruːhˈɑje moxˈarreb tˈar
 308 | اِحْساسْ تَمایُلْ  | ˈehsɑs tamˈɑjol
 309 | بِ کُمَکْ کَرْدَنْ بِ فَرْدْ بُزُرْگْسالْ  | beː kˈomak kˈardan beː fˈard bozˈorɡsɑl
 310 | کِ خارِجْ اَزْ کُنْتُرُلْ بودِ  | kˈeː xˈɑredʒ az kˈontorˌol bˈuːdeː
 311 | اِحْساسْ مَحْرومْ بودَنْ  | ˈehsɑs mˈahruːm bˈuːdan
 312 | اَزْ مُحَبَّتْ والِدِیْنْ  | az mohˈabbat vɑlˈedejn
 313 | یا تَرْسْ اَزْ عَصَبانیَتْ آنْها  | jɑː tˈars az ˌasabɑnˈijjat ˈɑnhɑ
 314 | یا اِحْساسْ نا اَمْنی  | jɑː ˈehsɑs nɑ ˈaːmni
 315 | بَرایِ بَیانْ خواسْتِ هایِ پیچیدِ تَرْ مانْ  | barˈɑje bˈajɑn xˈɑsteː hˈɑje pitʃˈideː tar mˈɑn
 316 | آنْ زَمانْ مَنْطِقی بودْ  | ɑn zamˈɑn mantˈeq1i bˈuːd
 317 | کِ بِ عُنْوانْ اَفْرادْ بالِغْ  | kˈeː beː ˈonvɑn ˈaːfrˈɑd bˈɑleq1
 318 | بَرْخی گُزینِ هایِ خاصْ را نَپَذیریمْ  | bˈarxi ɡozˈineː hˈɑje xˈɑs rɑ nˈapazˌirim
 319 | نه اینْ خاطِرْ کِ اَفْرادْ نامُناسِبی بودَنْدْ  | nˈa iːn xˈɑter kˈeː ˈaːfrˈɑd nɑmˈonɑsˌebi bˈuːdand
 320 | بَلْکِ بِ اینْ دَلیلْ  | bˈalkeː beː iːn dˈalil
 321 | کِ کَمی زیادی خوبْ بودَنْدْ  | kˈeː kˈami ziˈɑdi xˈuːb bˈuːdand
 322 | اَزْ اینْ لَحاظْ کِ شَدیدَاْ مُتِعادِلْ  | az iːn lahˈɑz kˈeː ʃadˈidan mˌoteʔˈɑdel
 323 | عاقِلْ فَهْمیدِ  | ˈɑq1el fahmˈideː
 324 | وَ مُعْتَمِدْ بِ نَظَرْ میرِسیدَنْدْ  | vˈa moʔtˈamed beː nˈazar mirˈesidˌand
 325 | وَ نَزْدْ ما  | vˈa nˈazd mˈɑ
 326 | اینْ چِنینْ خوبْ بودَنْ عَجیبْ اَسْتْ  | iːn tʃˈenin xˈuːb bˈuːdan ˈaːdʒib ˈast
 327 | وَ دورْ اَزْ اِسْتِحْقاقْ ما  | vˈa dˈuːr az ˌestehq1ˈɑq1 mˈɑ
 328 | ما بِ دُنْبالْ اَفْرادْ هَیَجانْ اَنْگیزْ دیگَری می‌کَرْدیمْ  | mɑ beː dˈonbɑl ˈaːfrˈɑd hajˈadʒɑn ˈaːnɡiz dˈiɡarˌi mikˈardim
 329 | نه با اینْ باوَرْ  | nˈa bɑ iːn bˈɑvar
 330 | کِ زِنْدِگی با آنْها  | kˈeː zˈendeɡˌi bɑ ˈɑnhɑ
 331 | موْزونْ تَرْ خواهَدْ بودْ  | mˈoːzuːn tar xˈɑhad bˈuːd
 332 | بَلْکِ اَزْ رویِ حِسی نا خوْدآگاهْ کِ می‌گویَدْ  | bˈalkeː az rˈuje hˈesi nɑ xodˌɑɡɑh kˈeː miɡˈujad
 333 | مُطْمَئِنَّاْ شِکْلْ ناکامی‌هایِ آنْ زِنْدِگی  | mˌotmaʔˈennan ʃˈekl nɑkˈɑmihˈɑje ɑn zˈendeɡˌi
 334 | آشْنا خواهَدْ بودْ  | ˈɑʃnˈɑ xˈɑhad bˈuːd
 335 | رَبیعْ اَزْ کُرْسِتَنْ می‌خواهَدْ با او اِزْدِواجْ کُنَدْ  | rˈabiʔ az korsˈetan mixˈɑhad bɑ ˈuː ezdˈevɑdʒ kˈonad
 336 | تا اَزْ دَسْتْ اَفْکارْ ویرانْگَرْ یِ  | tɑː az dˈast ˈaːfkɑr virˈɑnɡar jˈeː
 337 | کِ راجِعْ بِ رَوابِطَشْ دَرْ سَرْ میپَرْوَرانْدْ  | kˈeː rˈɑdʒeʔ beː rˌavɑbˈetaʃ dˈar sˈar miparvˈarɑnd
 338 | وَ مُدَّتْها اَسْتْ روحْ وَ رَوانْ او را  | vˈa mˌoddˈathɑ ˈast rˈuːh vˈa ravˈɑn ˈuː rˈɑ
 339 | دَرْ تَسَلُّطْ خوْدْ گِرِفْتِ خَلاصْ شَوَدْ  | dˈar tasˈallot xod ɡerˈefteː xalˈɑs ʃavˈad
 340 | او اَزْ اینْ هِفْدَهْ سالی کِ می‌شَوَدْ اَزْ آنْ فیلْمْ ساخْتْ  | ˈuː az iːn hˈefdah sˈɑli kˈeː miʃavˈad az ɑn fˈilm sˈɑxt
 341 | وَ اَزْ هَیَجاناتی کِ بِ جایی نَرِسیدَنْدْ خَسْتِ شُدِ  | vˈa az hˌajadʒɑnˈɑti kˈeː beː dʒˌɑiː nˌaresˈidand xˈasteː ʃˈodeː
 342 | حالا سی وَ دوْ سالَشْ اَسْتْ  | hˈɑlɑ sˈi vˈa dˈo sˈɑlaʃ ˈast
 343 | وَ تابْ چالِش‌هایِ دیگَرْ را نَدارَدْ  | vˈa tˈɑb tʃˈɑleʃhˈɑje dˈiɡar rɑ nˈadɑrˌad
 344 | اینْکِ رَبیعْ  | ˈinkeː rˈabiʔ
 345 | عِشْقْ عَمیقْ بِ کُرْسِتَنْ اِحْساسْ می‌کُنَدْ  | ˈeːʃq1 ˈaːmiq1 beː korsˈetan ˈehsɑs mikˈonad
 346 | وَ دَرْ عِیْنْ حالْ آرِزو می‌کُنَدْ  | vˈa dˈar ˈejn hˈɑl ˈɑrezˌu mikˈonad
 347 | اِزْدِواجْ باِلاَخَرِ  | ezdˈevɑdʒ bˌelaxˈareː
 348 | بِ سُلْطِ اَغْلَبْ دَرْدْناکْ عِشْقْ بَرْ زِنْدِگی او پایانْ دَهَدْ  | beː sˈolteː ˈaːq1lab dˈardnɑk ˈeːʃq1 bar zˈendeɡˌi ˈuː pˈɑjɑn dˈahad
 349 | نه نِشانْ اَزْ بَدْگُمانی او دارَدْ  | nˈa nˈeʃɑn az bˌadɡomˈɑni ˈuː dˈɑrad
 350 | وَ نه سَنْگْدِلی  | vˈa nˈa sanɡdˈeli
 351 | راجِعْ بِ کُرْسِتَنْ  | rˈɑdʒeʔ beː korsˈetan
 352 | چوْنْ ما اَغْلَبْ بِ ذِهْنْ رَبیعْ سَفَرْ می‌کُنیمْ  | tʃˈon mɑ ˈaːq1lab beː zˈehn rˈabiʔ sˈafar mikˈonim
 353 | هَمینْ بَسْ  | hˈamin bˈas
 354 | کِ نَبایَدْ  | kˈeː nˈabˈɑjad
 355 | مِیْلْ بِ شَخْصی را  | mˈeːjl beː ʃˈaxsi rˈɑ
 356 | کِ اَغْلَبْ با اَنْدوهْ راجِعْ بِ چیزْهایِ بِسْیاری  | kˈeː ˈaːq1lab bɑ ˈaːnduːh rˈɑdʒeʔ beː tʃizhˈɑje besjˈɑri
 357 | بِجُزْ کُرْسِتَنْ تَرْدیدْ کَرْدِ  | bˈedʒoz korsˈetan tˈardid kˈardeː
 358 | دَسْتْ کَمْ گِرِفْتْ  | dˈast kˈam ɡˈereft
 359 | هَمْچِنینْ دَرْخواسْتْ اِزْدِواجْ اَزْ سویْ شَخْصی بِسیارْ مِهْرْبانْ وَ جَذّابْ  | hamtʃˈenin dˈarxɑst ezdˈevɑdʒ az sˈuːj ʃˈaxsi besˈijɑr mˈeːhrbɑn vˈa dʒˈazzɑb
 360 | کِ ظاهِرَاْ مَسْرانِ وَ بِ صِراحَتْ  | kˈeː zɑhˈeran masrˈɑneː vˈa beː serˈɑhat
 361 | مُعْتَقِدْ اَسْتْ کُرْسِتَنْ بَرایِ مُناسِبْ او اَسْتْ  | moʔtˈaq1ed ˈast korsˈetan barˈɑje monˈɑseb ˈuː ˈast
 362 | آنْها  | ˈɑnhɑ
 363 | دَرْ یِکْ صُبْحْ بارانی ماهْ نوامْبْرْ  | dˈar jˈek sˈobh bˈɑrɑnˌi mˈɑh nˈovɑmbr
 364 | دَرْ اُتاقی گُلْبِی رَنْگْ  | dˈar otˈɑːq1i ɡolbˌeːi rˈanɡ
 365 | واقِعْ دَرْ دَفْتَرْ خانِ ای دَرْ اینورْنَسْ  | vˈɑq1eʔ dˈar dˈaftar xˈɑneː iː dˈar iːnˈuːrnas
 366 | دَرْ حُضورْ مادَرْ کُرْسِتَنْ  | dˈar hˈozuːr mˈɑdar korsˈetan
 367 | پِدَرْ وَ نا مادَری رَبیعْ  | pˈedar vˈa nɑ mɑdˈari rˈabiʔ
 368 | وَ هَشْتْ نَفَرْ اَزْ دوسْتانِشانْ  | vˈa hˈaʃt nˈafar az dˌustɑnˈeʃɑn
 369 | بِ وَسیلِ شَخْصی صاحِبْ مَنْسَبْ  | beː vasˈileː ʃˈaxsi sˈɑheb mˈansab
 370 | بِ عَقْدْ هَمْ دَرآمَدَنْدْ  | beː ˈaːq1d hˈam darɑmˈadand
 371 | مَجْموعِ ای اَزْ تَعَهُّداتْ تَعییْنْ شُدِ  | mˌadʒmuːʔˈeː iː az tˌaʔahhˈodɑt tˈaʔiːn ʃˈodeː
 372 | اَزْ سویْ دوْلَتْ اِسْکاتْلَنْدْ را  | az sˈuːj dˈolat eskˈɑtland rˈɑ
 373 | بُلَنْدْ خوانْدَنْدْ  | bˈoland xˈɑndand
 374 | وَ مُتِعَهِّدْ شُدَنْدْ  | vˈa mˌoteʔˈahhed ʃˈodand
 375 | کِ بِ یِکْدیگَرْ عِشْقْ بِوَرْزَنْدْ  | kˈeː beː jekdˈiɡar ˈeːʃq1 bevˈarzand
 376 | وَ اَزْ هَمْ مُراقِبَتْ کُنَنْدْ  | vˈa az hˈam mˌorɑq1ˈebat kˈonand
 377 | صَبورْ باشَنْدْ  | sˈabur bˈɑʃand
 378 | وَ بِ هَمْ مِهْرْبانی کُنَنْدْ  | vˈa beː hˈam meːhrbˈɑni kˈonand
 379 | بِ هَمْ اِطْمینانْ کُنَنْدْ  | beː hˈam etmˈinɑn kˈonand
 380 | وَ یِکْدیگَرْ را بِبَخْشَنْدْ  | vˈa jekdˈiɡar rɑ bebˈaxʃand
 381 | بِهْتَرینْ دوسْتانْ هَمْ باشَنْدْ  | behtˈarin dˈustɑn hˈam bˈɑʃand
 382 | وَ تا زَمانْ مَرْگْ  | vˈa tɑː zamˈɑn mˈarɡ
 383 | هَمْدَمْ وَ هَمْراهْ وَفادارْ یِکْدیگَرْ بِمانَنْدْ  | hˈamdam vˈa hamrˈɑh vafˈɑdɑr jekdˈiɡar bemˈɑnand
 384 | دوْلَتْ  | dˈolat
 385 | اَزْ آنْجایی کِ مایِلْ نَبودِ  | az ˈɑndʒˈɑiː kˈeː mɑjˈel nˈabuːdˌeː
 386 | هَمِ چیزْ را دیکْتِ کُنَدْ  | hˈameː tʃˈiz rɑ dˈikteː kˈonad
 387 | یا شایَدْ هَمْ نِمیدانِسْتِ  | jɑː ʃˈɑjad hˈam nˈemidˌɑnestˌeː
 388 | چِطوْرْ اینْ کارْ را اَنْجامْ دَهَدْ  | tʃˈetor iːn kˈɑr rɑ ˈaːndʒˈɑm dˈahad
 389 | نَظَرْ دیگَری نِمی‌دَهَدْ  | nˈazar dˈiɡarˌi nˌemidˈahad
 390 | راجِعْ بِ اینْکِ  | rˈɑdʒeʔ beː ˈinkeː
 391 | چِطوْرْ بِ تَعَهُّداتْ شانْ  | tʃˈetor beː tˌaʔahhˈodɑt ʃˈɑn
 392 | عِیْنیَتْ بِبَخْشَنْدْ  | ejnˈiːjat bebˈaxʃand
 393 | اَلْبَتِّ  | albˈatteː
 394 | اِطِّلاعاتی دَرْبارِ تَخْفیفْ مالیاتی  | ˌeːttelɑʔˈɑti darbˈɑreː tˈaxfif mˈɑliˌɑti
 395 | بَرایِ آنْهایی کِ اَوَّلینْ خانِ شانْ را عایِقْ کُنَنْدْ  | barˈɑje ɑnhˌɑiː kˈeː avvˈalin xˈɑneː ʃˈɑn rɑ ˈɑjeq1 kˈonand
 396 | بِ زوْجْ ها اِرائِ میشَوَدْ  | beː zˈoːdʒ hɑ erˈɑeː miʃavˈad
 397 | بَعْدْ اَزْ مَراسِمْ  | bˈaʔd az marˈɑsem
 398 | شِرْکَتْ کُنَنْدِگانْ دَرْ مَراسِمْ اِزْدِواجْ  | ʃˈerkat kˌonandˈeɡɑn dˈar marˈɑsem ezdˈevɑdʒ
 399 | بَرایِ صَرْفْ ناهارْ  | barˈɑje sˈarf nɑhˈɑr
 400 | بِ رِسْتورانی دَرْ هَمانْ نَزْدیکی راهْنَمایی می‌شَوَنْدْ  | beː rˌesturˈɑni dˈar hamˈɑn nˈazdikˌi rˌɑhnamˈɑiː miʃˈavand
 401 | وَ دیرْ وَقْتْ هَمانْ شَبْ  | vˈa dˈir vˈaq1t hamˈɑn ʃˈab
 402 | تازِ عَروسْ وَ تازِ دامادْ  | tˈɑzeː ˈarus vˈa tˈɑzeː dˈɑmˈɑd
 403 | دَرْ هُتِلْ کوچَکی  | dˈar hˈotel kuːtʃˈaki
 404 | نَزْدیکْ بُلْوارْ سِنْ ژِرْمَنْ  | nˈazdik bˈolvɑr sˈen ʒˈerman
 405 | دَرْ پاریسْ آرامْ می‌گیرَنْدْ"  | dˈar pˈɑris ˈɑrˈɑm miɡˈirand
