 195 | بِ عُنْوانِ مُذاکِرِ‌یِ کُنَنْدِ‌یِ مالی را  | beː onvˈɑne mˌozɑkˈereːjˈe konˈandeːjˈe mˈɑli rˈɑ
 196 | اَزْ اِخْتِفاء بیرونْ آوَرْدْ  | az extˈefɑ bˈiruːn ˈɑvard
 197 | رَبیعِ او را زیرِ نَظَرْ می‌گیرَدْ کِ شَبْ تا دیرْ وَقْتِ  | rˌabiʔˈe ˈuː rɑ zˈire nˈazar miɡˈirad kˈeː ʃˈab tɑː dˈir vˈaq1te
 198 | قِیْمَتْها را بَرْرَسی می‌کُنَدْ  | q1ejmˈathɑ rɑ barrˈasi mikˈonad
 199 | وَ اَوَّلِ صُبْحِ پُشْتِ تِلِفُنْ  | vˈa ˈavvalˌe sˈobhe pˈoʃte tˌelefˈon
 200 | با جِدّیَتْ با مُشاوِرینِ اَمْلاکْ صُحْبَتْ می‌کُنَدْ  | bɑ dʒeddˈijat bɑ mˌoʃɑverˈine ˈaːmlˈɑk sˈohbat mikˈonad
 201 | وَ بِ اینْ نَتیجِ می‌رِسَدْ  | vˈa beː iːn nˈatidʒˌeː mirˈesad
 202 | کِ واقِعَنْ خُشْ شانْسْ اَسْتْ کِ با زَنی اِزْدِواجْ کَرْدِ  | kˈeː vɑq1ˈeʔan xˈoʃ ʃˈɑns ˈast kˈeː bɑ zˈani ezdˈevɑdʒ kˈardeː
 203 | کِ اینْ چِنینْ ماهِرانِ  | kˈeː iːn tʃˈenin mˌɑherˈɑneː
 204 | اَزْ پَسِ مَسائِلِ مالی بَرْمی آیَدْ  | az pˈase masˈɑʔelˌe mˈɑli bˈarmi ˈɑjad
 205 | با گُذَشْتِ زَمانْ  | bɑ ɡozˈaʃte zamˈɑn
 206 | مُضوعِ دیگَری را هَمْ مُتِوَجِّ می‌شَوَدْ  | mozˈuʔe dˈiɡarˌi rɑ hˈam mˌotevˈadʒdʒeː miʃavˈad
 207 | مُمْکِنْ اَسْتْ حَقیقَتَنْ  | mˈomken ˈast hˌaq1iq1ˈatan
 208 | اینْ خِصْلَتْ دَرْ کِرِسْتِنْ وُجودْ داشْتِ_باشَدْ  | iːn xˈeslat dˈar kerˈesten vˈodʒuːd dˈɑʃteː bˈɑʃad
 209 | کِ بِ طَرْزِ غِیْرِ عادی  | kˈeː beː tˈarze q1ˈejre ˈɑdi
 210 | بِ وَضْعیَتِ مالیِ دیگَرانْ حَسّاسیَتْ نِشانْ دَهَدْ  | beː vazʔˈiːjatˌe mˈɑliˌe diɡˈarɑn hˌassɑsˈiːjat nˈeʃɑn dˈahad
 211 | وَ آرِزویِ رِسیدَنْ بِ میزانِ بِخُصوصی اَزْ رِفاهِ مادی را  | vˈa ˈɑrezˌuje rˈesidˌan beː mizˈɑne bexosˈusi az refˈɑhe mˈɑdi rˈɑ
 212 | دَرْ سَرْ بِپَرْوَرانْدْ  | dˈar sˈar beparvˈarɑnd
 213 | اینْ را می‌تَوانْ بِ شِکْلِ یِکْ ضَعْفْ دیدْ  | iːn rɑ mitˈavɑn beː ʃˈekle jˈek zˈaʔf dˈid
 214 | اَمّا بِ هَمانْ اَنْدازِ کِ ضَعْفْ اَسْتْ  | ˈammˌɑ beː hamˈɑn ˈaːndˈɑzeː kˈeː zˈaʔf ˈast
 215 | وَ رَبیعْ حَتّا شَکْ دارَدْ کِ باشَدْ  | vˈa rˈabiʔ hˌattˈɑ ʃˈak dˈɑrad kˈeː bˈɑʃad
 216 | اَگَرْ ژَرْف‌تَرْ بِنْگَریمْ  | ˌaɡˈar ʒˈarftar benɡˈarim
 217 | بِ یِکْ نُقْطِ‌یِ قُوَّتْ هَمْ مُرْتَبِطْ اَسْتْ  | beː jˈek nˈoq1teːjˈe q1ˈovvat hˈam mortˈabet ˈast
 218 | بَهایی کِ رَبیعْ بایَدْ  | bahˈɑiː kˈeː rˈabiʔ bˈɑjad
 219 | بَرایِ تِکْیِ بَرْ مَهارَتِ کُنْتُرُلِ مالیِ هَمْسَرَشْ بِپَرْدازَدْ  | bˌarɑjˈe tˈekjeː bar mˌahɑrˈate kˈontorˌole mˈɑliˌe hamsˈaraʃ bepardˈɑzad
 220 | اینْ اَسْتْ کِ ضَعْف‌هایِ مُسَلَّمِ وابَسْتِ بِ آنْ را نیزْ  | iːn ˈast kˈeː zˈaʔfhɑjˈe mˌosallˈame vˈɑbastˌeː beː ɑn rɑ nˈiz
 221 | تَحَمُّلْ کُنَدْ  | tahˈammol kˈonad
 222 | هَمانْ مُحَسَّناتی کِ اَزْ او  | hamˈɑn mˌohassanˈɑti kˈeː az ˈuː
 223 | مُذاکِرِ کُنَنْدِ  | mˌozɑkˈereː konˈandeː
 224 | وَ کُنْتُرُلِ کُنَنْدِ‌یِ مالی قَدْری می‌سازَدْ  | vˈa kˈontorˌole konˈandeːjˈe mˈɑli q1ˈadri misˈɑzad
 225 | گاهی اُقاتْ  | ɡˈɑhi ˈoːq1ɑt
 226 | مَخْصوصَنْ وَقْتی رَبیعْ راجِعْ بِ شُغْلَشْ نِگَرانْ اَسْتْ  | maxsˈusan vˈaq1ti rˈabiʔ rˈɑdʒeʔ beː ʃˈoq1laʃ neɡˈarɑn ˈast
 227 | او را تَبْدیلْ بِ هَمْ صُحْبَتی دیوانِ کُنَنْدِ  | ˈuː rɑ tˈabdil beː hˈam sohbˈati divˈɑneː konˈandeː
 228 | وَ عَصَبی کُنَنْدِ می‌کُنَدْ  | vˈa asˈabi konˈandeː mikˈonad
 229 | کِ فَقَطْ دَرْ کِنارَشْ می‌تَوانْ  | kˈeː fˈaq1at dˈar kenˈɑːraʃ mitˈavɑn
 230 | داشْتِ‌هایِ دیگَرانْ را بَرْرَسی کَرْدْ  | dˈɑʃteːhɑjˈe diɡˈarɑn rɑ barrˈasi kˈard
 231 | دَرْ هَرْ دُ سِناریُ  | dˈar har dˈo sˌenɑrˈijo
 232 | بِ طُرِ مُشابِهْ  | beː tˈore moʃˈɑbeh
 233 | هَمْ دَغْدَغِ‌یِ اَمْنیَتْ اَسْتْ  | hˈam daq1dˈaq1eːjˈe ˈaːmniːjˌat ˈast
 234 | هَمْ بیمیلی بِ مُحاسِبِ‌یِ مَعیارْهایِ مادی  | hˈam bimˈili beː mˌohɑsˈebeːjˈe mˌaʔiˈɑrhˈɑje mˈɑdi
 235 | بَرایِ مُوَفَّقیَتْ  | bˌarɑjˈe mˌovaffaq1ˈiːjat
 236 | وَ هَمْ تَوَجُّه‌یِ زیرَکانِ  | vˈa hˈam tˈavadʒdʒˌohjˈe zˌirakˈɑneː
 237 | بِ اَرْزِشِ مادیِ اَجْناسْ  | beː arzˈeʃe mˈɑdiˌe ˈaːdʒnˈɑs
 238 | یِکْ ویژِگیِ واحِدْ دَرْ کِرِسْتِنْ  | jˈek vˌiʒeɡˈie vˈɑhed dˈar kerˈesten
 239 | هَمْ مُعامِلِ‌یِ شِگِفْتِ اَنْگیزِ خانِ را بِ هَمْراهْ دارَدْ  | hˈam mˌoʔɑmˈeleːjˈe ʃeɡˈefte ˈaːnɡizˌe xˈɑneː rɑ beː hamrˈɑh dˈɑrad
 240 | وَ هَمْ تَزَلْزُلِ مُقِعیَتِ اِجْتِماعی را  | vˈa hˈam tˌazalzˈole mˌoq1eʔiːjˈate ˌedʒtemˈɑʔˈi rˈɑ
 241 | رَبیعْ اَکْنونْ می‌تَوانَدْ دَرْکْ کُنَدْ  | rˈabiʔ ˈaːknuːn mitavˈɑnad dˈark kˈonad
 242 | کِ کِرِسْتِنْ  | kˈeː kerˈesten
 243 | دَرْ نِگَرانی‌هایِ گاهْ وَ بیگاهَشِ  | dˈar nˌeɡarˈɑnihɑjˈe ɡˈɑh vˈa biɡˈɑhaʃˌe
 244 | راجِعْ بِ ثِرْوَتِ نِسْبیِ دوسْتانَشْ  | rˈɑdʒeʔ beː servˈate nesbˈie dustˈɑnaʃ
 245 | تَنْها ضَعْف‌هایِ نُقاطِ قُوَّتَشْ را بِ نَمایِشْ می‌گُذارَدْ  | tˈanhɑ zˈaʔfhɑjˈe noq1ˈɑte q1ovvˈataʃ rɑ beː namˈɑjeʃ miɡozˈɑrad
 246 | وَ بَسْ  | vˈa bˈas
 247 | دَرْ اِدامِ  | dˈar edˈɑmeː
 248 | وَقْتی بِ خانِ‌یِ جَدیدِشانْ نَقْلْ مَکانْ کَرْدَنْدْ  | vˈaq1ti beː xˈɑneːjˈe dʒˌadidˈeʃɑn nˈaq1l makˈɑn kˈardand
 249 | رَبیعْ تَلاشْ می‌کُنَدْ  | rˈabiʔ talˈɑʃ mikˈonad
 250 | هیچْگاهْ اَزْ آنْ نُقاطِ قُوَّتْ غافِلْ نَشَوَدْ  | hitʃɡˈɑh az ɑn noq1ˈɑte q1ˈovvat q1ˈɑfel nˈaʃavˈad
 251 | حَتّا دَرْ مَواقِعی کِ ضَعْف‌ها  | hˌattˈɑ dˈar mavˈɑq1eʔˌi kˈeː zˈaʔfhˈɑ
 252 | بِ وُضوحْ دیدِ_می‌شَوَنْدْ  | beː vˈozuːh dˈideː miʃˈavand
 253 | ضَعْفِ هایی کِ بِ وَسیلِ‌یِ نُقاطِ قُوَّتْ ایجادْ می‌شَوَنْدْ  | zˈaʔfe hˈɑiː kˈeː beː vasˈileːjˈe noq1ˈɑte q1ˈovvat iːdʒˈɑd miʃˈavand
