 000 | " صَفْحِ‌یِ صَدْ وَ نه  | sˈafheːjˈe sˈad vˈa nˈa
 001 | اِدامِ‌یِ یادْ دادَنْ وَ یادْ گِرِفْتَنْ  | edˈɑmeːjˈe jˈɑd dˈɑdan vˈa jˈɑd ɡerˈeftan
 002 | چِنانْچِ رَبیعْ  | tʃenˈɑntʃe rˈabiʔ
 003 | رَوِشِ آموزِشیِ بِهْتَری اِنْتِخابْ کَرْدِ_بودْ  | rˈaveʃˌe ˌɑmuzeʃˈie behtˈari ˌentexˈɑb kˈardeː bˈuːd
 004 | دَرْسی کِ دَرْصَدَدْ بودْ بِدَهَدْ  | dˈarsi kˈeː darsˈadad bˈuːd bedˈahad
 005 | بِ گونِ‌ای بِسیارْ مُتَفاوِتْ بَرْ مُلّا می‌شُدْ  | beː ɡˈuneːiː besˈijɑr mˌotafˈɑvet bar mˈollɑ miʃˈod
 006 | بَرایِ شُروعِ  | bˌarɑjˈe ʃˌoruːʔˈe
 007 | قَبْلْ اَزْ هَرْ صُحْبَتی صَبْرْ میکَرْدْ تا هَرْدُ یِکْ راسْتْ بِ رَخْتِخابْ بِرَوَنْدْ  | q1ˈabl az har sohbˈati sˈabr mˌikard tɑː hˈardo jˈek rˈɑst beː raxtˈexɑb berˈavand
 008 | وَ مُطْمَئِنْ میشُدْ کِ خوبْ اِسْتِراحَتْ کَرْدِ‌اَنْدْ  | vˈa mˈotmˌaen miʃˈod kˈeː xˈuːb ˌesterˈɑhat kˈardeːˈand
 009 | صُبْحِ روزِ بَعْدْ می‌تَوانِسْتْ  | sˈobhe rˈuːze bˈaʔd mitˈavɑnˌest
 010 | بَعْدْ اَزْ خُرْدَنِ قَهْوِ وَ شیرینی  | bˈaʔd az xordˈane q1ˈahveː vˈa ʃirˈini
 011 | بَرْ رویِ نیمْکَتی شایَدْ دَرْ پارْکینْگِ جُرْجْ پَنْجُمِ  | bar rujˈe nimkˈati ʃˈɑjad dˈar pˈɑrkinɡˌe dʒˈordʒ pˈandʒomˌe
 012 | پیشْنَهادِ قَدَمْ زَدَنْ بِدَهَدْ  | pˈiʃnahˈɑde q1ˈadam zˈadan bedˈahad
 013 | هَمْچِنینْ می‌تَوانِسْتْ حِیْنِ تَماشایِ دِرَخْتانِ تَنومَنْدِ بَلوطْ  | hamtʃˈenin mitˈavɑnˌest hˈejne tamˈɑʃˈɑje dˌeraxtˈɑne tˌanuːmˈande bˈalut
 014 | راجِعْ بِ آشْپَزی  | rˈɑdʒeʔ beː ɑʃpˈazi
 015 | وَ چیزْهایِ دیگَرْ  | vˈa tʃizhˈɑje dˈiɡar
 016 | اَزْ کِرِسْتِنِ تَعْریفْ وَ تَمْجیدْ کُنَدْ  | az kˌerestˈene tˈaʔrif vˈa tˈamdʒid kˈonad
 017 | شایَدْ اَزْ مَهارَتِ او دَرْ مُواجِهِ با سیاسْتْهایِ کاریَشْ  | ʃˈɑjad az mˌahɑrˈate ˈuː dˈar mˌovɑdʒˈeheː bɑ siˈɑsthˈɑje kɑrˈijaʃ
 018 | یا لُطْفی کِ بِ رَبیعْ کَرْدِ_بودْ  | jɑː lˈotfi kˈeː beː rˈabiʔ kˈardeː bˈuːd
 019 | وَ بَسْتِ‌ای را کِ روزِ قَبْلْ بَرایَشْ پُسْتْ کَرْدِ_بودْ  | vˈa bˈasteːiː rɑ kˈeː rˈuːze q1ˈabl barˈɑjaʃ pˈost kˈardeː bˈuːd
 020 | سِپَسْ  | sˈepas
 021 | بِ جایِ اینْکِ او را مُتَّهَمْ کُنَدْ خُدَشْ را نیزْ دَرْ رَفْتاری کِ می‌خاسْتْ بَرْ آنْ مُتِمَرْکِزْ شَوَدْ دَرْگیرْ می‌کَرْدْ  | beː dʒˌɑje ˈinkeː ˈuː rɑ mottˈaham kˈonad xˌodaʃ rɑ nˈiz dˈar raftˈɑri kˈeː mixˈɑst bar ɑn mˌotemˈarkez ʃavˈad dˈarɡir mikˈard
 022 | می‌تَوانِسْتْ اینْطُرْ آغازْ کُنَدْ  | mitˈavɑnˌest ˈintoːr ˈɑq1ˈɑz kˈonad
 023 | تَکْلِ  | tˈakle
 024 | حِسْ میکُنَمْ بِ بَعْضی اَزْ کَسایی کِ میشِناسیمْ دارِ حَسودیمْ میشِ  | hˈes mikˈonam beː bˈaʔzi az kasˈɑiː kˈeː miʃenˈɑsim dˈɑreː hasˈudim mˈiʃeː
 025 | اَگِ وارِدِ کارِ مِعْماری نَشُدِ_بودَمْ  | ˈaːɡeː vˈɑredˌe kˈɑre meʔmˈɑri naʃˈodeː bˈuːdam
 026 | می‌تونِسْتیمْ ویلایِ تابِسْتانی داشْتِ_باشیمْ وَ  | mitunˈestim vilˈɑje tˈɑbestˌɑni dˈɑʃteː bˈɑʃim vˈa
 027 | مَنَمِ کُلّی اَزَشْ خُشَمْ میومَدْ  | manˈame kollˈi ˈazaʃ xˈoʃam mijˈumad
 028 | مَنْ بیشْتَرْ اَزْ هَرْ کَسْ دِیْگَه‌ای عاشِقِ آفْتابْ وَ دَرْیایِ مِدیتْرانِ‌  | man bˈiʃtar az har kˈas dˈejɡahiː ˈɑʃeq1ˌe ˈɑftˈɑb vˈa darjˌɑːje mˌeditrˈɑneː
 029 | اَمْ آرْزومِ رویِ زَمینْهایِ سَنْگیِ خُنَکْ راهْ بِرَمْ وَ  | am ˈɑrzuːmˌeː rujˈe zˌaminhˈɑje sanɡˈie xˈonak rˈɑh bˈeram vˈa
 030 | بویِ یاسْ وَ آویشَنْ رو  | bˈuːje jˈɑs vˈa ɑvˈiʃan rˈu
 031 | تویِ باغْ اِسْتِشْمامْ کُنَمْ  | tujˈe bˈɑq1 ˌesteʃmˈɑm kˈonam
 032 | خِیْلی مُتِأَسِّفَمْ کِ هَرْدُمونْ را مایوسْ کَرْدَمْ  | xˈejli mˌoteʔassˈefam kˈeː hardˈomun rɑ mˈɑjus kˈardam
 033 | بَعْدْ مانَنْدِ پِزِشْکی کِ قَبْلْ اَزْ فُرو کَرْدَنِ آمْپولْ  | bˈaʔd mɑnˈande pezˈeʃki kˈeː q1ˈabl az fˈoru kardˈane ˈɑmpuːl
 034 | بِ مَریضْ آرامِشْ می‌دَهَدْ بِگویَدْ  | beː mˈariz ɑrˈɑmeʃ midˈahad beɡˈujad
 035 | بِ هَرْحالِ  | beː harhˈɑle
 036 | مُضوعِ دِیْگَه‌ای کِ میخاسْتَمْ بِگَمْ  | mozˈuʔe dˈejɡahiː kˈeː mixˈɑstam bˈeɡam
 037 | وَ اِحْتِمالَنْ دَرْسِ خوبی هَمْ بَرایِ هَرْدُمونْ هَسْتْ  | vˈa ˌehtemˈɑlan dˈarse xˈuːbi hˈam bˌarɑjˈe hardˈomun hˈast
 038 | اینِ کِ ما اَزْ خِیْلی جَهاتِ دِیْگَهْ خُشْبَخْتْ هَسْتیمْ وَ  | ˌiːneː kˈeː mɑ az xˈejli dʒahˈɑte dˈejɡah xˈoʃbaxt hˈastim vˈa
 039 | بایَدْ حَدِّاَقَلْ سَعْیْ کُنیمْ فَراموشِشونْ نَکُنیمْ  | bˈɑjad hˌaddeˈaq1al sˈaʔj kˈonim farˈɑmuʃˌeʃun nakˈonim
 040 | ما خُشْبَخْتیمْ چُنْ هَمْدِیْگَهْ رو داریمْ  | mɑ xoʃbˈaxtim tʃˈon hamdˈejɡah rˈu dˈɑrim
 041 | چُنْ اَزْ شُغْلِ مونْ تُ یِ روزْ خوبْ لِذَّتْ می‌بَریمْ  | tʃˈon az ʃˈoq1le mun tˈo jˈeː rˈuːz xˈuːb lˈezzat mibˈarim
 042 | وَ چُنْ خوبْ میدونیمْ  | vˈa tʃˈon xˈuːb midˈuːnim
 043 | چِطُرْ تُ تَعْطیلاتِ تابِسْتانی بارونْ زَدِ مونْ  | tʃˈetor tˈo tˌaʔtilˈɑte tˈɑbestˌɑni bˈɑruːn zˈadeː mˈun
 044 | تُ جَزایِرِ غَرْبیِ  | tˈo dʒˌazɑjˈere q1arbˈie
 045 | تُ کُلْبِ یِ مَزْرَعِ دارْ  | tˈo kˈolbeː jˈeː mazrˈaʔeː dˈɑr
 046 | جاییکِ‌یِ یِکُمْ بویِ پِشْکِلِ گوسْفَنْدْ میدِ  | dʒˈɑjikˌeːjˈe jˈekom bˈuːje peʃkˈele ɡˈuːsfand mˈideː
 047 | کُلّی خُشْ بِگَذْرونیمْ  | kollˈi xˈoʃ beɡazrˈuːnim
 048 | مَنْ کِ تا وَقْتی با تُ باشَمْ  | man kˈeː tɑː vˈaq1ti bɑ tˈo bˈɑʃam
 049 | واقِعَنْ حاضِرَمْ با کَمالِ مِیْلْ  | vɑq1ˈeʔan hɑzˈeram bɑ kamˈɑle mˈeːjl
 050 | رویِ هَمینْ نیمْکَتْ زِنْدِگی کُنَمْ  | rujˈe hˈamin nˈimkat zˈendeɡˌi kˈonam
 051 | اَمّا فَقَطْ رَبیعْ نیسْتْ کِ مُعَلِّمْ اِفْتِضاحیسْتْ کِرِسْتِنْ  | ˈammˌɑ fˈaq1at rˈabiʔ nˈist kˈeː moʔˈallem ˌeftezˈɑhist kerˈesten
 052 | هَمْ دانِشِ آموزْ باهوشی نیسْتْ  | hˈam dˈɑneʃˌe ˈɑmuːz bˈɑhuːʃˌi nˈist
 053 | دَرْ تَمامِ طولِ رابِطِ‌یِ شانِ  | dˈar tamˈɑme tˈuːle rˈɑbetˌeːjˈe ʃˈɑne
 054 | هَرْ دُیِ آنْها دَرْ هَرْ دُ کارْ  | har dˈoje ˌɑnhɑ dˈar har dˈo kˈɑr
 055 | هَمْ یادْ دادَنْ  | hˈam jˈɑd dˈɑdan
 056 | وَ هَمْ یادْ گِرِفْتَنِ  | vˈa hˈam jˈɑd ɡˌereftˈane
 057 | بِکُلی نامُوَفَّقْ هَسْتَنْدْ  | bekˈoli nɑmˈovaffˌaq1 hˈastand
 058 | با اَوَّلینْ نِشانْ اَزْ اینْ کِ یِکی اَزْ آنْها  | bɑ avvˈalin nˈeʃɑn az iːn kˈeː jˈeki az ˈɑnhɑ
 059 | لَحْنِ آموزِشی بِ خُدْ گِرِفْتِ_اَسْتْ دیگَری تَصَوُّرْ می‌کُنَدْ کِ بِ او حَمْلِ شُدِ  | lˈahne ˌɑmuzˈeʃi beː xod ɡerˈefteː ˈast dˈiɡarˌi tasˈavvor mikˈonad kˈeː beː ˈuː hˈamleː ʃˈodeː
 060 | وَ اینْ باعِثْ می‌شَوَدْ  | vˈa iːn bˈɑʔes miʃavˈad
 061 | گوشْهایَشْ را بِگیرَدْ  | ɡuːʃhˈɑjaʃ rɑ beɡˈirad
 062 | تا آنْ دَرْسْ را نَشُنودْ  | tɑː ɑn dˈars rɑ nˈaʃonˌuːd
 063 | وَ با تَمَسْخُرْ وَ پَرْخاشْگَری عَکْسِ اُلعَمَلْ نِشانْ دَهَدْ  | vˈa bɑ tamˈasxor vˈa pˌarxɑʃɡˈari ˈaːkse olˈamal nˈeʃɑn dˈahad
 064 | وَ بِدینْ تَرْتیبْ  | vˈa bedˈin tˈartib
 065 | مُجِبِ ناراحَتی وَ بیزاریِ بیشْتَرْ  | modʒˈebe nɑrˈɑhatˌi vˈa bˌizɑrˌie bˈiʃtar
 066 | دَرْ ذِهْنِ طَرَفْ زودْ رَنْجِ آموزِشْ دَهَنْدِ شَوَدْ  | dˈar zˈehne tˈaraf zˈuːd rˈandʒe ɑmˈuzeʃ dahˈandeː ʃavˈad
 067 | کِرِسْتِنْ  | kerˈesten
 068 | دَرْ تَخْتِخابِ خَسْتِ‌تَرْ اَزْ هَمیشِ جَوابْ می‌دَهَدْ  | dˈar tˌaxtexˈɑbe xˈasteːtar az hamˈiʃeː dʒˈavɑb midˈahad
 069 | رَبیعِ  | rˌabiʔˈe
 070 | تاحالا هیچْ کَسْ چیزی راجِعْ بِ اینْکِ مَنْ پولِ پَرَسْتْ هَسْتَمْ یا نه  | tˈɑhˈɑlˈɑ hˈitʃ kˈas tʃˈizi rˈɑdʒeʔ beː ˈinkeː man pˈuːle pˈarast hˈastam jɑː nˈa
 071 | بِهَمْ نَگُفْتِ  | bˈeham naɡˈofteː
 072 | او عَمیقَنْ  | ˈuː amˈiq1an
 073 | اَزْ اینْ حَرْفْ رَبیعْ  | az iːn hˈarf rˈabiʔ
 074 | وَ اینْکِ بِ سَبُکِ زِنْدِگیِ دوسْتانَشْ حِسادَتْ میکُنَدْ  | vˈa ˈinkeː beː sabˈoke zˈendeɡˌie dustˈɑnaʃ hesˈɑdat mikˈonad
 075 | آزُرْدِ خاطِرْ شُدِ  | ɑzˈordeː xˈɑter ʃˈodeː
 076 | راسْتَشْ هَمینْ چَنْدْ روزْ پیشْ بودْ کِ مامانْ پُشْتِ تِلِفُنْ بِهَمْ گُفْتْ  | rˈɑstaʃ hˈamin tʃˈand rˈuːz pˈiʃ bˈuːd kˈeː mˈɑmɑn pˈoʃte tˌelefˈon bˈeham ɡˈoft
 077 | تا حالا کَسی را نَدیدِ کِ مِثْلِ مَنْ راجِعْ بِ پولِ اَنْقَدَرْ مَعْقولْ وَ سَنْجیدِ باشِ  | tɑː hˈɑlɑ kˈasi rɑ nˈadidˌeː kˈeː mˈesle man rˈɑdʒeʔ beː pˈuːle ˈaːnq1adˌar mˈaʔq1uːl vˈa sandʒˈideː bˈɑʃeː
 078 | وَلی اونْ یِکُمْ فَرْقْ دارِ تَکْلْ میدونیمْ کِ  | vˈali ˈuːn jˈekom fˈarq1 dˈɑreː tˈakl midˈuːnim kˈeː
 079 | مامانَتْ فَقَطْ اینْ حَرْفْ رو میزَنِ چُنْ دوسْتَتْ دارِ  | mˈɑmɑnˌat fˈaq1at iːn hˈarf rˈu mizˈaneː tʃˈon dˈustat dˈɑreː
 080 | وَ اَزْ دیدِ اونْ مُطْمَئِنَّنْ هیچْ خَطایی اَزْ تُ سَرْ نِمیزَنِ  | vˈa az dˈide ˈuːn mˌotmaʔˈennan hˈitʃ xatˈɑiː az tˈo sˈar nˌemizˈaneː
 081 | یِ جوری حَرْفْ میزَنی اِنْگارْ یِ ایرادِ  | jˈeː dʒˈuːri hˈarf mizˈani ˈenɡɑr jˈeː iːrˈɑdeː
 082 | اَگِ واقِعَنْ دوسْتَمْ داری چِرا نِمیتونی چَشْتو بِ رَوِشْ بِبَنْدی  | ˈaːɡeː vɑq1ˈeʔan dˈustam dˈɑri tʃˈerɑ nˌemitˌuni tʃˈaʃtuː beː rˈaveʃ bebˈandi
 083 |  چُنْ یِ جورِ دِیْگَهْ دوسْتَتْ دارَمْ  | tʃˈon jˈeː dʒˈuːre dˈejɡah dˈustat dˈɑram
 084 | چِ جوری  | tʃeː dʒˈuːri
 085 |  یِ جوری کِ می‌فَهْمَمْ اَلانْ داری کَمْ کَمْ بِداخْلاقْ میشی  | jˈeː dʒˈuːri kˈeː mifˈahmam ˈaːlˈɑn dˈɑri kˈam kˈam bedˈɑxlˈɑq1 mˈiʃi
 086 | رَبیعْ می‌دانَدْ کِ حَرْفْهایَشْ  | rˈabiʔ midˈɑnad kˈeː harfhˈɑjaʃ
 087 | بی آنْکِ بِخاهَدْ خِیْلی بِ دِرازا کِشیدِ_شُدِ_اَسْتْ  | bi ˈɑnkeː bexˈɑhad xˈejli beː derˈɑzɑ keʃˈideː ʃˈodeː ˈast
 088 | می‌گویَدْ  | miɡˈujad
 089 | مَنْ واقِعَنْ عاشِقِتَمْ خِیْلی زیادْ دوسْتَتْ دارَمْ  | man vɑq1ˈeʔan ˌɑʃeq1ˈetam xˈejli ziˈɑd dˈustat dˈɑram
 090 | اونْقَدَرِ زیادْ کِ مُدامْ میخایِ مِنُ تَغییْرْ بَدی  | ˌuːnq1adˈare ziˈɑd kˈeː mˈodɑm mixˈɑje mˈeno tˈaq1iːr bˈadi
 091 |  رَبیعْ ای کاشْ میفَهْمیدَمْ  | rˈabiʔ iː kˈɑʃ mifahmˈidam
 092 | دَرْسَهایِ سَخْتْ  | darsahˈɑje sˈaxt
 093 | بِ دانِشِ آموزانْ فُرْصَتْ می‌دَهَدْ عَقَبْ بِکِشَنْدْ  | beː dˈɑneʃˌe ˈɑmuːzˌɑn fˈorsat midˈahad ˈaːq1ab bekˈeʃand
 094 | وَ بِ خُدِشانْ دِلْداری بِدَهَنْدْ کِ مُعَلِّمِ شانْ واقِعَنْ یا دیوانِ اَسْتْ یا بَدْجِنْسْ  | vˈa beː xodˌeʃɑn deldˈɑri bedˈahand kˈeː mˌoʔallˈeme ʃˈɑn vɑq1ˈeʔan jɑː divˈɑneː ˈast jɑː bˈaddʒens
 095 | وَ بَنابَراینْ  | vˈa bˌanɑbˈarin
 096 | اُصولِ اِنْتِقادی بَرْ خُدِ آنانْ وارِدْ نیسْتْ  | osˈule ˌenteq1ˈɑdi bar xˌode ˈɑnˈɑn vˈɑred nˈist
 097 | شَنیدَنِ قِضاوَتی غِیْرِ مَنْطِقی وَ تُنْدْ وَ تیزْ  | ʃˌanidˈane q1ˌezɑvˈati q1ˈejre mantˈeq1i vˈa tˈond vˈa tˈiz
 098 | باعِثْ می‌شَوَدْ  | bˈɑʔes miʃavˈad
 099 | با خُشِ خیالی حِسْ کُنیمْ  | bɑ xˈoʃe xiˈɑli hˈes kˈonim
 100 | اِمْکانْ نَدارَدْ شَریکِ زِنْدِگیِمانْ  | ˈemkɑn nˈadɑrˌad ʃarˈike zˈendeɡˌijemˌɑn
 101 | هَمْزَمانْ هَمْ بَدْجِنْسْ باشَدْ  | hamzˈamɑn hˈam bˈaddʒens bˈɑʃad
 102 | وَ هَمْ شایَدْ کَمی حَقْ با او باشَدْ  | vˈa hˈam ʃˈɑjad kˈami hˈaq1 bɑ ˈuː bˈɑʃad
 103 | ما اَزْ نَظَرِ اِحْساسی  | mɑ az nˈazarˌe ehsˈɑsi
 104 | مَنْفی نِگَریِ هَمْسَرِمانْ را  | mˈanfi nˌeɡarˈie hamsarˈemɑn rˈɑ
 105 | با رَفْتارِ دِلْگَرْمِ کُنَنْدِ‌یِ دوسْتانْ وَ خانِوادِ مانْ  | bɑ raftˈɑre delɡˈarme konˈandeːjˈe dˈustɑn vˈa xˌɑnevˈɑdeː mˈɑn
 106 | مُقایِسِ می‌کُنیمْ  | mˌoq1ɑjˈeseː mikˈonim
 107 | یَعْنی کَسانی کِ هیچْگاهْ  | jˈaʔni kasˈɑni kˈeː hitʃɡˈɑh
 108 | تَحْتِ چِنینْ فِشارِ هایی نَبودَنْدْ  | tahtˈe tʃˈenin feʃˈɑre hˈɑiː nˈabuːdˌand
 109 | راه‌هایِ دیگَری نیزْ  | rˈɑhhɑjˈe dˈiɡarˌi nˈiz
 110 | بَرایِ نِگَریسْتَنْ بِ عِشْقْ وُجودْ دارَدْ  | bˌarɑjˈe nˈeɡarˌistan beː ˈeːʃq1 vˈodʒuːd dˈɑrad
 111 | یونانیانِ باسْتانْ  | jˌunɑniˈɑne bˈɑstɑn
 112 | دَرْ فَلْسَفِ‌یِ خُدْ  | dˈar falsˈafeːjˈe xˈod
 113 | دیدْگاهی مُفیدْ  | didɡˈɑhi mofˈid
 114 | وَلی غِیْرِ مُتِداوِلِ  | vˈali q1ˈejre mˌotedˈɑvelˌe
 115 | راجِعْ بِ رابِطِ‌یِ بِیْنِ عِشْقْ وَ آموزِشْ  | rˈɑdʒeʔ beː rˈɑbetˌeːjˈe bˈejne ˈeːʃq1 vˈa ɑmˈuzeʃ
 116 | اِرائِ کَرْدِ‌اَنْدْ  | erˈɑeː kˈardeːˈand
 117 | اَزْ دیدِ آنانْ  | az dˈide ˈɑnˈɑn
 118 | عِشْقْ دَرْ اِبْتِدا وَ قَبْلْ اَزْ هَرْ چیزْ  | ˈeːʃq1 dˈar ebtˈedɑ vˈa q1ˈabl az har tʃˈiz
 119 | حِسِ سِتایِشِ  | hˈese sˌetɑjˈeʃe
 120 | اَبْعادِ بَرْتَرِ اِنْسانیِ دیگَرْ بودْ  | ˈaːbʔˈɑde bartˈare ensˈɑniˌe dˈiɡar bˈuːd
 121 | عِشْقِ  | ˈeːʃq1e
 122 | هَیَجانْ مُواجِهْ شُدَنْ  | hajˈadʒɑn movˈɑdʒeh ʃˈodan
 123 | با خِصْلَت‌هایِ پَرْهیزْکارانِ بودْ  | bɑ xˈeslathɑjˈe pˌarhizkɑrˈɑneː bˈuːd
 124 | طِبْقِ نَظَریاتِ اینْ فَلْسَفِ‌  | tˈebq1e nˈazarˌiɑtˌe iːn falsˈafeː
 125 | یِ عَمیقْ شُدَنِ عِشْقْ  | jˈe ˈaːmiq1 ʃodˈane ˈeːʃq1
 126 | هَمیشِ دَرْبَرْدارَنْدِ‌یِ تَمایُلْ بِ یادْ دادَنْ  | hamˈiʃeː darbˌardɑrˈandejˈeː tamˈɑjol beː jˈɑd dˈɑdan
 127 | وَ دَرْ مُقابِلِ  | vˈa dˈar mˌoq1ɑbˈele
 128 | یادْگِرِفْتَنِ راهْهایی اَسْتْ  | jɑdɡˌereftˈane rɑhhˈɑiː ˈast
 129 | بَرایِ پَرْهیزْکارْتَرْ شُدَنْ  | bˌarɑjˈe pˌarhizkˈɑrtar ʃˈodan
 130 | چِگونِ کَمْتَرْ عَصَبانی شَویمْ  | tʃeɡˈuneː kˈamtar ˌasabˈɑni ʃˈavim
 131 | یا کَمْتَرْ کینِ‌یِ جَوْ باشیمْ  | jɑː kˈamtar kˈineːjˈe dʒˈav bˈɑʃim
 132 | وَ بیشْتَرْ موشِکافْ وَ شُجاعْ  | vˈa bˈiʃtar muʃˈekɑf vˈa ʃˈodʒɑʔ
 133 | عُشّاقِ راسْتینْ هیچْگاهْ نِمیتَوانَنْدْ بِ اینْ قَناعَتْ کُنَنْدْ کِ یِکْدیگَرْ را  | oʃʃˈɑq1e rˈɑstin hitʃɡˈɑh nˈemitˈavɑnˌand beː iːn q1anˈɑʔˈat kˈonand kˈeː jekdˈiɡar rˈɑ
 134 | هَمانْطُرْ کِ هَسْتَنْدْ بِپَذیرَنْدْ  | hamˈɑntor kˈeː hˈastand bepazˈirand
 135 | چِنینْ چیزی شِکْلِ دَهَنْدِ‌یِ خیانَتی بُزْدِلانِ وَ تَنِ پُرْوَرانِ  | tʃˈenin tʃˈizi ʃˈekle dahˈandeːjˈe xiˈɑnatˌi bˌozdelˈɑne vˈa tˈane porvarˈɑneː
 136 | بِ کُلِ هَدَفِ اینْ رَوابِطْ اَسْتْ  | beː kˈole hadˈafe iːn ravˈɑbet ˈast
 137 | هَمیشِ چیزی دَرْ ما  | hamˈiʃeː tʃˈizi dˈar mˈɑ
 138 | بَرایِ بِهْبودْ یافْتَنْ  | bˌarɑjˈe behbˈuːd jˈɑftan
 139 | وَ آموزِشْ بِ دیگَرانْ وُجودْ دارَدْ  | vˈa ɑmˈuzeʃ beː diɡˈarɑn vˈodʒuːd dˈɑrad
 140 | وَقْتی عُشّاقْ  | vˈaq1ti ˈoʃʃɑq1
 141 | بِ خُصوصیاتی اِشارِ می‌کُنَنْدْ  | beː xˌosusiˈɑti eʃˈɑreː mikˈonand
 142 | کِ مُمْکِنْ اَسْتْ دَرْ شَخْصیَتِ طَرَفْ مُقابِلِشانْ  | kˈeː mˈomken ˈast dˈar ʃˌaxsiːjˈate tˈaraf mˌoq1ɑbelˈeʃɑn
 143 | مایِ‌یِ تَأَسُّفْ یا ناراحَتْ کُنَنْدِ باشَدْ  | mˌɑjejˈe taʔˈassof jɑː nɑrˈɑhat konˈandeː bˈɑʃad
 144 | اَگَرْ اینْ ویژِگی‌ها  | ˌaɡˈar iːn viʒˈeɡihˈɑ
 145 | اَزْ دَریچِ‌یِ اینْ لِنْزِ یونانِ باسْتانْ نِگَریسْتِ_شَوَنْدْ  | az darˈitʃejˈe iːn lˈenze junˈɑne bˌɑstɑn nˈeɡarˌisteː ʃˈavand
 146 | نَبایَدْ مُجِبِ دَسْتْ کِشیدَنْ اَزْ روحِ عِشْقْ شَوَنْدْ  | nˈabˈɑjad modʒˈebe dˈast keʃˈidan az rˈuːhe ˈeːʃq1 ʃˈavand
 147 | بِ آنانْ بایَدْ  | beː ˈɑnˈɑn bˈɑjad
 148 | بِ خاطِرِ تَلاشِشانْ دَرْ جَهَتِ اَنْجامِ کاری بِسیارْ صَحیحْ  | beː xˈɑterˌe talˈɑʃeʃˌɑn dˈar dʒahˈate ˈaːndʒˈɑme kˈɑri besˈijɑr sˈahih
 149 | بَرایِ ماهیَتِ عِشْقْ تَبْریکْ گُفْتْ  | bˌarɑjˈe mˌɑhiːjˈate ˈeːʃq1 tˈabrik ɡˈoft
 150 | بِ خاطِرِ کُمَکْ بِ شَریکِ زِنْدِگیِ شانْ  | beː xˈɑterˌe kˈomak beː ʃarˈike zˈendeɡˌie ʃˈɑn
 151 | بَرایِ تَبْدیلْ شُدَنْ  | bˌarɑjˈe tˈabdil ʃˈodan
 152 | بِ نُسْخِ‌ای بِهْتَرْ اَزْ خُدَشْ  | beː nˈosxeːiː bˈehtar az xˈodaʃ
 153 | دَرْ دُنْیایی کِ بیشْتَرْ رُشْدْ یافْتِ  | dˈar donjˈɑiː kˈeː bˈiʃtar rˈoʃd jˈɑfteː
 154 | دُنْیایی کِ اَنْدَکی بِ اِنْگارِ‌یِ یونانی اَزْ عِشْقْ واقِف‌تَرْ اَسْتْ  | donjˈɑiː kˈeː andˌaki beː enɡˈɑreːjˈe junˈɑni az ˈeːʃq1 vˈɑq1eftar ˈast
 155 | شایَدْ بِدانیمْ  | ʃˈɑjad bedˈɑnim
 156 | کِ وَقْتی می‌خاهیمْ چیزی را تَذَکُرْ دَهیمْ  | kˈeː vˈaq1ti mixˈɑhim tʃˈizi rɑ tazˈakor dˈahim
 157 | بایَدْ اَنْدَکی کَمْتَرْ ناشی هَراسانْ وَ پَرْخاشْگَرْ باشیمْ  | bˈɑjad andˌaki kˈamtar nˈɑʃi harˈɑsɑn vˈa parxˈɑʃɡar bˈɑʃim
 158 | وَ دَرْ زَمانِ دَرْیافْتِ واکُنِشْ نیزْ  | vˈa dˈar zamˈɑne darjˈɑfte vɑkˈoneʃ nˈiz
 159 | کَمی کَمْتَرْ سِتیزِ جَوْ وَ حَسّاسْ باشیمْ  | kˈami kˈamtar setˈizeː dʒˈav vˈa hˈassɑs bˈɑʃim
 160 | بِدینْ تَرْتیبْ  | bedˈin tˈartib
 161 | مَفْهومِ تَعْلیمِ دَرونِ رابِطِ‌  | mafhˈuːme taʔlˈime darˈune rˈɑbetˌeː
 162 | یِ بَرْخی اَزْ مَعانیِ ضِمْنیِ عَجیبْ وَ غَریبْ  | jˈe bˈarxi az maʔˈɑniˌe zemnˈie ˈaːdʒib vˈa q1ˈarib
 163 | وَ مَنْفیِ خُدْ را اَزْ دَسْتْ خاهَدْ_دادْ  | vˈa manfˈie xod rɑ az dˈast xˈɑhad dˈɑd
 164 | آنْگاهْ بِ خوبی خاهیمْ_پَذیرُفْتْ  | ɑnɡˌɑh beː xˈuːbi xˈɑhim pazˈiroft
 165 | کِ هَرْ دُ پُرُژِ  | kˈeː har dˈo porˈoʒeː
 166 | یادْ دادَنْ وَ یادْ گِرِفْتَنْ  | jˈɑd dˈɑdan vˈa jˈɑd ɡerˈeftan
 167 | خاطِرْنِشانْ کَرْدَنِ عُیوبِ دیگَری  | xˌɑternˈeʃɑn kardˈane ˌoijˈube dˈiɡarˌi
 168 | وَ قَرارْ دادِنِ خُدْ دَرْ مَعْرَضِ اِنْتِقادْ  | vˈa q1arˈɑr dˈɑdenˌe xod dˈar maʔrˈaze ˌenteq1ˈɑd
 169 | مُمْکِنْ اَسْتْ دَرْ نَهایَتْ  | mˈomken ˈast dˈar nahˈɑjat
 170 | دَرْ خِدْمَتِ هَدَفِ واقِعیِ عِشْقْ باشَدْ  | dˈar xedmˈate hadˈafe vˈɑq1eʔˈie ˈeːʃq1 bˈɑʃad
 171 | رَبیعْ هیچْگاهْ مُوَفَّقْ نِمی‌شَوَدْ  | rˈabiʔ hitʃɡˈɑh movˈaffaq1 nˌemiʃavˈad
 172 | آنْقَدْریِ خُدْ را کُنْتُرُلْ کُنَدْ  | ˌɑnq1adrˈie xod rɑ kˈontorˌol kˈonad
 173 | کِ بِتَوانَدْ مَنْظورَشْ را مُنْتَقِلْ کُنَدْ  | kˈeː betavˈɑnad manzˈuraʃ rɑ montˈaq1el kˈonad
 174 | زَمانِ زیادی می‌بُرْدْ  | zamˈɑne ziˈɑdi mibˈord
 175 | وَ سال‌هایِ بیشْتَری بایَدْ بِگُذَرَدْ  | vˈa sˈɑlhɑjˈe biʃtˈari bˈɑjad beɡozˈarad
 176 | تا آنْها دَرْ هُنَرْ یادْ دادَنْ وَ یادْ گِرِفْتَنِ  | tɑː ˌɑnhɑ dˈar hˈonar jˈɑd dˈɑdan vˈa jˈɑd ɡˌereftˈane
 177 | کامِلَنْ خِبْرِ شَوَنْدْ  | kɑmˈelan xˈebreː ʃˈavand
 178 | اَمّا دَرْ اینْ اَثْنا  | ˈammˌɑ dˈar iːn ˈaːsnˈɑ
 179 | دِلْخُریِ مَرْبوطْ بِ اِنْتِقادِ رَبیعْ اَزْ هَمْسَرَشْ  | delxorˈie mˈarbut beː ˌenteq1ˈɑde rˈabiʔ az hamsˈaraʃ
 180 | بِ خاطِرِ مادی گَرایی  | beː xˈɑterˌe mˈɑdi ɡarˈɑiː
 181 | با رویْدادی تَحْقیرآمیزْ وَ اَلْبَتِّ مُهِمِ فُرو نِشَسْتْ  | bɑ rujdˈɑdi tˌahq1irˈɑmiz vˈa albˈatteː mˈohemˌe fˈoru neʃˈast
 182 | پَنْجْ سالْ بَعْدْ اَزْ اِزْدِواجِ شانْ  | pˈandʒ sˈɑl bˈaʔd az ˌezdevˈɑdʒe ʃˈɑn
 183 | دَرْ دُرِ‌ای بِسیارْ مُساعِدْ  | dˈar dˈoreːiː besˈijɑr mosˈɑed
 184 | بَرایِ خَریدْ وَ فُروشِ مِلْکْ  | bˌarɑjˈe xˈarid vˈa forˈuːʃe mˈelk
 185 | کِرِسْتِنْ مُوَفَّقْ می‌شَوَدْ  | kerˈesten movˈaffaq1 miʃavˈad
 186 | آپارْتِمانِ شانْ را بِفُروشَدْ  | ˌɑpɑrtemˈɑne ʃˈɑn rɑ beforˈuʃad
 187 | وامِ جَدیدی دَسْتْ وَ پا کُنَدْ  | vˈɑme dʒadˈidi dˈast vˈa pˈɑ kˈonad
 188 | وَ با قِیْمَتی بِسیارْ مَقْرونْ بِ صَرْفِ  | vˈa bɑ q1ejmˈati besˈijɑr mˈaq1ruːn beː sˈarfeː
 189 | خانِ‌ای راحَتْ وَ دِلْبازِ  | xˈɑneːiː rˈɑhat vˈa delbˈɑze
 190 | چَنْدْ خیابانِ آنْ طَرَف‌تَرْ  | tʃˈand xiˈɑbɑnˌe ɑn tˈaraftˈar
 191 | دَرْ نیوبْتَلْتَرَسْتْ  | dˈar nˌijubtaltˈarast
 192 | بِگیرَدْ  | beɡˈirad
 193 | اینْ مانُوْرْ  | iːn mˈɑnovr
 194 | تَمامِ مَهارَت‌هایِ او  | tamˈɑme mahˈɑrathɑjˈe ˈuː
