 000 | "رازْها صَفْحِ صَدْ وَ نَوَدْ وَ هَفْتْ  | rˈɑzhɑ sˈafheː sˈad vˈa nˈavad vˈa hˈaft
 001 | هیچْ رابِطِ‌ای بِدونْ تَعَهُّدْ بِ صَمیمیَتْ قَلْبی آغازْ نِمی‌شَوَدْ  | hˈitʃ rˈɑbetˌeːiː bedˈuːn taʔˈahhod beː sˌamimˈiːjat q1ˈalbi ˈɑq1ˈɑz nˌemiʃavˈad
 002 | هَمْچِنینْ مَحالْ اَسْتْ بِتَوانْ تَصَوُّرْ کَرْدْ  | hamtʃˈenin mahˈɑl ˈast betˈavɑn tasˈavvor kˈard
 003 | کِ طَرَفِیْنْ  | kˈeː tarˈafejn
 004 | رابِطِ  | rˈɑbetˌeː
 005 | نَدانَنْدْ بَرایِ اینْکِ عِشْقْ اِدامِ داشْتِ باشَدْ  | nˈadˈɑnand barˈɑje ˈinkeː ˈeːʃq1 edˈɑmeː dˈɑʃteː bˈɑʃad
 006 | بایَدْ بِسْیاری اَزْ اَفْکارِشانْ را پیشْ خوْدِشانْ نِگَهْ دارَنْدْ  | bˈɑjad besjˈɑri az ˈaːfkɑrˌeʃɑn rɑ pˈiʃ xodˌeʃɑn nˈeɡah dˈɑrand
 007 | آنْقَدْرْ دَرْگیرْ صِداقَتْ هَسْتیمْ کِ اَدَبْ وَ نِزاکَتْ را فَراموشْ می‌کُنیمْ  | ˈɑnq1adr dˈarɡir sedˈɑq1at hˈastim kˈeː ˈadab vˈa nezˈɑkat rɑ farˈɑmuʃ mikˈonim
 008 | هَرْگِزْ نِمی‌خواهیمْ با تَمامْ خُصوصیاتْ آزارْدَهَنْدِ‌مانْ  | hˈarɡez nˌemixˈɑhim bɑ tˈamɑm xˌosusˈiɑt ˈɑzˈɑrdahˌandeːmˈɑn
 009 | با اَفْرادی کِ بَرایِمانْ اَهَمّیَتْ دارَنْدْ  | bɑ ˈaːfrˈɑdi kˈeː barˈɑjemˌɑn ˌahammˈiːjat dˈɑrand
 010 | مواجِهْ شَویمْ  | movˈɑdʒeh ʃˈavim
 011 | بِ هَمانْ اَنْدازِ کِ تَوانایی اِقْرارْ صَریحْ لازِمِ عِشْقْ اَسْتْ  | beː hamˈɑn ˈaːndˈɑzeː kˈeː tˌavɑnˈɑiː ˈeq1rɑr sˈarih lɑzˈemeː ˈeːʃq1 ˈast
 012 | سَرْکوبْ مِقْداری خوْدْداری  | sarkˈuːb meq1dˈɑri xoddˈɑri
 013 | وَ کَمی اَزْ خوْدْگُذَشْتِگی دَرْ اِصْلاحْ خوْدْ نیزْ مُطْمَئِنَّاْ دَرْ عِشْقْ لازِمْ اَسْتْ  | vˈa kˈami az xodɡozˈaʃteɡˌi dˈar ˈeslɑh xod nˈiz mˌotmaʔˈennan dˈar ˈeːʃq1 lˈɑzem ˈast
 014 | اِنْسانی کِ خوْدَشْ تَوانایی شِنیدَنْ هیچْ رازی را نَدارَدْ  | ensˈɑni kˈeː xˌodaʃ tˌavɑnˈɑiː ʃenˈidan hˈitʃ rˈɑzi rɑ nˈadɑrˌad
 015 | اَمّا بِ نامْ صِداقَتْ موْضوعاتی را با دیگَری بِ اِشْتِراکْ میگُذارَدْ  | ˈammˌɑ beː nˈɑm sedˈɑq1at mˌozuːˈɑti rɑ bɑ dˈiɡarˌi beː ˌeʃterˈɑk miɡozˈɑrad
 016 | کِ آنْقَدْرْ آسیبْ زَنَنْدِ‌اَنْدْ کِ مُمْکِنْ اَسْتْ هیچ‌گاهْ فَراموشْ نَشَوَنْدْ  | kˈeː ˈɑnq1adr ˈɑsib zanˈandeːand kˈeː mˈomken ˈast hˈitʃɡˈɑh farˈɑmuʃ naʃˈavand
 017 | بِ هیچْ وَجْهْ بِ عِشْقْ مُقَیَّدْ نیسْتْ  | beː hˈitʃ vˈadʒh beː ˈeːʃq1 moq1ˈajjad nˈist
 018 | وَ اَگَرْ مَشْکوکْ شَویمْ  | vˈa ˌaɡˈar mˈaʃkuːk ʃˈavim
 019 | چِنانْکِ اَگَرْ رابِطِ‌مانْ اَرْزِشْمَنْدْ باشَدْ  | tʃenˈɑnke ˌaɡˈar rˈɑbetˌeːmˈɑn arzˈeʃmand bˈɑʃad
 020 | بایَدْ مُدامْ مَشْکوکْ شَویمْ  | bˈɑjad mˈodɑm mˈaʃkuːk ʃˈavim
 021 | کِ طَرَف‌مانْ دُروغْ هَمْ می‌گویَدْ  | kˈeː tˈarafmˈɑn dˈoruːq1 hˈam miɡˈujad
 022 | راجِعْ بِ ذِهْنیاتَشْ قِضاوَتَشْ دَرْبارِ شُغْلْ ما  | rˈɑdʒeʔ beː zˌehniˈɑtaʃ q1ˌezɑvˈataʃ darbˈɑreː ʃˈoq1l mˈɑ
 023 | وَ اینْ کِ شَبْ قَبْلْ کُجا بودِ  | vˈa iːn kˈeː ʃˈab q1ˈabl kˈodʒɑ bˈuːdeː
 024 | بِهْتَرینْ کارْ اینْ اَسْتْ کِ مِثْلْ یِکْ بازْپُرْسی بی‌رَحْمْ وَ جِدّی رَفْتارْ نَکُنیمْ  | behtˈarin kˈɑr iːn ˈast kˈeː mˈesl jˈek bɑzpˈorsi birˈahm vˈa dʒˈeddi raftˈɑr nakˈonim
 025 | مِهْرْبانانِ‌تَرْ  | mˌeːhrbɑnˈɑneːtˈar
 026 | عاقِلانِ‌تَرْ  | ˈɑq1elˌɑneːtˈar
 027 | وَ بِ روحْ حَقیقی عِشْقْ نَزْدیک‌تَرْ اَسْتْ  | vˈa beː rˈuːh haq1ˈiq1i ˈeːʃq1 nˈazdiktar ˈast
 028 | اَگَرْ تَظاهُرْ کُنیمْ کِ اَصْلَاْ مُتِوَجِّ نَشُدِ‌  | ˌaɡˈar tazˈɑhor kˈonim kˈeː ˈaslan mˌotevˈadʒdʒeː naʃˈodeː
 029 | ایمْ رَبیعْ راهْ دیگَری نَدارَدْ جُزْ اینْکِ تا اَبَدْ دَرْبارِ‌یِ آنْچِ دَرْ بِرْلینْ اِتِّفاقْ اُفْتادْ دُروغْ بِگویَدْ  | iːm rˈabiʔ rˈɑh dˈiɡarˌi nˈadɑrˌad dʒˈoz ˈinkeː tɑː ˈabad darbˈɑreːjˈeː ˌɑntʃe dˈar bˈerlin ettˈefɑq1 ˈoftɑd dˈoruːq1 beɡˈujad
 030 | او مَجْبورْ بِ اینْکارْ اَسْتْ زیرا می‌دانَدْ گُفْتَنْ حَقیقَتْ  | ˈuː mˈadʒbur beː ˌiːnkɑr ˈast zirˈɑ midˈɑnad ɡˈoftan haq1ˈiq1at
 031 | دُروغْ بُزُرْگْتَری را موْجِبْ می‌شَوَدْ  | dˈoruːq1 bˈozorɡtˌari rɑ mˈodʒeb miʃavˈad
 032 | اینْ تَصَوُّرْ کامِلَاْ غَلَطْ  | iːn tasˈavvor kɑmˈelan q1ˈalat
 033 | کِ او دیگَرْ کِرِسْتِنْ را دوسْتْ نَدارَدْ  | kˈeː ˈuː dˈiɡar kerˈesten rɑ dˈuːst nˈadɑrˌad
 034 | یا اینْکِ او دیگَرْ دَرْ هیچْ زَمینِ‌ای اَزْ زِنْدِگی  | jɑː ˈinkeː ˈuː dˈiɡar dˈar hˈitʃ zamˈineːiː az zˈendeɡˌi
 035 | مَرْدْ قابِلْ اِعْتِمادی نیسْتْ  | mˈard q1ˈɑbel ˌeʔtemˈɑdi nˈist
 036 | گُفْتَنْ حَقیقَتْ  | ɡˈoftan haq1ˈiq1at
 037 | بیشْتَرْ اَزْ دُروغْ خَطَرْ ویرانْ کَرْدَنْ رابِطِ را دَرْ پِیْ دارَدْ  | bˈiʃtar az dˈoruːq1 xˈatar vˈirɑn kˈardan rˈɑbetˌeː rɑ dˈar pˈej dˈɑrad
 038 | دَرْ پِیْ اینْ رابِطِ  | dˈar pˈej iːn rˈɑbetˌeː
 039 | رَبیعْ بِ دیدْگاهْ تازِ‌ای  | rˈabiʔ beː didɡˈɑh tˈɑzeːˈiː
 040 | دَرْبارِ هَدَفْ اَزْ اِزْدِواجْ می‌رِسَدْ  | darbˈɑreː hˈadaf az ezdˈevɑdʒ mirˈesad
 041 | وَقْتی جَوان‌تَرْ بودْ فِکْرْ می‌کَرْدْ هَدَفْ اَزْ اِزْدِواجْ  | vˈaq1ti dʒavˈɑntar bˈuːd fˈekr mikˈard hˈadaf az ezdˈevɑdʒ
 042 | وَقْفْ کَرْدَنْ مَجْموعِ‌ای اَزْ اِحْساساتْ بِخُصوصْ اَسْتْ  | vˈaq1f kˈardan mˌadʒmuːʔˈeːiː az ehsˈɑsɑt bexˈosuːs ˈast
 043 | مِهْرْبانی  | meːhrbˈɑni
 044 | مِیْلْ جِنْسی شورْ وَ شوْقْ اِشْتیاقْ  | mˈeːjl dʒˈensi ʃˈuːr vˈa ʃˈoːq1 eʃtˈijɑq1
 045 | اَمّا اَکْنونْ می‌فَهْمَدْ کِ عَلاوِ بَرْ این‌ها  | ˈammˌɑ ˈaːknuːn mifˈahmad kˈeː aːlˈɑveː bar iːnhˈɑ
 046 | وَ با هَمانْ دَرَجِ اَهَمّیَتْ  | vˈa bɑ hamˈɑn darˈadʒeː ˌahammˈiːjat
 047 | اِزْدِواجْ نَهادیسْتْ کِ بایَدْ سالیانْ سالْ بَرْقَرارْ بِمانَدْ  | ezdˈevɑdʒ nˈahˈɑdist kˈeː bˈɑjad sˈɑliˌɑn sˈɑl barq1arˈɑr bemˈɑnad
 048 | بِدونْ اِرْجاعْ بِ هَرْ تَغییْرْ گُذَرایی  | bedˈuːn ˈerdʒɑʔ beː har tˈaq1iːr ɡˌozarˈɑiː
 049 | کِ دَرْ اِحْساساتْ طَرَفِیْنْ پیشْ می‌آیَدْ  | kˈeː dˈar ehsˈɑsɑt tarˈafejn pˈiʃ miˈɑjad
 050 | حَقانیَتْ آنْ  | haq1ˈɑniːjˌat ˈɑn
 051 | دَرْ پَدیدِ‌ای باثِبات‌تَرْ وَ مانْدْگارْتَرْ اَزْ اِحْساساتْ می‌گُنْجَدْ  | dˈar padˈideːiː bˈɑsebˌɑttar vˈa mɑndɡˈɑrtar az ehsˈɑsɑt miɡˈondʒad
 052 | دَرْ عَمَلی مُتِعَهِّدانِ  | dˈar amˈali mˌoteʔˌahhedˈɑneː
 053 | کِ تَجْدیدْ نَظَرْ دَرْ آنْ راهْ نَدارَدْ  | kˈeː tˈadʒdid nˈazar dˈar ɑn rˈɑh nˈadɑrˌad
 054 | وَ مُهِم‌تَرْ اَزْ آنْ دَرْ فَرْزَنْدانْ  | vˈa mˈohemtar az ɑn dˈar farzˈandɑn
 055 | دَسْتِ‌ای اَزْ موْجوداتْ کِ ذاتَاْ بِ خُشْنودی دائِمْ کَسانی کِ آنْها را بِ وُجودْ آوَرْدِ‌اَنْدْ  | dˈasteːiː az modʒˈuːdɑt kˈeː zˈɑtan beː xoʃnˈudi dɑˈem kasˈɑni kˈeː ˌɑnhɑ rɑ beː vˈodʒuːd ɑvˈardeːˈand
 056 | بی‌اِعْتِنا هَسْتَنْدْ  | bieʔtˈenɑ hˈastand
 057 | دَرْ طولْ تاریخْ  | dˈar tˈuːl tˈɑrix
 058 | اِنْسان‌ها بِ اِزْدِواج‌شانْ پایْبَنْدْ میمانَدِ‌اَنْدْ  | ensˈɑnhɑ beː ezdˈevɑdʒʃˈɑn pˈɑjband mˌimɑnˈadeːˈand
 059 | زیرا میخواسْتَنْدْ اِنْتِظاراتْ جامِعِ را بَرآوَرْدِ کُنَنْدْ  | zirˈɑ mixˈɑstand ˌentezˈɑrɑt dʒˈɑmeʔˈeː rɑ barɑvˈardeː kˈonand
 060 | دارایی چَنْدانی نَداشْتَنْدْ  | dˈɑrˈɑiː tʃandˈɑni nˈadˈɑʃtand
 061 | وَ میخواسْتَنْدْ وَحْدَتْ خانِوادِ‌شانْ را حِفْظْ کُنَنْدْ  | vˈa mixˈɑstand vˈahdat xˌɑnevˈɑdeːʃˈɑn rɑ hˈefz kˈonand
 062 | بَعْدْ بِ تَدْریجْ  | bˈaʔd beː tˈadridʒ
 063 | مِعْیارْ دیگَرْ بِسیارْ مُتَفاوِتی چیرِ شُدْ  | mˈeʔjɑr dˈiɡar besˈijɑr mˌotafˈɑvetˌi tʃˈireː ʃˈod
 064 | زوْج‌ها  | zˈoːdʒhˈɑ
 065 | تا آنْ زَمانْ با هَمْ می‌مانْدَنْدْ  | tɑː ɑn zamˈɑn bɑ hˈam mimˈɑndand
 066 | کِ اِحْساساتی بِخُصوصْ هَنوزْ بِیْنِشانْ وُجودْ داشْتْ  | kˈeː ˌehsɑsˈɑti bexˈosuːs hˈanuz bˈejneʃˌɑn vˈodʒuːd dˈɑʃt
 067 | شورْ وَ شوْقْ واقِعی  | ʃˈuːr vˈa ʃˈoːq1 vˈɑq1eʔˈi
 068 | کِشِشْ جِنْسی وَ اِحْساسْ رِضایَتْ  | kˈeʃeʃ dʒˈensi vˈa ˈehsɑs rezˈɑjat
 069 | دَرْ اینْ نِظامْ رومانْتیکْ جُدایی هَمْسَرانْ  | dˈar iːn nˈezɑm ruːmˈɑntik dʒodˈɑiː hamsarˈɑn
 070 | دَرْصورَتی موَجَّهْ بودْ کِ دَعْواهایِ روزْمَرِّ  | darsurˈati movˈadʒdʒah bˈuːd kˈeː daʔvˈɑhˈɑje ruzmˈarreː
 071 | مَلال‌آوَرْ می‌شُدَنْدْ  | malˈɑlˈɑvar miʃˈodand
 072 | فَرْزَنْدانْ اَعْصابِشانْ را بِ هَمْ میریخْتَنْدْ  | farzˈandɑn ˌaʔsɑbˈeʃɑn rɑ beː hˈam mirˈixtand
 073 | هَم‌آغوشی دیگَرْ بَرایِشانْ وَسْوَسِ‌کُنَنْدِ نَبودْ  | hˈamˈɑq1uːʃˌi dˈiɡar barˈɑjeʃˌɑn vasvˈaseːkonˈandeː nˈabuːd
 074 | یا اینْکِ هَرْ یِکْ اَزْ طَرَفِیْنْ  | jɑː ˈinkeː har jˈek az tarˈafejn
 075 | مُدَّتی بودْ کِ کَمی اِحْساسْ ناراحَتی میکَرْدْ  | mˌoddˈati bˈuːd kˈeː kˈami ˈehsɑs nɑrˈɑhatˌi mˈikard
 076 | هَرَچْقَدَرْ رَبیعْ بیشْتَرْ بِ آشُفْتِگی وَ بی‌جَهَتْ بودَنْ اِحْساساتَشْ پِیْ می‌بُرْدْ  | hˌaratʃq1ˈadar rˈabiʔ bˈiʃtar beː ˌɑʃoftˈeɡi vˈa bidʒˈahat bˈuːdan ˌehsɑsˈɑtaʃ pˈej mibˈord
 077 | بیشْتَرْ نِسْبَتْ بِ باوَرْ اِزْدِواجْ  | bˈiʃtar nˈesbat beː bˈɑvar ezdˈevɑdʒ
 078 | بِ عُنْوانْ یِکْ نَهادْ سوْقْ پِیْدا می‌کُنَدْ  | beː ˈonvɑn jˈek nˈahˈɑd sˈoq1 pˈejdɑ mikˈonad
 079 | دَرْ یِکْ کُنْفِرانْسْ  | dˈar jˈek konfˈerɑns
 080 | مُمْکِنْ اَسْتْ یِکْ زَنْ جَذّابْ را زیرْ چِشْمی بِپایِدْ  | mˈomken ˈast jˈek zˈan dʒˈazzɑb rɑ zˈir tʃˈeʃmi bepˈɑjed
 081 | وَ بِخواهَدْ بِخاطِرْ او هَمِ چیزَشْ اَزْ دَسْتْ بِدَهَدْ  | vˈa bexˈɑhad bexˈɑter ˈuː hˈameː tʃˈizaʃ az dˈast bedˈahad
 082 | اَمّا دوْ روزْ بَعْدْ  | ˈammˌɑ dˈo rˈuːz bˈaʔd
 083 | تَرْجیحْ بِدَهَدْ بِمیرَدْ وَلی بِدونْ کِرِسْتِنْ زِنْدِگی نَکُنَدْ  | tˈardʒih bedˈahad bemˈirad vˈali bedˈuːn kerˈesten zˈendeɡˌi nakˈonad
 084 | یا دَرْ آخَرْ هَفْته‌هایِ بارانی وَ طولانی  | jɑː dˈar ˈɑxar hˈafteːhˈɑje bˈɑrɑnˌi vˈa tuːlˈɑni
 085 | مُمْکِنْ اَسْتْ آرِزو کُنَدْ  | mˈomken ˈast ˈɑrezˌu kˈonad
 086 | کِ ای کاشْ فَرْزَنْدانَشْ بُزُرْگْ می‌شُدَنْدْ  | kˈeː iː kˈɑʃ fˌarzandˈɑnaʃ bozˈorɡ miʃˈodand
 087 | وَ بَرایِ هَمیشِ اَزْ خانِ می‌رَفْتَنْدْ  | vˈa barˈɑje hamˈiʃeː az xˈɑneː mirˈaftand
 088 | تا او بِتَوانَدْ مَجَلِّ‌اَشْ را دَرْ آرامِشْ بِخوانَدْ  | tɑː ˈuː betavˈɑnad madʒˈalleːaʃ rɑ dˈar ɑrˈɑmeʃ bexˈɑnad
 089 | وَ روزْ بَعْدْ دَرْ دَفْتَرْ کارَشْ شَدیدَاْ ناراحَتْ اَسْتْ اَزْ اینْکِ جَلَسِ مُمْکِنْ اَسْتْ طولانی شَوَدْ  | vˈa rˈuːz bˈaʔd dˈar dˈaftar kˈɑraʃ ʃadˈidan nɑrˈɑhat ˈast az ˈinkeː dʒalˈaseː mˈomken ˈast tuːlˈɑni ʃavˈad
 090 | وَ او یِکْ ساعَتْ دیرْ بِ خانِ بِرِسَدْ  | vˈa ˈuː jˈek sˈɑʔat dˈir beː xˈɑneː berˈesad
 091 | وَ نَتَوانَدْ بَچّه‌ها را بِخوابانْدْ  | vˈa nˈatavˌɑnad batʃtʃˈeːhɑ rɑ bexˈɑbˈɑnd
 092 | دَرْ جَریانْ زِنْدِگی زِناشویی  | dˈar dʒarˈijɑn zˈendeɡˌi zˌenɑʃˈuiː
 093 | او اَهَمّیَتْ تَدْبیرْ وَ کارْدانی را دَرَمی‌یابَدْ  | ˈuː ˌahammˈiːjat tˈadbir vˈa kɑrdˈɑni rɑ darˈamijˈɑbad
 094 | اینْ قاعِدِ کِ بِخاطِرْ پَیامَدْهایِ مُهِم‌تَرْ وَ حَسّاس‌تَرْ  | iːn q1ˈɑʔedˌeː kˈeː bexˈɑter pˌajɑmadhˈɑje mˈohemtar vˈa hˈassɑstˈar
 095 | لُزومَاْ هَمیشِ نَبایَدْ شَخْصْ چیزی را کِ دَرْ ذِهْنْ دارَدْ  | lozˈuman hamˈiʃeː nˈabˈɑjad ʃˈaxs tʃˈizi rɑ kˈeː dˈar zˈehn dˈɑrad
 096 | وَ کاری را کِ می‌خواهَدْ اَنْجامْ دَهَدْ  | vˈa kˈɑri rɑ kˈeː mixˈɑhad ˈaːndʒˈɑm dˈahad
 097 | بِ زَبانْ بیاوَرَدْ  | beː zabˈɑn bˌijɑvˈarad
 098 | رَبیعْ نیروهایِ ضِدِّ وَ نَقیضْ عاطِفی وَ هوْرْمونی را  | rˈabiʔ nˌiruːhˈɑje zˈedde vˈa nˈaq1iz ˈɑtefˌi vˈa hormˈuni rˈɑ
 099 | کِ مُدامْ او را  | kˈeː mˈodɑm ˈuː rˈɑ
 100 | بِ صَدْ جَهَتْ ناعاقِلانِ وَ بی‌نَتیجِ میکِشَنْدْ  | beː sˈad dʒˈahat nɑˈɑq1elˌɑneː vˈa binˈatidʒˌeː mikˈeʃand
 101 | بِ ذِهْنَشْ می‌سِپارَدْ  | beː zˈehnaʃ misepˈɑrad
 102 | بَها دادَنْ بِ هَرْ یِکْ اَزْ اینْها  | bˈahɑ dˈɑdan beː har jˈek az ˈiːnhɑ
 103 | بَرابَرْ خواهَدْ بودْ با اَزْ بِیْنْ بُرْدَنْ فُرْصَتْ بَرْخوْرْداری اَزْ یِکْ زِنْدِگی مُنْسَجِمْ  | barˈɑbar xˈɑhad bˈuːd bɑ az bˈejn bˈordan fˈorsat barxordˈɑri az jˈek zˈendeɡˌi monsˈadʒem
 104 | او می‌دانَدْ هَرْگِزْ پیشْرَفْتْ نَخواهَدْ کَرْدْ  | ˈuː midˈɑnad hˈarɡez pˈiʃraft nˈaxɑhˌad kˈard
 105 | اَگَرْ نَتَوانَدْ تابْ بیاوَرَدْ کِ حَدِّاَقَلْ بَرْخی اُقاتْ  | ˌaɡˈar nˈatavˌɑnad tˈɑb bˌijɑvˈarad kˈeː hˌaddeˈaq1al bˈarxi ˈoːq1ɑt
 106 | اَزْ دَرونْ ناراضی باشَدْ وَ اَزْ بیرونْ مُتِظاهِرْ  | az dˈarun nɑrˈɑzi bˈɑʃad vˈa az bˈiruːn mˌotezˈɑher
 107 | مَخْصوصَاْ راجِعْ بِ چِنینْ اِحْساساتْ گُذَرایی  | maxsˈusan rˈɑdʒeʔ beː tʃˈenin ehsˈɑsɑt ɡˌozarˈɑiː
 108 | مِثْلْ تَمایُلْ بِ رَها کَرْدَنْ فَرْزَنْدانَشْ  | mˈesl tamˈɑjol beː rahˈɑ kˈardan fˌarzandˈɑnaʃ
 109 | یا پایانْ دادَنْ بِ زِنْدِگی مُشْتَرْکِشْ  | jɑː pˈɑjɑn dˈɑdan beː zˈendeɡˌi moʃtˈarkeʃ
 110 | بِ خاطِرْ لِذَّتی یِکْ شِبْهْ  | beː xˈɑter lezzˈati jˈek ʃˈebh
 111 | با یِکْ بَرْنامِ‌ریزْ شَهْری آمْریکایی  | bɑ jˈek barnˈɑmeːrˈiz ʃˈahri ˌɑmrikˈɑiː
 112 | با چَشْمانْ خاکِسْتَری سَبْزْ فوْقُ‌العادِّ جَذّابْ  | bɑ tʃˈaʃmɑn xˈɑkestˌari sˈabz fˈoːq1olˈɑdde dʒˈazzɑb
 113 | بَرایِ رَبیعْ خِیْلی سَخْتْ خواهَدْ بودْ کِ هَمیشِ اِحْساساتَشْ او را دَرْ زِنْدِگی هِدایَتْ کُنَنْدْ  | barˈɑje rˈabiʔ xˈejli sˈaxt xˈɑhad bˈuːd kˈeː hamˈiʃeː ˌehsɑsˈɑtaʃ ˈuː rɑ dˈar zˈendeɡˌi hedˈɑjat kˈonand
 114 | او گُزارِ‌یِ شیمیایی آشُفْتِ‌ایسْتْ کِ نیازْ مُبْرَمْ بِ اُصولی بُنْیادینْ دارَدْ  | ˈuː ɡozˈɑreːjˈeː ʃˌimiˈɑiː ɑʃˈofteːˈiːst kˈeː nˈijɑz mˈobram beː osˈuli bonjˈɑdin dˈɑrad
 115 | تا دَرْ بُحْران‌هایِ عَقْلانی کوتاه‌مُدَّتَشْ  | tɑː dˈar bˈohrɑnhˈɑje aːq1lˈɑni kuːtˈɑhmˌoddˈataʃ
 116 | بِ آنْها مُتِوَسِّلْ شَوَدْ  | beː ˌɑnhɑ mˌotevˈassel ʃavˈad
 117 | او می‌دانَدْ  | ˈuː midˈɑnad
 118 | بایَدْ بِخاطِرْ اینْ موْضوع خوْشْحالْ باشَدْ  | bˈɑjad bexˈɑter iːn mˈozuː xoʃhˈɑl bˈɑʃad
 119 | کِ شَرایِطْ بیرونی‌اَشْ  | kˈeː ʃarˈɑjet birˈuːniˈaʃ
 120 | گاهی اُقاتْ مُمْکِنْ اَسْتْ با اِحْساساتْ دَرونی‌اَشْ هَمْخوانی نَداشْتِ باشَدْ  | ɡˈɑhi ˈoːq1ɑt mˈomken ˈast bɑ ehsˈɑsɑt darˈuniaʃ hamxˈɑni nˈadˈɑʃteː bˈɑʃad
 121 | اینْ شایَدْ  | iːn ʃˈɑjad
 122 | نِشانِ‌ای باشَدْ بَرْ اینْکِ  | neʃˈɑneiː bˈɑʃad bar ˈinkeː
 123 | او دَرْ مَسیرْ دُرُسْتی قَرارْ گِرِفْتِ اَسْتْ"  | ˈuː dˈar mˈasir dorˈosti q1arˈɑr ɡerˈefteː ˈast
