 000 | "فراتر از رمانتیسم صفحه دویست و یک 
 001 | نظریه دلبستگی 
 002 | صفحه دویست و سه 
 003 | با گذر زمان هر دوی آنها 
 004 | به آگاهی تازه‌ای از خامی خود میرسند 
 005 | و همزمان به این حس نیز میرسند 
 006 | که این نمی‌تواند فقط مختص آنان باشد 
 007 | مطمئنا افرادی هستند که می‌توانند 
 008 | بهتر آنان را درک کنند 
 009 | بهتر از خودشان 
 010 | سال‌ها بود که راجع به روان درمانی 
 011 | با هم شوخی می‌کردند 
 012 | اوایل کلا این شاخه علمی به سخره گرفته می‌شد 
 013 | روان درمانی مختص انسان‌های دیوانه‌ایست که پول و وقت زیادی دارند 
 014 | تمام روان درمانگرها خودشان دیوانه‌ 
 015 | اند افرادی که مشکل دارند فقط کافیست بیشتر با دوستانشان حرف بزنند 
 016 | مراجعه به یک نفر 
 017 | برای حل مشکل 
 018 | کاریست که مردم در منهتن میکنند 
 019 | نه در لوتیان اسکاتلند 
 020 | اما با هر بحث شدیدی که بینشان درمی‌گیرد 
 021 | این کلیشه‌های اطمینان‌بخش دیگر چندان متقاعدکننده به نظر نمی‌رسند 
 022 | و روزی که ربیع در واکنش به پرس و جوی کرستن راجع به صورت حساب کارت اعتباری 
 023 | با عصبانیت 
 024 | پایه یکی از صندلی‌ها را می‌شکند 
 025 | هر دو همزمان بی آنکه حرفی بزنند 
 026 | به این نتیجه می‌رسند 
 027 | که باید برای روان درمانی وقت بگیرند 
 028 | پیدا کردن روان درمانگر خوب 
 029 | کار سختیست خیلی سخت‌تر از پیدا کردن مثلا آرایشگر ماهر 
 030 | کسی که شاید 
 031 | در نوع خدمتی که ارائه می‌دهد کمتر این ادعای جاه‌طلبانه را داشته باشد 
 032 | که از بشریت مراقبت می‌کند 
 033 | پرسش از اطرافیان هم دشوار است 
 034 | چرا که مردم این پرسش را 
 035 | نشانه‌ای از وجود مشکلات در زندگی زناشویی آنان قلمداد می‌کنند 
 036 | به جای اینکه آن را گواهی بر مستحکم بودن و عمر طولانی و پر آتیه زندگی آنان بدانند 
 037 | همچون بیشتر چیزهایی 
 038 | که کاملا در سیر عشق کمک کننده هستند 
 039 | مشاوره هم به شدت غیر رمانتیک به نظر می‌رسد 
 040 | بالاخره از طریق جستجوی آنلاین 
 041 | یک نفر را پیدا می‌کنند 
 042 | متخصصی با مطب شخصی در مرکز شهر 
 043 | که در وبسایت ساده‌اش ذکر شده 
 044 | کارشناس مشکلات زوج‌ها 
 045 | این عبارت به نظر اطمینان بخش است 
 046 | مشکلات آنان منحصر به فرد نیستند 
 047 | بلکه قسمتی از چیزی اند که درون یک واحد بررسی شده اتفاق می‌افتد 
 048 | و در سرتاسر جهان 
 049 | مشکل‌ساز است 
 050 | دفتر مشاوره 
 051 | در طبقه سوم ساختمان قدیمی دلگیری 
 052 | مربوط به اواخر قرن نوزدهم است 
 053 | اما فضای داخلش گرم و خوشایند است 
 054 | پر از کتاب و روزنامه و نقاشی منظره 
 055 | روان‌درمانگر خانم فربرن روپوش سرمه‌ای ساده‌ای به تن دارد 
 056 | و کلاه‌خودی بزرگ از موهای خاکستری 
 057 | محکم پیچیده شده روی سرش 
 058 | و چهره‌ای ظاهرا آرام و صمیمی 
 059 | وقتی در اتاق مشاوره می‌نشیند 
 060 | پاهایش فاصله‌ی زیادی با زمین دارند 
 061 | ربیع بعدا 
 062 | با بدجنسی پیش خودش فکر میکند که این پا گنده 
 063 | به نظر نمی‌رسد آنقدری تجربیات احساسی شخصی داشته باشد 
 064 | که ادعا کند متخصص آن 
 065 | است ربیع متوجه جعبه‌ی بزرگ دستمال کاغذی 
 066 | روی میز کوچک بین خودش و کرستن می‌شود 
 067 | و درون خود موجی از اعتراض نسبت به معنای ضمنی وجود آن جعبه در آنجا حس می‌کند 
 068 | او اصلا دلش نمی‌خواهد این دعوت به گریه را بپذیرد 
 069 | و غم و غصه‌های بغرنجش را در حضور دیگران 
 070 | در توده‌ای دستمال کاغذی بریزد 
 071 | وقتی خانم فربرن دارد شماره تلفن آن‌ها را یادداشت می‌کند 
 072 | ربیع نزدیک است این روند را متوقف کند 
 073 | و اعلام کند که آمدن آن‌ها به آنجا 
 074 | در حقیقت اشتباه بوده 
 075 | یعنی درواقع واکنش افراطی نمایشی‌ای بوده 
 076 | به چند بگو مگو که بینشان اتفاق افتاده 
 077 | و این که حالا که بهتر نگاه میکند 
 078 | میبیند که رابطه‌شان کاملا خوب است 
 079 | و تازه مواقعی هم هست که رابطه‌شان خیلی خوب است 
 080 | او میخواهد از اتاق بزند بیرون 
 081 | و به دنیای معمولی برگردد 
 082 | برود به آن کافه گوشه خیابان 
 083 | جایی که او و کرستن ساندویچ تن و یک لیوان نوشیدنی خوشبو بخورند 
 084 | و زندگی عادی‌اشان را ادامه بدهند 
 085 | زندگی‌ای که به خاطر احساس اشتباه بی‌کفایتی 
 086 | به طرز عجیبی به اراده خود از آن محروم شده بودند 
 087 | روان درمانگر کاملا شمرده 
 088 | و با لهجهٔ افراد سطح بالای ادینبرو می‌گوید 
 089 | اجازه بدید با توضیح یه سری چیزها شروع کنیم 
 090 | پنجاه دقیقه فرصت داریم 
 091 | که از روی ساعت بالای شومینه 
 092 | میتونید حسابش رو داشته باشید 
 093 | ممکنه الان کمی دلواپس باشید 
 094 | که اگر اینطور نبود عجیب بود 
 095 | همینطور ممکنه فکر کنید من همه‌چیز رو درباره شما میدونم 
 096 | یا اینکه محاله که چیزی راجع به شما بدونم 
 097 | که البته هیچکدوم کاملا درست نیست 
 098 | ما با هم قراره مسائل رو بررسی کنیم 
 099 | لازمه که بخاطر اومدنتون به اینجا 
 100 | بهتون تبریک بگم 
 101 | میدونم که این کار 
 102 | نیاز به شجاعت داره 
 103 | صرفا با توافق بر سر اینکه اینجا بیایید 
 104 | یکی از بزرگترین قدم‌هایی رو برداشتید 
 105 | که دو نفر ممکنه بردارند 
 106 | تا برای با هم موندن تلاش کنن 
 107 | پشت سرش قفسه‌ایست از کتاب‌های مربوط به کارش 
 108 | خود و مکانیزم‌های دفاعی آن 
 109 | خانه جاییست که از آن شروع می‌کنیم 
 110 | اضطراب جدایی 
 111 | بازتاب عشق در روان‌درمانی زوج‌ها 
 112 | و خویشتن و دیگری 
 113 | در نظریه روابط موضوعی 
 114 | خودش هم در حال نوشتن اولین کتابش 
 115 | است به نام دلبستگی ایمن 
 116 | و دلبستگی اضطرابی 
 117 | در روابط زناشویی 
 118 | که از سوی ناشری معمولی در لندن 
 119 | چاپ خواهد شد 
 120 | او با لحنی صمیمانه‌تر ادامه می‌دهد 
 121 | خوب بهم بگو چی باعث شد به این نتیجه برسی 
 122 | که بیای اینجا و من رو ببینی 
 123 | کرستن توضیح می‌دهد که آنها هفده سال قبل با هم آشنا شده‌اند 
 124 | دو فرزند دارند 
 125 | هر دو در سن کم یکی از والدینشان را از دست داده‌اند 
 126 | زندگی آنها پرمشغله 
 127 | رضایت‌بخش 
 128 | و گاهی اوقات جهنمیست 
 129 | او از بگو مگو هایی که می‌کنند متنفر است 
 130 | از دید او شوهرش بیشتر اوقات دیگر آن مردی نیست که او عاشقش شد 
 131 | او عصبانی می‌شود درها را به هم می‌کوبد 
 132 | و کرستن را با لفظ خیلی زشتی صدا کرده است 
 133 | خانم فربرن 
 134 | با آرامشی که آنها بعدا بیشتر با آن آشنا خواهند شد 
 135 | سرش را از روی یادداشتی که مینویسد بلند می‌کند 
 136 | ربیع تصدیق می‌کند که همه‌ی حرف‌های کرستن درست است 
 137 | اما سردی و تحقیر خاموش گاه به گاه کرستن 
 138 | موجب سرخوردگی ربیع می‌شود 
 139 | و به نظرش می‌رسد 
 140 | هدفش عصبانی کردن ربیع است 
 141 | واکنش کرستن در برابر نگرانی‌ها 
 142 | چه مربوط به خودش باشند چه ربیع 
 143 | سکوت است و بی‌محلی به ربیع 
 144 | اغلب ربیع از او می‌پرسد که اصلا علاقه‌ای به او دارد یا نه 
 145 | نظریهٔ دلبستگی 
 146 | که توسط روانشناس جان بولبی و همکارانش در انگلستان در دههٔ هزار و نهصد و پنجاه به وجود آمد 
 147 | تنش‌ها و کشمکش‌های روابط را 
 148 | در تجربهٔ اولیه‌مان از مراقبت والدین 
 149 | ردیابی می‌کند 
 150 | برآورد می‌شود که یک سوم جمعیت اروپای غربی و آمریکای شمالی 
 151 | به نوعی در کودکی از سوی والدین خود دچار سرخوردگی شده‌اند 
 152 | بنگرید به سی. بی واسیلی دو هزار و سیزده 
 153 | در نتیجه 
 154 | مکانیزم‌های دفاعی اولیه 
 155 | برای دفع ترس‌های توام با اضطرابی توان‌فرسا 
 156 | درگیر شده‌اند 
 157 | و توانایی اعتماد کردن و صمیمیت مختل شده است 
 158 | بولبی در کتاب فوق‌العاده خود 
 159 | جدایی و اضطراب 
 160 | هزار و نهصد و پنجاه و نه 
 161 | استدلال می‌کند 
 162 | افرادی که در سن کم 
 163 | به خاطر شرایط خانوادگی خود مایوس شده‌اند 
 164 | در بزرگسالی 
 165 | و در مواجهه با مشکلات یا ابهامات موجود در روابطشان 
 166 | عموما دو نوع واکنش نشان خواهند داد 
 167 | اول 
 168 | تمایل به رفتاری هراسناک چسبنده 
 169 | و کنترل‌کننده 
 170 | نمونه‌ای که بولبی دلبستگی اضطرابی می‌نامد 
 171 | و دوم تمایل به عقب‌نشینی دفاعی 
 172 | که او دلبستگی اجتنابی می‌نامد 
 173 | فرد مضطرب مایل است مدام شریک زندگی‌اش را چک کند 
 174 | برون‌ریزی ناگهانی حسادت داشته باشد 
 175 | و بیشتر عمرش حسرت بخورد 
 176 | که روابطش صمیمانه‌تر نیست 
 177 | فرد اجتناب‌کننده به نوبهٔ خود 
 178 | از نیاز به فاصله صحبت می‌کند 
 179 | از تنهایی خود لذت می‌برد 
 180 | و در مواقعی از مقتضیات صمیمیت جنسی در هراس است 
 181 | نزدیک به هفتاد درصد افرادی که 
 182 | به زوج درمانی پناه می‌برند 
 183 | یا رفتار مضطرب از خود بروز می‌دهند 
 184 | یا رفتار اجتناب‌کننده 
 185 | اغلب در زوج‌ها 
 186 | یکی از طرفین اجتناب‌کننده است 
 187 | و دیگری مضطرب 
 188 | و در مسیر مارپیچ زوال اعتماد 
 189 | با هر واکنشی یکدیگر را بیشتر اذیت می‌کنند 
 190 | دکتر جوئنا فربرن 
 191 | دلبستگی ایمن و دلبستگی اضطرابی در روابط زناشویی 
 192 | از منظر روابط موضوعی 
 193 | نشر کارناک لندن به‌زودی 
 194 | بهتر است بپذیریم 
 195 | که آنها قرار نیست خودبه‌خود یکدیگر را درک کنند 
 196 | اینجا بودن آنها به این معنیست که از درون‌یابی آنچه ممکن است 
 197 | درون معشوقشان در حال وقوع باشد 
 198 | دست کشیده‌اند 
 199 | رویاهای رومانتیک در طول ماه‌ها 
 200 | جای خود را 
 201 | به بررسی موشکافانهٔ برخی موارد به ظاهر جزئی زندگی خانوادگی می‌دهند 
 202 | گرچه از دید خانم فربرن این‌ 
 203 | ها اصلا مواردی جزئی نیستند 
 204 | گفتهٔ مهربانانه 
 205 | بی‌حوصلگی موقتی 
 206 | و لحن تند و آسیب‌زننده 
 207 | در واقع مواد خام حرفهٔ او هستند 
 208 | خانم فربرن کمک می‌کند 
 209 | تا بمب‌ها را خنثی کنند 
 210 | شاید احمقانه به نظر برسد 
 211 | که پنجاه دقیقه 
 212 | و هفتاد و پنج پوند خرج کنند 
 213 | به خاطر نحوهٔ جواب دادن ربیع 
 214 | وقتی کرستن 
 215 | برای دومین بار او را صدا می‌زند 
 216 | تا از طبقه بالا پایین بیاید 
 217 | و میز را بچیند 
 218 | یا نحوهٔ واکنش کرستن 
 219 | به نمرات پایین استر 
 220 | در درس جغرافیا 
 221 | اما این‌ها زمینه‌های پرورش موضوعاتی هستند 
 222 | که اگر بررسی نشوند 
 223 | ممکن است به همان فجایعی تبدیل شوند 
 224 | که جامعه درگیرشان است 
 225 | خشونت خانگی 
 226 | از هم پاشیدن خانواده 
 227 | مداخله خدمات اجتماعی 
 228 | احکام قضایی 
 229 | همه چیز 
 230 | با تحقیرهای جزئی 
 231 | و مایوس کردن آغاز می‌شود 
 232 | امروز ربیع بگومگوی شب قبل را پیش می‌کشد 
 233 | بحث راجع به کار و پول بوده است 
 234 | این خطر وجود دارد 
 235 | که کار ربیع معلق شود 
 236 | یا حقوقش در آیندهٔ نزدیک کاهش پیدا کند 
 237 | و این باعث خواهد شد نتوانند 
 238 | قسط‌های وام مسکن را پرداخت کنند 
 239 | کرستن 
 240 | رفتاری از سر بی‌اعتنایی نشان داده 
 241 | چرا همسرش 
 242 | وقتی با چیزی به این مهمی مواجه می‌شود 
 243 | همیشه چنین بی‌اعتنا عکس‌العمل نشان می‌دهد 
 244 | نمی‌تواند چیزی بگوید 
 245 | که کمکی بکند 
 246 | اصلا درست حرف ربیع را شنیده 
 247 | چرا بیشتر اوقات 
 248 | وقتی ربیع بیشتر از همیشه به حمایتش نیاز دارد 
 249 | با یک 
 250 | هوممم بی‌معنی جواب می‌دهد 
 251 | به همین خاطر بود که ربیع سرش داد کشید فحش داد و رفت کار درستی نبود 
 252 | ولی کرستن هم واقعا داشت او را مایوس می‌کرد 
 253 | یکی از نشانه‌های شخص دل‌بستهٔ مضطرب 
 254 | ناتوانی در تحمل موقعیت‌های پیچیده 
 255 | و واکنش نمایشی 
 256 | به چنین موقعیت‌هاییست 
 257 | همچون سکوت 
 258 | درنگ یا سخنی توام با بی‌اعتنایی 
 259 | این‌ها به سرعت 
 260 | با منفی‌نگری به توهین یا حمله‌های بدخواهانه تعبیر می‌شوند 
 261 | برای شخصی که دل‌بستگی اضطرابی دارد 
 262 | هر گونه توهین جزئی 
 263 | حرف تند یا بی‌توجهی 
 264 | ممکن است به عنوان تهدیدی جدی تلقی شود 
 265 | که پیام‌آور فروپاشی رابطه است 
 266 | توضیحات موضوعی بیشتر 
 267 | از دسترس خارج می‌شوند 
 268 | این افراد از درون اغلب حس می‌کنند انگار برای زندگی‌شان 
 269 | در حال جنگیدن‌اند 
 270 | گرچه معمولا نمیتوانند آسیب‌پذیری خود را 
 271 | برای اطرافیان‌شان شرح دهند 
 272 | چرا که اطرافیان طبیعتا ممکن است در عوض 
 273 | برچسب بدخلق زودرنج 
 274 | یا بی‌رحم به آنان بزنند 
 275 | کرستن با اعتراض می‌گوید که چه حرف احمقانه‌ای 
 276 | ربیع دوباره دارد اغراق می‌کند 
 277 | همانطور که راجع به خیلی چیزها این کار را می‌کند 
 278 | از شدت باران گرفته 
 279 | تا میزان بد بودن غذای رستوران 
 280 | مثل موقعی که به پرتغال رفته بودند 
 281 | و تا چند ماه بعد از آن سفر 
 282 | فقط دربارهٔ این می‌گفت که چه هتل مزخرفی بود 
 283 | انگار که دنیا به آخر رسیده بود 
 284 | حتی وقتی می‌دید که بچه‌ها از هتل خوششان آمده بود 
 285 | کرستن اضافه می‌کند که واکنش او 
 286 | مطمئنا واکنش خود ربیع را توجیه نمی‌کند 
 287 | ارزشش را داشت که آن‌طور با خشم از اتاق بیرون برود؟ 
 288 | کدام انسان بالغی 
 289 | چنین رفتاری نشان می‌دهد 
 290 | کرستن به طور ضمنی خانم فربرن را تحریک می‌کند که تصدیق کند بین آن دو نفر 
 291 | اوست که عاقلانه رفتار می‌کند 
 292 | و به عنوان یک همجنس می‌خواست خانم فربرن را 
 293 | ترغیب به همراهی 
 294 | در حیرت از حماقت و بزرگ‌نمایی مردان کند 
 295 | اما خانم فربرن 
 296 | دوست ندارد تحت فشار قرار بگیرد 
 297 | تا از کسی طرفداری کند 
 298 | این بخشی از نبوغ اوست 
 299 | او اهمیت نمی‌دهد که شخص حق را به خودش بدهد 
 300 | بلکه می‌خواهد بفهمد هرکدام چه حسی دارند 
 301 | و سپس مطمئن شود که طرف مقابل آن حس را همدلانه درک میکند" 
  | undefined 
