 000 | « صَفْحِ‌یِ دِویسْتْ وَ نه  | sˈafheːjˈe dˈevist vˈa nˈa
 001 | اِدامِ‌یِ نَظَریِ‌یِ دِلْبَسْتِگی  | edˈɑmeːjˈe nˈazarˌijejˈe delbˈasteɡˌi
 002 | اَمّا خانُمِ فَرْبَرَنْ  | ˈammˌɑ xɑnˈome farbˈaran
 003 | دوسْتْ نَدارَدْ تَحْتِ فِشارْ قَرارْ بِگیرَدْ  | dˈuːst nˈadɑrˌad tahtˈe fˈeʃɑr q1arˈɑr beɡˈirad
 004 | تا اَزْ کَسی طَرَفْداری کُنَدْ  | tɑː az kˈasi tˌarafdˈɑri kˈonad
 005 | اینْ بَخْشی اَزْ نُبوغِ اوسْتْ  | iːn bˈaxʃi az nobˈuq1e ˈuːst
 006 | او اَهَمّیَتْ نِمی‌دَهَدْ کِ شَخْصِ حَقْ را بِ خُدَشْ بِدَهَدْ  | ˈuː ˌahammˈiːjat nˌemidˈahad kˈeː ʃˈaxse hˈaq1 rɑ beː xˌodaʃ bedˈahad
 007 | بَلْکِ می‌خاهَدْ بِفَهْمَدْ هَرْ کُدامْ چِ حِسی دارَنْدْ  | bˈalkeː mixˈɑhad befˈahmad har kˈodɑm tʃeː hˈesi dˈɑrand
 008 | وَ سِپَسْ مُطْمَئِنْ شَوَدْ کِ طَرَفِ مُقابِلِ  | vˈa sˈepas mˈotmˌaen ʃavˈad kˈeː tarˈafe mˌoq1ɑbˈele
 009 | آنْ حِسْ را هَمْدِلانِ دَرْکْ می‌کُنَدْ  | ɑn hˈes rɑ hˌamdelˈɑne dˈark mikˈonad
 010 | اَزْ رَبیعْ می‌پُرْسَدْ  | az rˈabiʔ mipˈorsad
 011 | اینْطُرْ مَواقِعْ کِ کِرِسْتِنْ زیادْ چیزی نِمی‌گَهْ  | ˈintoːr mavˈɑq1eʔ kˈeː kerˈesten ziˈɑd tʃˈizi nˌemiɡˈah
 012 | بِهِشْ چِ حِسی داری  | bˈeheʃ tʃeː hˈesi dˈɑri
 013 | رَبیعْ فِکْرْ می‌کُنَدْ چِ سُؤالْ بیخُدی  | rˈabiʔ fˈekr mikˈonad tʃeː soʔˈɑl bixˈodi
 014 | ناراحَتی شَبِ قَبْلْ  | nɑrˈɑhatˌi ʃˈabe q1ˈabl
 015 | دُبارِ دارَدْ دَرْ او اِحْیا می‌شَوَدْ  | dobˈɑreː dˈɑrad dˈar ˈuː ˈehjɑ miʃavˈad
 016 | دَقیقَنْ هَمونْ حِسی رو دارَمْ کِ شُما اِنْتِظارْ داریدْ  | daq1ˈiq1an hˈamun hˈesi rˈu dˈɑram kˈeː ʃˈomɑ ˌentezˈɑr dˈɑrid
 017 | اینْکِ اونْ وَحْشَتْناکِ  | ˈinkeː ˈuːn vˌahʃatnˈɑkeː
 018 | کِرِسْتِنْ مُداخِلِ می‌کُنَدْ وَ می‌گویَدْ  | kerˈesten mˌodɑxˈeleː mikˈonad vˈa miɡˈujad
 019 | وَحْشَتْناکْ  | vahʃˈatnɑk
 020 | فَقَطْ بِ اینْ خاطِرْ کِ هَمونْ چیزی رو نَمیگَمْ کِ تُ می‌خایِ بِشِنَوی وَحَشَتَناکَمِ  | fˈaq1at beː iːn xˈɑter kˈeː hˈamun tʃˈizi rˈu nˈamiɡˌam kˈeː tˈo mixˈɑje bˌeʃenˈavi vˌahaʃˌatanˈɑkamˌe
 021 | خانُمِ فَرْبَرَنْ می‌گویَدْ  | xɑnˈome farbˈaran miɡˈujad
 022 | یِ لَحْظِ لُطْفَنْ اِجازِ بِدِ کِرِسْتِنْ  | jˈeː lˈahzeː lˈotfan edʒˈɑzeː bˈedeː kerˈesten
 023 | میخامْ کَمی بیشْتَرْ اِحْساساتِ رَبیعْ رو دَرْ چِنینْ مَواقِعی بَرْرَسی کُنَمْ  | mixˈɑm kˈami bˈiʃtar ˌehsɑsˈɑte rˈabiʔ rˈu dˈar tʃˈenin mavˈɑq1eʔˌi barrˈasi kˈonam
 024 | وَقْتی فِکْرْ می‌کُنی  | vˈaq1ti fˈekr mikˈoni
 025 | کِرِسْتِنِ تُ رو مایوسْ کَرْدِ  | kˌerestˈene tˈo rˈu mˈɑjus kˈardeː
 026 | چِ حِسی داری  | tʃeː hˈesi dˈɑri
 027 | رَبیعْ بی آنْکِ تَحَمُّلْ کُنَدْ  | rˈabiʔ bi ˈɑnkeː tahˈammol kˈonad
 028 | اِجازِ می‌دَهَدْ بَرایِ یِکْبارْ هَمْ کِ شُدِ  | edʒˈɑzeː midˈahad bˌarɑjˈe jekbˈɑr hˈam kˈeː ʃˈodeː
 029 | ناخُدآگاهَشْ بِ جایِ او حَرْفْ بِزَنَدْ  | nɑxˈodɑːɡˌɑhaʃ beː dʒˌɑje ˈuː hˈarf bezˈanad
 030 | تَرْسِ رَهاشْدِگیِ دَرْمانْدِگی  | tˈarse rahˈɑʃdeɡˌie darmɑndˈeɡi
 031 | اَکْنونْ سُکوتْ بَرْقَرارْ شُدِ_اَسْتْ  | ˈaːknuːn sˈokuːt barq1arˈɑr ʃˈodeː ˈast
 032 | اَغْلَبْ بَعْدْ اَزْ اینْکِ یِکی اَزْ آنْها حَرْفِ مُهِمی می‌زَنَدْ چِنینْ اَسْتْ  | ˈaːq1lab bˈaʔd az ˈinkeː jˈeki az ˌɑnhɑ hˈarfe mˈohemˌi mizˈanad tʃˈenin ˈast
 033 | اِحْساسِ تَنْهایی میکُنَمْ  | ehsˈɑse tanhˈɑiː mikˈonam
 034 | اِحْساسِ بی‌اَرْزِشی میکُنَمْ  | ehsˈɑse biarzˈeʃi mikˈonam
 035 | اِحْساسْ میکُنَمْ  | ˈehsɑs mikˈonam
 036 | اونْ کَمْتَرینْ اَهَمّیَتی بِ مَنْ نِمی‌دَهْ  | ˈuːn kˈamtarˌin ˌahammiːjˈati beː man nˌemidˈah
 037 | رَبیعْ ساکِتْ می‌شَوَدْ  | rˈabiʔ sˈɑket miʃavˈad
 038 | شایَدْ غِیْرِمُنْتَظِرِ اَسْتْ  | ʃˈɑjad q1ˈejremˌontazˌereː ˈast
 039 | اَمّا اَشْکْ دَرْ چَشْمانَشْ جَمْعْ شُدِ_اَسْتْ  | ˈammˌɑ ˈaʃk dˈar tʃaʃmˈɑnaʃ dʒˈamʔ ʃˈodeː ˈast
 040 | خانُمِ فَرْبَرَنْ  | xɑnˈome farbˈaran
 041 | با لَحْنی خُنْثاْ اَمّا مُشْتاقِ شِنیدَنْ می‌گویَدْ  | bɑ lˈahni xˈonsɑ ˈammˌɑ moʃtˈɑq1e ʃenˈidan miɡˈujad
 042 | ظاهِرَنْ سَخْتِ  | zɑhˈeran sˈaxteː
 043 | کِرِسْتِنْ می‌گویَدْ  | kerˈesten miɡˈujad
 044 | وَلی بِ نَظَرِ مَنْ نِمی‌رُسِ تَرْسیدِ باشِ  | vˈali beː nˈazarˌe man nˌemirˈoseː tarsˈideː bˈɑʃeː
 045 | کَسی کِ دادْ میزَنِ وَ بِ هَمْسَرَشْ فُحْشْ میدِ  | kˈasi kˈeː dˈɑd mizˈaneː vˈa beː hamsˈaraʃ fˈohʃ mˈideː
 046 | بِ نَظَرِ نِمی‌رُسِ کانْدیدایِ خوبی  | beː nˈazarˌe nˌemirˈoseː kˈɑndidˈɑje xˈuːbi
 047 | بَرایِ کَسْبِ عُنْوانِ بَرِ‌یِ کوچولویِ بی‌چارِ‌یِ تَرْسیدِ باشِ  | bˌarɑjˈe kˈasbe onvˈɑne bˌareːjˈe kˌuːtʃuːluːjˈe bitʃˈɑreːjˈeː tarsˈideː bˈɑʃeː
 048 | خانُمْ فَرْبَرَنْ  | xˈɑnom farbˈaran
 049 | مُشْکِلْ را با اَنْبُرِ دَرْمانیِ خُدْ مُحْکَمْ گِرِفْتِ  | mˈoʃkel rɑ bɑ anbˈore dˌarmɑnˈie xod mˈohkam ɡerˈefteː
 050 | وَ نِمی‌گُذارَدْ اَزْ دَسْتَشْ دَرْ بِرَوَدْ  | vˈa nˌemiɡozˈɑrad az dˈastaʃ dˈar berˈavad
 051 | رِوالِ خاصی وُجودْ دارَدْ  | revˈɑle xˈɑsi vˈodʒuːd dˈɑrad
 052 | رَبیعْ دَرْ مَواقِعی کِ اِحْتیاجْ بِ حِمایَتْ  | rˈabiʔ dˈar mavˈɑq1eʔˌi kˈeː ehtˈijɑdʒ beː hemˈɑjat
 053 | وَ اِطْمینانِ خاطِرْ دارَدْ  | vˈa ˌetminˈɑne xˈɑter dˈɑrad
 054 | کِرِسْتِنْ را سَرْدْ وَ دَرْ خُدِ فُرو رَفْتِ می‌یابَدْ  | kerˈesten rɑ sˈard vˈa dˈar xˌode fˈoru rˈafteː mijˈɑbad
 055 | او میتَرْسَدْ عَصَبانی می‌شَوَدْ  | ˈuː mitˈarsad ˌasabˈɑni miʃavˈad
 056 | وَ بَعْدْ کِرِسْتِنْ را حَتّا بیشْتَرْ دَرْ خُدْ فُرورَفْتِ می‌یابَدْ  | vˈa bˈaʔd kerˈesten rɑ hˌattˈɑ bˈiʃtar dˈar xod fˌorurˈafteː mijˈɑbad
 057 | اینْ تَرْسْ وَ عَصَبانیَتْ بیشْتَرْ می‌شَوَدْ  | iːn tˈars vˈa ˌasabɑnˈijjat bˈiʃtar miʃavˈad
 058 | وَ فاصِلِ نیزْ بیشْتَرْ  | vˈa fˈɑselˌeː nˈiz bˈiʃtar
 059 | کِرِسْتِنِ او را بِ عُنْوانِ فَرْدی خُدْبینْ وَ زورْگو میبینَدْ  | kˌerestˈene ˈuː rɑ beː onvˈɑne fˈardi xˌodbin vˈa zˈuːrɡu mibˈinad
 060 | گُذَشْتِ کِرِسْتِنْ بِ او آموخْتِ کِ مَرْدْها  | ɡozˈaʃteː kerˈesten beː ˈuː ɑmˈuxteː kˈeː mˈardhɑ
 061 | تَمایُلِ ذاتی  | tˌamɑjˈole zˈɑti
 062 | بِ رَفْتارِ سُلْطِ‌گَرایانِ دارَنْدْ  | beː raftˈɑre sˈolteːɡarˈɑjɑnˌeː dˈɑrand
 063 | وَ اینْکِ اینْ زَنْ اَسْتْ کِ بایَدْ با قُدْرَتْ وَ جِدّیَتِ  | vˈa ˈinkeː iːn zˈan ˈast kˈeː bˈɑjad bɑ q1odrˈat vˈa dʒˌeddijˈate
 064 | جُلُیِ اینْ رَفْتارْ بَأْیْسْتَدْ  | dʒˌolojˈe iːn raftˈɑr bˈaʔjstad
 065 | اِمْکانِ بَخْشِشْ دَرْ اینْ مَواقِعْ وُجودْ نَدارَدْ  | emkˈɑne bˈaxʃeʃ dˈar iːn mavˈɑq1eʔ vˈodʒuːd nˈadɑrˌad
 066 | اَمّا دَرْ رَبیعْ هیچْ قُدْرَتی وُجودْ نَدارَدْ  | ˈammˌɑ dˈar rˈabiʔ hˈitʃ q1odrˈati vˈodʒuːd nˈadɑrˌad
 067 | او کِ با بی اِعْتِنایی آشْکارْ کِرِسْتِنِ تَحْقیرْ شُدِ  | ˈuː kˈeː bɑ bi ˌeʔtenˈɑiː ˈɑʃkɑr kˌerestˈene tˈahq1ir ʃˈodeː
 068 | فَقَطْ دَسْتْ وَ پا می‌زَنَدْ  | fˈaq1at dˈast vˈa pˈɑ mizˈanad
 069 | دَرْمانْدِ وَ ناتَوانْ  | darmˈɑndeː vˈa nɑtˈavɑn
 070 | بَنابَراینْ تَأَسُّف‌آوَرْ وَ حَتّا تَقْریبَنْ فاجِعِ اَسْتْ  | bˌanɑbˈarin taʔˈassofˈɑvar vˈa hˌattˈɑ taq1rˈiban fˈɑdʒeʔˈeː ˈast
 071 | کِ نَحْوِ‌یِ واکُنِشْ نِشانْ دادِنِ رَبیعْ بِ نُقاطِ ضَعْفَشْ  | kˈeː nahvˈejˈe vɑkˈoneʃ nˈeʃɑn dˈɑdenˌe rˈabiʔ beː noq1ˈɑte zˈaʔfaʃ
 072 | بِ گونِ‌ایسْتْ کِ کامِلَنْ آنْ ضَعْف‌ها را می‌پوشانْدْ  | beː ɡˈuneːˈiːst kˈeː kɑmˈelan ɑn zˈaʔfhɑ rɑ mipuːʃˈɑnd
 073 | وَ باعِثْ می‌شَوَدْ  | vˈa bˈɑʔes miʃavˈad
 074 | کَسی را کِ شَدیدَنْ بِ دِلْداری‌اَشْ نیازْ دارَدْ  | kˈasi rɑ kˈeː ʃadˈidan beː deldˈɑriaʃ nˈijɑz dˈɑrad
 075 | اَزْ خُدْ بِرانَدْ  | az xod berˈɑnad
 076 | اَمّا اَکْنونْ  | ˈammˌɑ ˈaːknuːn
 077 | یِکْ بارْ دَرْ هَفْتِ‌  | jˈek bˈɑr dˈar hˈafteː
 078 | یِ چاهارْشَنْبِ‌ها ظُهْرْ  | jˈe tʃˌɑhɑrʃˈanbeːhɑ zˈohr
 079 | فُرْصَتی پیشْ می‌آیَدْ  | forsˈati pˈiʃ miˈɑjad
 080 | کِ اینْ چَرْخِ‌یِ ناپَسَنْدْ مُتِوَقِّفْ شَوَدْ  | kˈeː iːn tʃˈarxeːjˈe nɑpˌasand mˌotevˈaq1q1ef ʃavˈad
 081 | خانُمِ فَرْبَرَنْ اَزْ کِرِسْتِنْ  | xɑnˈome farbˈaran az kerˈesten
 082 | دَرْ بَرابَرِ آزارِ رَبیعْ مُحافِظَتْ می‌کُنَدْ  | dˈar bˌarɑbˈare ˈɑzˈɑre rˈabiʔ mˌohɑfˈezat mikˈonad
 083 | وَ اَزْ رَبیعْ  | vˈa az rˈabiʔ
 084 | دَرْ بَرابَرِ سَرْدی وَ دَرون‌گَراییِ کِرِسْتِنْ  | dˈar bˌarɑbˈare sˈardi vˈa dˈarunɡarˈɑiːˌe kerˈesten
 085 | اَزْ هَرْ یِکْ اَزْ آن‌ها خاسْتِ_می‌شَوَدْ با دِقَّتْ  | az har jˈek az ɑnhɑ xˈɑsteː miʃavˈad bɑ dˈeq1q1at
 086 | بِ زیرْ ظاهِرِ آزارْدَهَنْدِ‌یِ دیگَری نِگاهْ کُنَنْدْ  | beː zˈir zˈɑherˌe ˈɑzˈɑrdahˌandeːjˈe dˈiɡarˌi nˈeɡɑh kˈonand
 087 | تا کودَکْ دَرونِ تَرْسیدِ وَ مَفْلوکْ را بِبینَنْدْ  | tɑː kˈuːdak darˈune tarsˈideː vˈa mˈafluːk rɑ bebˈinand
 088 | خانُمِ فَرَبْرَنِ  | xɑnˈome fˌarabrˈane
 089 | هَرْ زَمانْ کِ اِحْساسْ کُنَدْ  | har zamˈɑn kˈeː ˈehsɑs kˈonad
 090 | مُراجِعِ‌یِ کُنَنْدِ‌اَشْ دَرْ شَرَفِ دَسْت‌یابی بِ بینِشی خاصْ اَسْتْ  | mˌorɑdʒˈeʔeːjˈe konˈandeːaʃ dˈar ʃarˈafe dˈastjˈɑbi beː binˈeʃi xˈɑs ˈast
 091 | خَطَرْ می‌کُنَدْ وَ مُسْتَقیم‌تَرْ وارِدِ صُحْبَتْ می‌شَوَدْ  | xˈatar mikˈonad vˈa mostˈaq1imtar vˈɑredˌe sˈohbat miʃavˈad
 092 | کِرِسْتِنْ  | kerˈesten
 093 | فِکْرْ می‌کُنی دادْزَدَنْ وَ گاهی فُحْش‌دادَنْ  | fˈekr mikˈoni dˈɑdzadˌan vˈa ɡˈɑhi fˈohʃdˈɑdan
 094 | کارْهایی هَسْتَنْدْ کِ یِ مَرْدِ قَوی اَنْجامْ می‌دَهْ  | kɑrhˈɑiː hˈastand kˈeː jˈeː mˈarde q1ˈavi ˈaːndʒˈɑm midˈah
 095 | او می‌دانَدْ چِطُرْ آرامْ آرامْ پیشْ بِرَوَدْ  | ˈuː midˈɑnad tʃˈetor ˈɑrˈɑm ˈɑrˈɑm pˈiʃ berˈavad
 096 | عَناوینِ کِتاب‌هایِ داخِلِ قَفَسِ  | aːnˈɑvinˌe kˈetɑbhɑjˈe dˈɑxelˌe q1afˈaseː
 097 | مُمْکِنْ اَسْتْ گام‌هایِ نِسْبَتَنْ سَنْگینی طَلَبْ کُنَنْدْ  | mˈomken ˈast ɡˈɑmhɑjˈe nesbˈatan sanɡˈini tˈalab kˈonand
 098 | اَمّا دَرْ جَریانِ یِکْ جَلَسِ‌  | ˈammˌɑ dˈar dʒˌarijˈɑne jˈek dʒalˈaseː
 099 | یِ اینْ رَوان‌دَرْمانْگَرْ کوتولِ  | jˈe iːn ravˈɑndarmˈɑnɡar kuːtˈuːleː
 100 | مِثْلِ بالِرین‌ها قَدَمْ بَرْمی‌دارَدْ  | mˈesle bˈɑlerˌinhɑ q1ˈadam bˈarmidˈɑrad
 101 | مُشْکِلاتْ بِیْنِ اینْ زُجْ  | mˈoʃkelˌɑt bˈejne iːn zˈoːdʒ
 102 | بِ هَم‌آغوشی هَمْ تَعْمیمْ می‌یابَدْ  | beː hˈamˈɑq1uːʃˌi hˈam tˈaʔmim mijˈɑbad
 103 | وَقْتی کِرِسْتِنْ خَسْتِ اَسْتْ یا حَواسَشْ سَرِ جایَشْ نیسْتْ رَبیعِ سَریعْ خِیْلی خِیْلی سَریعْ دُچارِ یاسْ می‌شَوَدْ  | vˈaq1ti kerˈesten xˈasteː ˈast jɑː havˈɑsaʃ sˈare dʒˌɑjaʃ nˈist rˌabiʔˈe sˈariʔ xˈejli xˈejli sˈariʔ dotʃˈɑre jˈɑs miʃavˈad
 104 | ذِهْنَشْ بِ سُرْعَتْ بِ اینْ نَتیجِ می‌رِسَدْ کِ خُدَشْ نیرویِ دافِعِ دارَدْ  | zˈehnaʃ beː sˈorʔat beː iːn nˈatidʒˌeː mirˈesad kˈeː xˌodaʃ nˌiruːjˈe dˈɑfeʔˈeː dˈɑrad
 105 | اینْ حِسِ اِنْزِجارْ اَزْ خُدْ کِ اَزْ مُدَّتْها پیشْ اَزْ آمَدَنِ کِرِسْتِنْ  | iːn hˈese ˌenzedʒˈɑr az xod kˈeː az mˌoddˈathɑ pˈiʃ az ˈɑmadˌane kerˈesten
 106 | دَرْ رَبیعْ وُجودْ داشْتِ  | dˈar rˈabiʔ vˈodʒuːd dˈɑʃteː
 107 | یِکی اَزْ ویژِگیهایِ‌اَشْ اینْ اَسْتْ کِ می‌تَوانْ آنْ را بَرایِ دیگَرانْ شَرْحْ دادْ  | jˈeki az vˌiʒeɡihˈɑjeaʃ iːn ˈast kˈeː mitˈavɑn ɑn rɑ bˌarɑjˈe diɡˈarɑn ʃˈarh dˈɑd
 108 | حَتّا اَگَرْ مُضِعِ تُنْدی  | hˌattˈɑ ˌaɡˈar moːzˈeʔe tˈondi
 109 | نِسْبَتْ بِ کَسانی کِ مُسَبِّبِ آنْ بودِ‌اَنْدْ ایجادْ کُنَدْ  | nˈesbat beː kasˈɑni kˈeː mˌosabbˈebe ɑn bˈuːdeːand iːdʒˈɑd kˈonad
 110 | بَنابَراینْ عُمومَنْ  | bˌanɑbˈarin omˈuman
 111 | یِکْ شَبِ نافَرْجامْ  | jˈek ʃˈabe nɑfˈardʒˈɑm
 112 | تَبْدیلْ می‌شَوَدْ بِ  | tˈabdil miʃavˈad bˈeː
 113 | اَنْگیزِ‌ای دَرْ لِباسِ مُبَدِّلْ بَرایِ رَبیعْ  | ˈaːnɡizˌeːiː dˈar lˈebɑsˌe mobˈaddel bˌarɑjˈe rˈabiʔ
 114 | کِ روزِ بَعْدْ سُخَنانی نیش‌دارْ وَ آسیبِ زَنَنْدِ بِ زَبانْ بیاوَرَدْ  | kˈeː rˈuːze bˈaʔd sˌoxanˈɑni nˈiʃdˈɑr vˈa ˈɑsibˌe zanˈandeː beː zabˈɑn bˌijɑvˈarad
 115 | کِ آنْ مُقِعْ  | kˈeː ɑn mˈoq1eʔ
 116 | تَلاشِ بیشْتَری را اَزْ سویِ کِرِسْتِنْ  | talˈɑʃe biʃtˈari rɑ az sˈuːje kerˈesten
 117 | بَرایِ عَقَب‌نِشینی طَلَبْ می‌کُنَدْ  | bˌarɑjˈe ˈaːq1abneʃˈini tˈalab mikˈonad
 118 | وَ اَلْبَتِّ  | vˈa albˈatteː
 119 | تَلاشی کِ بِ زَبانْ نَیامَدِ  | talˈɑʃi kˈeː beː zabˈɑn nˌajɑmˈadeː
 120 | رَبیعْ بَعْدْ اَزْ چَنْدْ روزْ پَس‌زَدِ‌شُدَنِ  | rˈabiʔ bˈaʔd az tʃˈand rˈuːz pˈaszˈadeːʃodˈane
 121 | طاقِتَشْ تَمامْ می‌شَوَدْ  | tˈɑq1etˌaʃ tˈamɑm miʃavˈad
 122 | وَ کِرِسْتِنْ را بِ سَرْدی وَ غِیْرعِادی بودَنْ مُتَّهَمْ می‌کُنَدْ  | vˈa kerˈesten rɑ beː sˈardi vˈa q1ˈejreˈɑdi bˈuːdan mottˈaham mikˈonad
 123 | کِرِسْتِنْ هَمْ جَوابْ می‌دَهَدْ کِ بِ گَمانَشْ رَبیعْ  | kerˈesten hˈam dʒˈavɑb midˈahad kˈeː beː ɡamˈɑnaʃ rˈabiʔ
 124 | واقِعَنْ اَزْ آزَرْدَنِ او لِذَّتْ می‌بُرْدْ  | vɑq1ˈeʔan az ˈɑzardˌane ˈuː lˈezzat mibˈord
 125 | چُنْ بیشْتَرِ اُقاتْ هَمینْ کارْ را می‌کُنَدْ  | tʃˈon biʃtˈare ˈoːq1ɑt hˈamin kˈɑr rɑ mikˈonad
 126 | کِرِسْتِنْ بِ جایی دَرونِ ذِهْنَشْ عَقَب‌نِشینی می‌کُنَدْ  | kerˈesten beː dʒˌɑiː darˈune zˈehnaʃ ˈaːq1abneʃˈini mikˈonad
 127 | کِ غَمَنْگیزْ  | kˈeː q1ˈamˈaːnɡiz
 128 | اَمّا بِ طَرْزِ عَجیبی  | ˈammˌɑ beː tˈarze aːdʒˈibi
 129 | آرامِش‌بَخْشْ وَ آشْناسْتْ  | ɑrˈɑmeʃbˈaxʃ vˈa ˈɑʃnˈɑst
 130 | جایی کِ وَقْتی اَزْ دیگَرانْ مایوسْ می‌شَوَدْ کِ اَغْلَبْ پیشْ می‌آیَدْ  | dʒˌɑiː kˈeː vˈaq1ti az diɡˈarɑn mˈɑjus miʃavˈad kˈeː ˈaːq1lab pˈiʃ miˈɑjad
 131 | آنْجا خُدَشْ را پِنْهانْ می‌کُنَدْ  | ˈɑndʒˈɑ xˌodaʃ rɑ pˈenhɑn mikˈonad
 132 | وَ با کِتابْ خانْدَنْ وَ گوشْ دادَنْ بِ موسیقی  | vˈa bɑ kˈetɑb xˈɑndan vˈa ɡˈuːʃ dˈɑdan beː muːsˈiq1i
 133 | آرامْ می‌گیرَدْ  | ˈɑrˈɑm miɡˈirad
 134 | او دَرْ مُحافِظَتْ وَ دِفاعْ اَزْ خُدَشْ مُتِخَصِّصْ اَسْتْ  | ˈuː dˈar mˌohɑfˈezat vˈa dˈefɑʔ az xˌodaʃ mˌotexˈasses ˈast
 135 | بیشْتَرْ عُمْرَشْ مَشْغولِ یادْگیریِ آنْ بودِ_اَسْتْ  | bˈiʃtar ˈomraʃ maʃq1ˈuːle jɑdɡirˈie ɑn bˈuːdeː ˈast
 136 | مُشَخَّصِ‌یِ مُدِلِ دِلْبَسْتِگیِ اِجْتِنابی  | mˌoʃaxxˈaseːjˈe modˈele delbˈasteɡˌie ˌedʒtenˈɑbi
 137 | زَمانی کِ نَیازْهایِ عاطِفی بَرآوَرْدِ نَشُدِ‌اَنْدْ  | zamˈɑni kˈeː nˈajˈɑzhˈɑje ˈɑtefˌi barɑvˈardeː naʃˈodeːˈand
 138 | مِیْلِ شَدیدْ بِ اِجْتِنابْ اَزْ دَعْوا  | mˈeːjle ʃˈadid beː ˌedʒtenˈɑb az daʔvˈɑ
 139 | وَ مُواجِهِ‌یِ کَمْتَرْ با دیگْریسْتِ  | vˈa mˌovɑdʒˈeheːjˈe kˈamtar bɑ diɡrˈiste
 140 | شَخْصِ اِجْتِناب‌کُنَنْدِ  | ʃˈaxse ˌedʒtenˈɑbkonˈandeː
 141 | بِ سُرْعَتْ تَصَوُّرْ می‌کُنَدْ کِ دیگَرانْ می‌خاهَنْدْ بِ او حَمْلِ کُنَنْدْ  | beː sˈorʔat tasˈavvor mikˈonad kˈeː diɡˈarɑn mixˈɑhand beː ˈuː hˈamleː kˈonand
 142 | وَ نِمی‌تَوانْ با آن‌ها مَنْطِقی حَرْفْ زَدْ  | vˈa nˌemitˈavɑn bɑ ɑnhɑ mantˈeq1i hˈarf zˈad
 143 | فَقَطْ بایَدْ فَرارْ کَرْدْ فاصِلِ گِرِفْتْ وَ سَرْدْ رَفْتارْ کَرْدْ  | fˈaq1at bˈɑjad farˈɑr kˈard fˈɑselˌeː ɡˈereft vˈa sˈard raftˈɑr kˈard
 144 | مُتِأَسِّفانِ  | mˌoteˌʔassefˈɑneː
 145 | اَفْرادِ اِجْتِناب‌کُنَنْدِ  | ˈaːfrˈɑde ˌedʒtenˈɑbkonˈandeː
 146 | عُمومَنْ نِمیتَوانَنْدْ  | omˈuman nˈemitˈavɑnˌand
 147 | اُلْگویِ رَفْتارِ دِفاعی وَ وَحْشَت‌زَدِ‌یِ خُدْ را  | olɡˈuje raftˈɑre defˈɑʔi vˈa vˈahʃatzˈadeːjˈe xod rˈɑ
 148 | بَرایِ شَریکِ زِنْدِگی‌اَشانْ تُضیحْ دَهَنْدْ  | bˌarɑjˈe ʃarˈike zˈendeɡˌiˈaːʃˈɑn tˈozih dˈahand
 149 | دَرْ نَتیجِ‌  | dˈar nˈatidʒˌeː
 150 | یِ دَلایِلِ رَفْتارِ اِنْزِواطَلَبانِ‌یِ آنانْ  | jˈe dˌalɑjˈele raftˈɑre ˌenzevˌɑtalabˈɑneːjˈe ˈɑnˈɑn
 151 | هَمْچِنانْ پِنْهانْ می‌مانْدْ  | hamtʃenˈɑn pˈenhɑn mimˈɑnd
 152 | وَ بِ راحَتی می‌تَوانْ رَفْتارِ آنانْ را  | vˈa beː rɑhˈati mitˈavɑn raftˈɑre ˈɑnˈɑn rˈɑ
 153 | با بی‌اِعْتِنایی وَ بیخیالی  | bɑ biˌeʔtenˈɑiː vˈa bˌixiˈɑli
 154 | اِشْتِباهْ گِرِفْتْ  | eʃtˈebɑh ɡˈereft
 155 | دَرْ حالی کِ دَرْ اَصْلِ خَلافِ آنْ صِحَتْ دارَدْ  | dˈar hˈɑli kˈeː dˈar ˈaːsle xalˈɑfe ɑn sˈehat dˈɑrad
 156 | فَرْدِ اِجْتِناب‌کُنَنْدِ  | fˈarde ˌedʒtenˈɑbkonˈandeː
 157 | شَدیدَنْ اَهْلِ مُبالاتْ اَسْتْ  | ʃadˈidan ˈaːhle mobˈɑlɑt ˈast
 158 | فَقَطْ مَسئَلِ‌یِ اینْ اَسْتْ کِ دوسْتْ داشْتَنْ  | fˈaq1at masˈaːleːjˈe iːn ˈast kˈeː dˈuːst dˈɑʃtan
 159 | بِ نَظَرَشْ خِیْلی پُرْمُخاطِرِ اَسْتْ  | beː nˈazarˌaʃ xˈejli pormˌoxɑtˈereː ˈast
 160 | خانُمِ فَرْبَرَنْ هَرْگِزْ کَسی را وادارْ بِ نَتیجِ‌گیری نِمی‌کُنَدْ  | xɑnˈome farbˈaran hˈarɡez kˈasi rɑ vˈɑdɑr beː nˈatidʒˌeːɡˈiri nˌemikˈonad
 161 | با اینْحالِ آیِنِ‌ایِ فَرْضی روبَه‌رویِ کِرِسْتِنْ می‌گیرَدْ  | bɑ ʔinhˈɑle ɑjˈeneːˌiːe fˈarzi rˈubahrujˈe kerˈesten miɡˈirad
 162 | تا او بِتَوانَدْ  | tɑː ˈuː betavˈɑnad
 163 | تَأْثیراتی را کِ بَرْ دیگَرانْ می‌گُذارَدْ بِبینَدْ  | tˌaʔsirˈɑti rɑ kˈeː bar diɡˈarɑn miɡozˈɑrad bebinad
 164 | او بِ کِرِسْتِنْ کُمَکْ می‌کُنَدْ  | ˈuː beː kerˈesten kˈomak mikˈonad
 165 | اَزْ تَمایُلَشْ بِ فَرارْ وَ سُکوت‌کَرْدَنْ  | az tˌamɑjˈolaʃ beː farˈɑr vˈa sˈokuːtkˈardan
 166 | دَرْ واکُنِشْ بِ اِسْتِرِسْ آگاهْ شَوَدْ  | dˈar vɑkˈoneʃ beː estˈeres ˈɑːɡɑh ʃavˈad
 167 | وَ او را تَشْویقْ می‌کُنَدْ کِ دَرْ نَظَرْ بِگیرَدْ  | vˈa ˈuː rɑ tˈaʃviq1 mikˈonad kˈeː dˈar nˈazar beɡˈirad
 168 | چِ قَدْرْ اینْ رَفْتارْها  | tʃeː q1ˈadr iːn raftˈɑrhɑ
 169 | مُمْکِنْ اَسْتْ بَرْ اَفْرادی کِ بِ او وابَسْتِ‌اَنْدْ  | mˈomken ˈast bar ˈaːfrˈɑdi kˈeː beː ˈuː vˈɑbastˌeːˈand
 170 | تَأْثیرْگُذارْ باشَدْ  | tˌaʔsirɡozˈɑr bˈɑʃad
 171 | کِرِسْتِنْ هَمْ هَمْچُنْ رَبیعْ عادَتْ دارَدْ  | kerˈesten hˈam hamtʃˈon rˈabiʔ ˈɑdat dˈɑrad
 172 | ناراحَتی‌هایَشْ را بِ گونِ‌ای اِبْرازْ کُنَدْ  | nɑrˈɑhatˌihˌɑjaʃ rɑ beː ɡˈuneːiː ˈebrɑz kˈonad
 173 | کِ بِ هیچْ وَجْهْ اَزْ کَسانی کِ شَدیدَنْ نیازْمَنْدِ مُحَبَّتِشانْ اَسْتْ  | kˈeː beː hˈitʃ vˈadʒh az kasˈɑni kˈeː ʃadˈidan nˌijɑzmˈande mˌohabbatˈeʃɑn ˈast
 174 | هَمْدِلی‌ای دَرْیافْتْ نَکُنَدْ  | hamdˈeliiː dˈarjɑft nakˈonad
 175 | رَبیعْ هَرْگِزْ  | rˈabiʔ hˈarɡez
 176 | مُسْتَقیمَنْ حَرْفِ شَبی را کِ با لارِنِ گُذَرانْدِ‌یِ پیشْ نِمی‌کِشَدْ  | mˌostaq1ˈiman hˈarfe ʃˈabi rɑ kˈeː bɑ lˈɑrenˌe ɡˌozarˈɑndeːjˈe pˈiʃ nˌemikˈeʃad
 177 | او فِکْرْ می‌کُنَدْ  | ˈuː fˈekr mikˈonad
 178 | اُلَویَتْ با اینْ اَسْتْ کِ بِفَهْمَدْ چِرا اینْ اِتِّفاقْ اُفْتادْ  | ˌoːlavˈijat bɑ iːn ˈast kˈeː befˈahmad tʃˈerɑ iːn ettˈefɑq1 ˈoftɑd
 179 | بِ جایِ اینْکِ اِقْرارْ کُنَدْ کِ اینْ کارْ را اَنْجامْ دادِ  | beː dʒˌɑje ˈinkeː ˈeq1rɑr kˈonad kˈeː iːn kˈɑr rɑ ˈaːndʒˈɑm dˈɑdeː
 180 | چِرا کِ اَگَرْ مَطْرَحْ شَوَدْ  | tʃˈerɑ kˈeː ˌaɡˈar mˈatrah ʃavˈad
 181 | مُمْکِنْ اَسْتْ اِحْساسِ عَدَمِ اِطْمینانْ بِ وُجودْ بیاوَرَدْ  | mˈomken ˈast ehsˈɑse aːdˈame etmˈinɑn beː vˈodʒuːd bˌijɑvˈarad
 182 | وَ اِعْتِمادْ بِیْنِ کِرِسْتِنْ وَ خُدَشْ را  | vˈa eʔtˈemɑd bˈejne kerˈesten vˈa xˌodaʃ rˈɑ
