 181 | اَزْ رانْدَنِ آنْ لِذَّتْ نِمی‌بُرْدْ  | az rˈɑndanˌe ɑn lˈezzat nˌemibˈord
 182 | اَگَرْ اُتاقِ نامُنَظَّمْ بودْ نِمی‌تَوانِسْتْ دَرْ آنْ اِسْتِراحَتْ کُنَدْ  | ˌaɡˈar otˈɑːq1e nɑmˈonazzˌam bˈuːd nˌemitˈavɑnˌest dˈar ɑn ˌesterˈɑhat kˈonad
 183 | اَگَرْ مَعْشوقَشْ اَبْعادی اَزْ او را دَرْکْ نِمی‌کَرْدْ  | ˌaɡˈar maʔʃˈuq1aʃ ˈaːbʔˈɑdi az ˈuː rɑ dˈark nˌemikˈard
 184 | کُلِ رابِطِ‌یِ زیرِ سوالْ می‌رَفْتْ  | kˈole rˈɑbetˌeːjˈe zˈire sˈoɑl mirˈaft
 185 | اَکْنونْ نِسْبَتَاْ خوبْ بَرایَشْ دارَدْ نِسْبَتَاْ خوبْ می‌شَوَدْ  | ˈaːknuːn nesbˈatan xˈuːb barˈɑjaʃ dˈɑrad nesbˈatan xˈuːb miʃavˈad
 186 | او مُتِوَجِّ می‌شَوَدْ  | ˈuː mˌotevˈadʒdʒeː miʃavˈad
 187 | عَلاقِ‌اَشْ بِ نوْعِ خاصی اَزْ اَخْبارِ راجِعْ بِ مَرْدانِ میانْسالْ  | aːlˈɑq1eːaʃ beː nˈoʔe xˈɑsi az ˈaːxbɑrˌe rˈɑdʒeʔ beː mardˈɑne miˈɑnsɑl
 188 | دَرْ حالِ اَفْزایِشْ اَسْتْ  | dˈar hˈɑle afzˈɑjeʃ ˈast
 189 | مَرْدی اَهْلِ گَلاسْکو بودْ کِ بَعْدْ اَزْ اینْکِ قَرْض‌هایِ سَنْگینی بالا آوَرْدِ_بودْ  | mˈardi ˈaːhle ɡalˈɑskuː bˈuːd kˈeː bˈaʔd az ˈinkeː q1ˈarzhɑjˈe sanɡˈini bˈɑlɑ ɑvˈardeː bˈuːd
 190 | وَ هَمْسَرَشْ مَچْشْ را حِیْنِ رابِطِ با زَنِ دیگَری گِرِفْتِ_بودْ خوْدَشْ را زیرِ قَطارْ اَنْداخْتْ  | vˈa hamsˈaraʃ mˈatʃʃ rɑ hˈejne rˈɑbetˌeː bɑ zˈane dˈiɡarˌi ɡerˈefteː bˈuːd xˌodaʃ rɑ zˈire q1atˈɑr ˈandɑxt
 191 | مَرْدِ دیگَری  | mˈarde dˈiɡarˌi
 192 | بَعْدْ اَزْ چَنْدْ رُسْواییِ آنْلایْنْ  | bˈaʔd az tʃˈand rˌosvɑˈiːe ˈɑnlɑjn
 193 | با ماشینْ بِ داخِلِ دَرْیایِ نَزْدیکِ اَبْرَدینْ رَفْتْ  | bɑ mˈɑʃin beː dˈɑxelˌe darjˌɑːje nˈazdikˌe ˈaːbradˌin rˈaft
 194 | رَبیعْ می‌دانَدْ  | rˈabiʔ midˈɑnad
 195 | کِ نَهایَتَاْ زیادْ طولْ نِمی‌کِشَدْ  | kˈeː nˌahɑjˈatan ziˈɑd tˈuːl nˌemikˈeʃad
 196 | فَقَطْ چَنْدْ اِشْتِباهْ کافیسْتْ تا ناگَهانْ فَرْدِ خوْدْ را دَرْ مُحاصِرِ‌یِ مُصیبَتْ بِبینَدْ  | fˈaq1at tʃˈand eʃtˈebɑh kˈɑfist tɑː nɑɡˈahɑn fˈarde xod rɑ dˈar mˌohɑsˈereːjˈe mosˈibat bebinad
 197 | تَحْتِ فَشارْهایِ زیادِ بیرونی  | tahtˈe faʃˈɑrhˈɑje ziˈɑde birˈuːni
 198 | بِ سادِگی اَزْ او نیزْ مُمْکِنْ اَسْتْ هَرْ کاری سَرْ بِزَنَدْ  | beː sɑdˈeɡi az ˈuː nˈiz mˈomken ˈast har kˈɑri sˈar bezˈanad
 199 | چیزی کِ باعِثْ می‌شَوَدْ او خوْدَشْ را عاقِلْ بِپِنْدارَدْ  | tʃˈizi kˈeː bˈɑʔes miʃavˈad ˈuː xˌodaʃ rɑ ˈɑq1el bependˈɑrad
 200 | تَنْها اَنْدَکی خوْشِقْبالیِ ذاتی بِخُصوصْ اَسْتْ  | tˈanhɑ andˌaki xˌoʃeq1bˈɑliˌe zˈɑti bexˈosuːs ˈast
 201 | اَمّا می‌دانَدْ کِ اَگَرْ زِنْدِگی بِخواهَدْ  | ˈammˌɑ midˈɑnad kˈeː ˌaɡˈar zˈendeɡˌi bexˈɑhad
 202 | دُرُسْتْ وَ حِسابی او را اِمْتِحانْ کُنَدْ  | dˈorost vˈa hˈesɑbˌi ˈuː rɑ emtˈehɑn kˈonad
 203 | یِکْ تِراژِدیِ واقِعی پیشِ رو خواهَدْ_بودْ  | jˈek tˌerɑʒedˈie vˈɑq1eʔˈi pˈiʃe rˈu xˈɑhad bˈuːd
 204 | دَرْ ساعَتِ دوْ یا سِ صُبْحْ کِ نه کامِلَاْ بیدارْ اَسْتْ وَ نه کامِلَاْ خوابْ  | dˈar sɑʔˈate dˈo jɑː sˈeː sˈobh kˈeː nˈa kɑmˈelan bˌidɑr ˈast vˈa nˈa kɑmˈelan xˈɑb
 205 | بَلْکِ دَرْ نَواحیِ بینابینی هُشْیاری سَفَرْ می‌کُنَدْ  | bˈalkeː dˈar navˈɑhiˌe binˈɑbinˌi hoʃjˈɑri sˈafar mikˈonad
 206 | دَرَمی‌یابَدْ کِ چَنْدینْ وَ چَنْدْ تَصْویرْ وَ خاطِرِ‌یِ سَرْگَرْدانْ  | darˈamijˈɑbad kˈeː tʃˈandin vˈa tʃˈand tˈasvir vˈa xˈɑterˌeːjˈe sarɡˈardɑn
 207 | دَرْ ذِهْنْ وُجودْ دارَدْ  | dˈar zˈehn vˈodʒuːd dˈɑrad
 208 | کِ هَمِ مُنْتَظِرَنْدْ بَقیِ عَقَبْ بِرَوَنْدْ  | kˈeː hˈameː mˌontazˈerand baq1ˈijeː ˈaːq1ab berˈavand
 209 | وَ آنْها موْرِدِ تَوَجُّه‌یِ او قَرارْ بِگیرَنْدْ  | vˈa ˌɑnhɑ morˈede tˈavadʒdʒˌohjˈe ˈuː q1arˈɑr beɡˈirand
 210 | تَصاویرِ گُذَرایی  | tasˈɑvirˌe ɡˌozarˈɑiː
 211 | اَزْ سَفَرِ هَشْتْ سالْ پیشْ بِ بانْکوْکْ  | az safˈare hˈaʃt sˈɑl pˈiʃ beː bˈɑnkok
 212 | مَنْظَرِ‌یِ سورْئالِ روسْتاهایِ هِنْدْ  | manzˈareːjˈe suːrʔˈɑle ruːstˈɑhˈɑje hˈend
 213 | بَعْدْ اَزْ شَبی کِ با تِکْیِ بَرْ پَنْجَرِ‌یِ هَواپِیْما گُذَرانْدْ  | bˈaʔd az ʃˈabi kˈeː bɑ tˈekjeː bar pandʒˈareːjˈe hˈavɑpˌejmɑ ɡozˈarɑnd
 214 | سَطْحِ سَرْدْ کَفِ حَمّامِ کاشی‌کاری شُدِ‌یِ  | sˈathe sˈard kˈafe hammˈɑme kˈɑʃikˈɑri ʃˈodeːjˈeː
 215 | خانِ‌ای  | xˈɑneːˈiː
 216 | کِ خانِوادِ‌اَشْ دَرْ آتِنْ  | kˈeː xˌɑnevˈɑdeːaʃ dˈar ˈɑten
 217 | دَرْ آنْ زِنْدِگی می‌کَرْدَنْدْ  | dˈar ɑn zˈendeɡˌi mikˈardand
 218 | اَوَّلینْ بارِشِ بَرْفی کِ دَرْ زِنْدِگی‌اَشْ تَجْرُبِ کَرْدْ  | avvˈalin bˈɑreʃˌe bˈarfi kˈeː dˈar zˈendeɡˌiaʃ tadʒrˈobe kˈard
 219 | دَرْ تَعْطیلاتْ دَرْ شَرْقِ سوئیسْ  | dˈar taʔtˈilɑt dˈar ʃˈarq1e sˈuːiːs
 220 | آسِمانِ خاکِسْتَری کَمْ اِرْتِفاعی  | ˈɑsemˌɑne xˈɑkestˌari kˈam ˌertefˈɑʔˈi
 221 | کِ حِیْنِ قَدَمْ زَدَنْ دَرْ زَمین‌هایِ نوْرُفولَکْ  | kˈeː hˈejne q1ˈadam zˈadan dˈar zˈaminhɑjˈe norˈofuːlˌak
 222 | مُشاهِدِ کَرْدِ_بودْ  | moʃˈɑhedˌeː kˈardeː bˈuːd
 223 | راهْروییْ دَرْ دانِشْگاهْ کِ بِ اِسْتَخْرِ شِنا مُنْتَهی می‌شُدْ  | rɑhrˈoiː dˈar dˈɑneʃɡˈɑh kˈeː beː estˈaxre ʃˈenɑ montˈahi miʃˈod
 224 | شَبی کِ با اِسْتِرْ دَرْ بیمارِسْتانْ گُذَرانْدْ  | ʃˈabi kˈeː bɑ ˈester dˈar bimˈɑrestˌɑn ɡozˈarɑnd
 225 | وَقْتی اَنْگُشْتِ اِسْتِرْ را عَمَلْ کَرْدِ_بودَنْدْ  | vˈaq1ti anɡˈoʃte ˈester rɑ ˈamal kˈardeː bˈuːdand
 226 | مُمْکِنْ اَسْتْ دَلایِلِ مَعْقولِ وُقوعِ بَرْخی چیزْها  | mˈomken ˈast dˌalɑjˈele maʔq1ˈuːle vˌoq1uːʔˈe bˈarxi tʃˈizhɑ
 227 | کَم‌کَمْ ناپَدیدْ شَوَدْ  | kˈamkˈam nɑpˈadid ʃavˈad
 228 | اَمّا هیچْ یِکْ اَزْ تَصاویرْ هَرْگِزْ واقِعَاْ اَزْ بِیْنْ نِمی‌رَوَنْدْ  | ˈammˌɑ hˈitʃ jˈek az tasˈɑvir hˈarɡez vɑq1ˈeʔan az bˈejn nˌemirˈavand
 229 | رَبیعْ دَرْ طولِ شَب‌هایِ بی‌خوابی‌اَشْ  | rˈabiʔ dˈar tˈuːle ʃˈabhɑjˈe bixˈɑbiˈaʃ
 230 | گاهی بِ مادَرَشْ فِکْرْ می‌کُنَدْ  | ɡˈɑhi beː mɑdˈaraʃ fˈekr mikˈonad
 231 | وَ دِلْتَنْگِ او می‌شَوَدْ  | vˈa deltˈanɡe ˈuː miʃavˈad
 232 | بِ‌طَرْزْ خِجالَت‌آوَری شَدیدَاْ آرِزو می‌کُنَدْ  | beːtˈarz xedʒˈɑlatˈɑvarˌi ʃadˈidan ˈɑrezˌu mikˈonad
 233 | ای کاشْ دوْبارِ هَشْتْ سالِ بودْ  | iː kˈɑʃ dobˈɑreː hˈaʃt sˈɑleː bˈuːd
 234 | وَ خوْدَشْ را زیرِ پَتو پیچیدِ_بودْ  | vˈa xˌodaʃ rɑ zˈire pˈatuː pitʃˈideː bˈuːd
 235 | کَمی تَبْ داشْتْ وَ مادَرَشْ بَرایَشْ غَذا می‌آوَرْدْ وَ کِتابْ می‌خوانْدْ  | kˈami tˈab dˈɑʃt vˈa mɑdˈaraʃ barˈɑjaʃ q1azˈɑ miˈɑvard vˈa kˈetɑb mixˈɑnd
 236 | او دِلَشْ می‌خواهَدْ مادَرَشْ پیشَشْ بودْ تا راجِعْ بِ آیَنْدِ بِ او قوَّتِ قَلْبْ بِدَهَدْ  | ˈuː dˈelaʃ mixˈɑhad mɑdˈaraʃ pˈiʃaʃ bˈuːd tɑː rˈɑdʒeʔ beː ɑjˈandeː beː ˈuː q1ovvˈate q1ˈalb bedˈahad
 237 | اِشْتِباهاتَشْ را بِبَخْشَدْ  | ˌeʃtebɑhˈɑtaʃ rɑ bebˈaxʃad
 238 | وَ موهایَشْ را مُرَتَّبْ وَ مُنَظَّمْ  | vˈa muːhˈɑjaʃ rɑ morˈattab vˈa monˈazzam
 239 | بِ سَمْتِ چَپْ شانِ بِزَنَدْ  | beː sˈamte tʃˈap ʃˈɑneː bezˈanad
 240 | لااقَلْ آنْقَدْری بالِغْ شُدِ کِ بِدانَدْ  | lˈɑˈɑq1al ɑnq1ˈadri bˈɑleq1 ʃˈodeː kˈeː bedˈɑnad
 241 | چیزِ مُهِمی دَرْ اینْ حالَت‌هایِ واپَس‌رو وُجودْ دارَدْ  | tʃˈize mˈohemˌi dˈar iːn hˈɑlathɑjˈe vˈɑpasrˈu vˈodʒuːd dˈɑrad
 242 | کِ نَبایَدْ فوْرَاْ سانْسورْ شَوَدْ  | kˈeː nˈabˈɑjad fˈoran sˈɑnsuːr ʃavˈad
 243 | او مُتِوَجِّ اَسْتْ کِ بِ رَغْمِ نِشانه‌هایِ بیرونی  | ˈuː mˌotevˈadʒdʒeː ˈast kˈeː beː rˈaq1me neʃˈɑnehɑjˈe birˈuːni
 244 | راه‌یِ چَنْدانی طِیِّ نَکَرْدِ_اَسْتْ  | rˈɑhjˈe tʃandˈɑni tˈejje nakˈardeː ˈast
 245 | او می‌فَهْمَدْ  | ˈuː mifˈahmad
 246 | کِ اِضْطِرابْ هَمیشِ دُنْبالَشْ خواهَدْ_آمَدْ  | kˈeː eztˈerɑb hamˈiʃeː donbˈɑlaʃ xˈɑhad ˈɑmad
 247 | مُمْکِنْ اَسْتْ بِ نَظَرْ بِرِسَدْ هَرْ موْجِ جَدیدی اَزْ آنْ  | mˈomken ˈast beː nˈazar berˈesad har mˈoːdʒe dʒadˈidi az ˈɑn
 248 | مَرْبوطْ بِ اینْ یا آنْ موْضوع خاصْ اَسْتْ  | mˈarbut beː iːn jɑː ɑn mˈozuː xˈɑs ˈast
 249 | مِهْمانی‌ای کِ دَرْ آنْ اَفْرادِ کَمی را می‌شِناسَدْ  | mehmˈɑniiː kˈeː dˈar ɑn ˈaːfrˈɑde kˈami rɑ miʃenˈɑsad
 250 | سَفَرِ دُشْواری کِ بایَدْ بِ کِشْوَری ناشِناسْ بِرَوَدْ  | safˈare doʃvˈɑri kˈeː bˈɑjad beː keʃvˈari nɑʃˌenɑs berˈavad
 251 | مَخْمَصِ‌ای دَرْ کارْ  | maxmˈaseːiː dˈar kˈɑr
 252 | اَمّا اَزْ مَنْظَری کُلّی‌تَرْ  | ˈammˌɑ az manzˈari kollˈitˈar
 253 | مُشْکِلْ هَمیشِ بُزُرْگ‌تَرْ  | mˈoʃkel hamˈiʃeː bozˈorɡtˈar
 254 | غامِض‌تَرْ  | q1ˈɑmeztˈar
 255 | مُهِم‌تَرْ وَ اَساسی‌تَرْ اَسْتْ "  | mˈohemtar vˈa ˈaːsˈɑsitar ˈast
