 000 | " بُلوغِ صَفْحِ‌یِ دِویسْتْ وَ هِفْدَهْ  | bolˈuq1e sˈafheːjˈe dˈevist vˈa hˈefdah
 001 | دَرْ طولِ زِمِسْتانْ  | dˈar tˈuːle zemˈestɑn
 002 | رَبیعْ مَشْغولِ طَرّاحیِ یِکْ مَجْموعِ‌یِ وَرْزِشی می‌شَوَدْ  | rˈabiʔ maʃq1ˈuːle tˌarrɑhˈie jˈek mˌadʒmuːʔˈeːjˈe varzˈeʃi miʃavˈad
 003 | او چَنْدینْ بارْ با مَسْئولینِ آموزِشْ وَ پَرْوَرِشِ مَحَلّی  | ˈuː tʃˈandin bˈɑr bɑ mˌasʔuːlˈine ɑmˈuzeʃ vˈa pˌarvarˈeʃe mahˈalli
 004 | کِ سِفارِشِ اینْ پُروْژِ را دادِ‌اَنْدْ مُلاقاتْ می‌کُنَدْ  | kˈeː sˌefɑrˈeʃe iːn porˈoʒeː rɑ dˈɑdeːand molˈɑq1ɑt mikˈonad
 005 | قَرارْ اَسْتْ ساخْتِمانِ فوْقُ‌العادِّ‌ای اَزْ کارْ دَرْ بیایَدْ  | q1arˈɑr ˈast sˈɑxtemˌɑne fˈoːq1olˈɑddeiː az kˈɑr dˈar bijˈɑjad
 006 | با اِسْتِفادِ اَزْ سیسْتِمِ نوْرَگیرْهایِ سَقْفی  | bɑ ˌestefˈɑdeː az sistˈeme norˈaɡirhˈɑje sˈaq1fi
 007 | کِ باعِثْ می‌شَوَنْدْ حَتّی دَرْ دِلْگیرْتَرینْ روزْها هَمْ  | kˈeː bˈɑʔes miʃˈavand hˌattˈɑ dˈar delɡirtˈarin rˈuːzhɑ hˈam
 008 | داخِلِ آنْ پُرِ نورْ باشَدْ  | dˈɑxelˌe ɑn pˈore nˈur bˈɑʃad
 009 | اَزْ دیدِ حِرْفِ‌ای  | az dˈide hˈerfeːˈiː
 010 | اینْ کارْ مُمْکِنْ اَسْتْ آغازْگَرْ چیزی بِسیارْ مُهِمْ بَرایِ رَبیعْ باشَدْ  | iːn kˈɑr mˈomken ˈast ˈɑq1ˈɑzɡar tʃˈizi besˈijɑr mˈohem bˌarɑjˈe rˈabiʔ bˈɑʃad
 011 | اَمّا دَرْ بَهارْ  | ˈammˌɑ dˈar bˈahɑr
 012 | آنانْ او را فَرا می‌خوانَنْدْ  | ˈɑnˈɑn ˈuː rɑ farˈɑ mixˈɑnand
 013 | وَ با حالَتِ پَرْخاشْگَرانِ‌یِ اَفْرادی  | vˈa bɑ hɑlˈate pˌarxɑʃɡarˈɑneːjˈe ˈaːfrˈɑdi
 014 | کِ اَزْ مایوسْ کَرْدَنِ کَسی اِحْساسِ گُناهْ می‌کُنَنْدْ  | kˈeː az mˈɑjus kardˈane kˈasi ehsˈɑse ɡˈonɑːh mikˈonand
 015 | وَ دَرْ نَتیجِ‌یِ آنْ  | vˈa dˈar nˈatidʒˌeːjˈe ˈɑn
 016 | وِجْهِ‌یِ تَهاجُمی بِ خوْدْ می‌گیرَنْدْ  | vˈedʒhejˈe tˌahɑdʒˈomi beː xod miɡˈirand
 017 | رُکْ وَ راسْتْ بِ رَبیعْ می‌گویَنْدْ کِ راضی نیسْتَنْدْ  | rˈok vˈa rˈɑst beː rˈabiʔ miɡˈujand kˈeː rˈɑzi nˈistand
 018 | وَ تَصْمیمْ گِرِفْتِ‌اَنْدْ  | vˈa tˈasmim ɡerˈefteːˈand
 019 | کارْ را بِ شَخْصِ دیگَری بِسِپارَنْدْ  | kˈɑr rɑ beː ʃˈaxse dˈiɡarˌi bˌesepˈɑrand
 020 | شَخْصی با تَجْرُبِ‌یِ بیشْتَرْ  | ʃˈaxsi bɑ tadʒrˈobejˈe bˈiʃtar
 021 | دَرْ هَمینْ زَمانْ اَسْتْ کِ بی‌خوابی شُروعْ می‌شَوَدْ  | dˈar hˈamin zamˈɑn ˈast kˈeː bixˈɑbi ʃˈoruːʔ miʃavˈad
 022 | بی‌خوابی  | bixˈɑbi
 023 | اَگَرْ چَنْدْ هَفْتِ طولْ بِکِشَدْ سَخْتْ وَ طاقَت‌فَرْسا می‌شَوَدْ  | ˌaɡˈar tʃˈand hˈafteː tˈuːl bekˈeʃad sˈaxt vˈa tˈɑq1atfˈarsɑ miʃavˈad
 024 | اَمّا اَگَرْ کَمْ باشَدْ مَثَلَاْ یِکْ شَبْ چَنْدانْ بِ دَرْمانْ نیازْ نَدارَدْ  | ˈammˌɑ ˌaɡˈar kˈam bˈɑʃad masˈalan jˈek ʃˈab tʃˈandɑn beː dˈarmɑn nˈijɑz nˈadɑrˌad
 025 | اَغْلَبِ دَرون‌بینی‌هایِ مُهِمْ وَ سَرْنِوِشْت‌سازْ را فَقَطْ شَب‌ها می‌تَوانیمْ کَسْبْ کُنیمْ  | ˈaːq1labˌe dˈarunbˈinihɑjˈe mˈohem vˈa sarnˈeveʃtsˈɑz rɑ fˈaq1at ʃˈabhɑ mitˈavɑnˌim kˈasb kˈonim
 026 | مِثْلِ ناقوس‌هایِ کِلیسایِ شَهْرْ  | mˈesle nˈɑq1ushɑjˈe kˌelisˈɑje ʃˈahr
 027 | کِ بایَدْ تا تاریکیِ هَوا صَبْرْ کُنَنْدْ  | kˈeː bˈɑjad tɑː tˈɑrikˌie hˈavɑ sˈabr kˈonand
 028 | تا بِ صِدا دَرآیَنْدْ  | tɑː beː sedˈɑ darˈɑjand
 029 | او دَرْ طولِ روزْ  | ˈuː dˈar tˈuːle rˈuːz
 030 | بایَدْ دَرْ حُضورِ دیگَرانْ فَرْدی وَظیفِ‌شِناسْ باشَدْ  | bˈɑjad dˈar hozˈuːre diɡˈarɑn fˈardi vazˈifeːʃenˈɑs bˈɑʃad
 031 | بَعْدْ اَزْ نیمِ‌یِ شَبْ تَنْها دَرْ اُتاقَکِ مُطالِعِ  | bˈaʔd az nˈimeːjˈe ʃˈab tˈanhɑ dˈar ˌotɑːq1ˈake mˌotɑlˈeʔeː
 032 | می‌تَوانَدْ  | mitavˈɑnad
 033 | بِ مَسْئولیَتِ خُصوصی‌تَرْ وَ بُزُرْگْتَرِ خوْدْ بِپَرْدازَدْ  | beː mˌasʔuːliːjˈate xosˈusitar vˈa bozˈorɡtarˌe xod bepardˈɑzad
 034 | تَفَکُّراتِ او بی‌شَکْ بَرایِ کِرِسْتِنْ  | tˌafakkorˈɑte ˈuː biʃˈak bˌarɑjˈe kerˈesten
 035 | اِسْتِرْ وَ ویلیامْ عَجیبْ نیسْتْ  | ˈester vˈa vˌiliˈɑm ˈaːdʒib nˈist
 036 | آن‌ها رَبیعْ را جورِ خاصی می‌خواهَنْدْ  | ɑnhɑ rˈabiʔ rɑ dʒˈuːre xˈɑsi mixˈɑhand
 037 | وَ او نِمی‌خواهَدْ آنانْ را مَأْیوسْ کُنَدْ  | vˈa ˈuː nˌemixˈɑhad ˈɑnˈɑn rɑ mˈaʔjus kˈonad
 038 | یا با اِسْتِنْباط‌هایِ عَجیبَشِ آنانْ را بِتَرْسانَدْ  | jɑː bɑ ˌestenbˈɑthɑjˈe ˌaːdʒibˈaʃe ˈɑnˈɑn rɑ bˌetarsˈɑnad
 039 | آنانْ حَقْ دارَنْدْ  | ˈɑnˈɑn hˈaq1 dˈɑrand
 040 | اَزْ پیش‌بینی‌پَذیریِ او بَهْرِ بِبَرَنْدْ  | az pˈiʃbˈinipˌazirˈie ˈuː bˈahreː bebˈarand
 041 | اَمّا اَکْنونْ  | ˈammˌɑ ˈaːknuːn
 042 | نَیازْهایِ دَرونیِ دیگَری  | nˈajˈɑzhˈɑje dˌarunˈie dˈiɡarˌi
 043 | تَوَجُّه‌یِ او را جَلْبْ کَرْدِ_اَسْتْ  | tˈavadʒdʒˌohjˈe ˈuː rɑ dʒˈalb kˈardeː ˈast
 044 | بی‌خوابی  | bixˈɑbi
 045 | اِنْتِقامِ ذِهْنِ اوسْتْ اَزْ او  | ˌenteq1ˈɑme zˈehne ˈuːst az ˈuː
 046 | بِ خاطِرِ تَمامِ اَفْکاری کِ دَرْ طولِ روزْ  | beː xˈɑterˌe tamˈɑme ˈaːfkɑrˌi kˈeː dˈar tˈuːle rˈuːz
 047 | مُلاحِظِ‌کارانِ اَزْ آنْها اِجْتِنابْ می‌کُنَدْ  | mˌolɑhˈezeːkɑrˈɑneː az ˌɑnhɑ ˌedʒtenˈɑb mikˈonad
 048 | پاداشِ زِنْدِگیِ مَعْمولی بِ اِنْسانْ  | pˈɑdˈɑʃe zˈendeɡˌie maʔmˈuːli beː ensˈɑn
 049 | دیدْگاهیسْتِ واقِع‌بینانِ  | didɡˈɑhistˌe vˈɑq1eʔbinˈɑneː
 050 | وَ غِیْرِدَرون‌نِگَرانِ  | vˈa q1ˈejredˌarunnˌeɡarˈɑneː
 051 | بَرایِ چیزْهایِ دیگَرْ  | bˌarɑjˈe tʃizhˈɑje dˈiɡar
 052 | زَمانْ خِیْلی کَمی فَراهَمْ اَسْتْ  | zamˈɑn xˈejli kˈami farˈɑham ˈast
 053 | وَ تَرْسْ خِیْلی زیادی  | vˈa tˈars xˈejli ziˈɑdi
 054 | ما اِجازِ می‌دَهیمْ  | mɑ edʒˈɑzeː midˈahim
 055 | اَزْ سویِ تَمایُلیِ ذاتی  | az sˈuːje tˌamɑjolˈie zˈɑti
 056 | بِ خوْدْداری هِدایَتْ شَویمْ  | beː xoddˈɑri hedˈɑjat ʃˈavim
 057 | خوْدْ را بِ جُلوْ می‌رانیمْ  | xod rɑ beː dʒˈolo mirˈɑnim
 058 | دَرْ جَوابِ ضَرْبِ‌ای کِ می‌خوْریمْ ضَرْبِ می‌زَنیمْ  | dˈar dʒavˈɑbe zˈarbeːiː kˈeː mixˈorim zˈarbeː mizˈanim
 059 | تَقْصیرْ را بِ گَرْدَنِ دیگَرانْ مینَدازیمْ  | tˈaq1sir rɑ beː ɡardˈane diɡˈarɑn minadˈɑzim
 060 | پُرْسِش‌هایِ سَرْگَرْدانْ دَرْ ذِهْنِمانْ را سَرْکوبْ می‌کُنیمْ  | pˈorseʃhɑjˈe sarɡˈardɑn dˈar zehnˈemɑn rɑ sarkˈuːb mikˈonim
 061 | وَ بِ دِقَّتْ راه‌یِ خوْدْ را  | vˈa beː dˈeq1q1at rˈɑhjˈe xod rˈɑ
 062 | بِ سویِ تَصْویرِ مُتِمَلِّقانِ‌ای کِ اَزْ مَقْصَدِمانْ دَرْ ذِهْنْ داریمْ  | beː sˈuːje tasvˈire mˌotemˌalleq1ˈɑneːiː kˈeː az mˌaq1sadˈemɑn dˈar zˈehn dˈɑrim
 063 | بازْ می‌کُنیمْ  | bˈɑz mikˈonim
 064 | تَقْریبَاْ چارِ‌یِ دیگَری نَداریمْ  | taq1rˈiban tʃˈɑreːjˈe dˈiɡarˌi nˈadˈɑrim
 065 | جُزْ اینْکِ سَرْسَخْتانِ  | dʒˈoz ˈinkeː sˌarsaxtˈɑneː
 066 | اَزْ خوْدِمانْ جانِبْداری کُنیمْ  | az xodˌemɑn dʒˈɑnebdˌɑri kˈonim
 067 | تَنْها زَمانی کِ سِتاره‌ها نَمایانْ می‌شَوَنْدْ  | tˈanhɑ zamˈɑni kˈeː setˈɑrehɑ namˈɑjɑn miʃˈavand
 068 | وَ تا سِپیدِ‌دَمْ  | vˈa tɑː sepˈideːdˈam
 069 | کِ کَسی دیگَرْ خواسْتِ‌ای اَزْ ما نَدارَدْ  | kˈeː kˈasi dˈiɡar xˈɑsteːiː az mɑ nˈadɑrˌad
 070 | می‌تَوانیمْ کُنْتُرُلی را کِ بَرْ خوْدْ داریمْ  | mitˈavɑnˌim kˈontorˌoli rɑ kˈeː bar xod dˈɑrim
 071 | کَمی رَها کُنیمْ  | kˈami rahˈɑ kˈonim
 072 | وَ دیدی صادِقانِ‌تَرْ  | vˈa dˈidi sˈɑdeq1ˌɑneːtˈar
 073 | وَ بِ دورْ اَزْ کوتَه‌فِکْری داشْتِ_باشیمْ  | vˈa beː dˈuːr az kˈutahfˈekri dˈɑʃteː bˈɑʃim
 074 | رَبیعْ با دیدی جَدیدْ بِ حَقایِقِ قَدیمی می‌نَگَرْدْ  | rˈabiʔ bɑ dˈidi dʒˈadid beː haq1ˈɑjeq1ˌe q1adˈimi minˈaɡard
 075 | او تَرْسوسْتِ خیالْبافْ اَسْتْ هَمْسَری خیانَتْکارْ اَسْتْ  | ˈuː tarsˈuːste xiˈɑlbɑf ˈast hamsˈari xiˈɑnatkˌɑr ˈast
 076 |   | 
 077 | وَ پِدَری بیشْ اَزْ حَدِّ سُلْطِ‌جَوْ وَ کُنْتُرُل‌گَرْ  | vˈa pedˈari bˈiʃ az hˈadde sˈolteːdʒˈav vˈa kˈontorˌolɡˈar
 078 | زِنْدِگی‌اَشْ بِ یِکْ مو بَنْدْ اَسْتْ  | zˈendeɡˌiaʃ beː jˈek mˈuː bˈand ˈast
 079 | او دَرْ کارَشْ دَرْ نیمِ‌یِ راهْ بازْ مانْدِ  | ˈuː dˈar kˈɑraʃ dˈar nˈimeːjˈe rˈɑh bˈɑz mˈɑndeː
 080 | وَ دَرْ مُقایِسِ با اِنْتِظاراتی کِ اَزْ او می‌  | vˈa dˈar mˌoq1ɑjˈeseː bɑ ˌentezˈɑrɑtˌi kˈeː az ˈuː mi
 081 | رَفْتِ تَقْریبَاْ هیچْ چیزی کَسْبْ نَکَرْدِ_اَسْتْ  | rˈafteː taq1rˈiban hˈitʃ tʃˈizi kˈasb nakˈardeː ˈast
 082 | او می‌تَوانَدْ  | ˈuː mitavˈɑnad
 083 | دَرْ ساعَتِ سِ‌یِ صُبْحْ بِ طَرْزِ عَجیبی آرامْ وَ فارِغْ اَزْ اِحْساساتْ  | dˈar sɑʔˈate sˈeːjˈe sˈobh beː tˈarze aːdʒˈibi ˈɑrˈɑm vˈa fˈɑreq1 az ehsˈɑsɑt
 084 | اِشْتِباهاتَشْ را فِهْرِسْت‌وارِدْ ذِکْرْ کُنَدْ  | ˌeʃtebɑhˈɑtaʃ rɑ fˈehrestvˈɑred zˈekr kˈonad
 085 | رَگه‌هایی اَزْ خوْدْسَری کِ باعِثِ بِ وُجودْ آمَدَنِ بی‌اِعْتِمادی  | rˈaɡeːhˈɑiː az xodsˈari kˈeː bˈɑʔesˌe beː vˈodʒuːd ˈɑmadˌane biˌeʔtemˈɑdi
 086 | دَرْ کارْفَرْمایانْ شُدِ  | dˈar kˈɑrfarmˌɑjɑn ʃˈodeː
 087 | گِرایِشْ بِ زودْرَنْجی  | ɡerˈɑjeʃ beː zudrˈandʒi
 088 | وَ تَمایُلْ بِ اِحْتیاطْ بِ خاطِرِ تَرْسْ اَزْ طُرْدْ شُدَنْ  | vˈa tamˈɑjol beː ehtˈijɑt beː xˈɑterˌe tˈars az tˈord ʃˈodan
 089 | او اِعْتِمادْ بِ نَفَسْ نَداشْتِ_اَسْتْ  | ˈuː eʔtˈemɑd beː nˈafas nˈadˈɑʃteː ˈast
 090 | تا دَرْ یِکْ کارْ بِمانَدْ  | tɑː dˈar jˈek kˈɑr bemˈɑnad
 091 | وَ آنْ را اِدامِ دَهَدْ  | vˈa ɑn rɑ edˈɑmeː dˈahad
 092 | هَمْ سِنْ وَ سالانِ او دَرْ اینْ کارْ آنْقَدْرْ پیشْرَفْتْ کَرْدِ‌اَنْدْ کِ بَرایِ خوْدِشانْ  | hˈam sˈen vˈa sˈɑlɑnˌe ˈuː dˈar iːn kˈɑr ˈɑnq1adr pˈiʃraft kˈardeːand kˈeː bˌarɑjˈe xodˈeʃɑn
 093 | دَفْتَرِ مِعْماری تاَسیسْ کَرْدِ‌اَنْدْ  | daftˈare meʔmˈɑri tˈasˌis kˈardeːˈand
 094 | بِ جایِ اینْکِ مُنْتَظِرْ بِمانَنْدْ  | beː dʒˌɑje ˈinkeː montˈazer bemˈɑnand
 095 | تا بِ آنانْ پیشْنَهادِ کارْ دادِ_شَوَدْ  | tɑː beː ˈɑnˈɑn pˈiʃnahˈɑde kˈɑr dˈɑdeː ʃavˈad
 096 | وَ بَعْدْ دُنْیا را مُقَصِّرْ بِدانَنْدْ کِ چِرا بِ اَنْدازِ‌یِ کافی  | vˈa bˈaʔd dˈonjɑ rɑ moq1ˈasser bedˈɑnand kˈeː tʃˈerɑ beː ˈaːndˈɑzeːjˈe kˈɑfi
 097 | بِ دَسْتْ وَ پایِشانْ نَیُفْتادِ اَسْتْ  | beː dˈast vˈa pˈɑjeʃˌɑn nˌajoftˈɑdeː ˈast
 098 | تَنْها یِکْ ساخْتِمانْ اَسْتْ  | tˈanhɑ jˈek sˈɑxtemˌɑn ˈast
 099 | مَخْصوصِ ذَخیرِ‌یِ اِطِّلاعاتْ  | maxsˈuse zaxˈireːjˈe ˌeːttelˈɑʔɑt
 100 | دَرْ هَرَتْفورَدَشایْرْ  | dˈar hˌaratfˌuːradaʃˈɑjr
 101 | کِ نامِ او بَرْ آنْ اَسْتْ  | kˈeː nˈɑme ˈuː bar ɑn ˈast
 102 | او دَرْ حالی اَزْ دُنْیا خواهَدْ_رَفْتْ کِ بَخْشِ اَعْظَمِ اِسْتِعْدادْهایَشْ  | ˈuː dˈar hˈɑli az dˈonjɑ xˈɑhad rˈaft kˈeː bˈaxʃe aʔzˈame ˌesteʔdɑdhˈɑjaʃ
 103 | هَنوزْ اِسْتِفادِ نَشُدِ‌اَنْدْ  | hˈanuz ˌestefˈɑdeː naʃˈodeːˈand
 104 | وَ تَنْها بِ عُنْوانِ تَشَعْشُع‌هایِ اِلْهام‌بَخْشی بودِ‌اَنْدْ  | vˈa tˈanhɑ beː onvˈɑne taʃˈaʔʃoʔhɑjˈe ˈelhɑmbˈaxʃi bˈuːdeːˈand
 105 | کِ گاهْ وَ بیگاهْ  | kˈeː ɡˈɑh vˈa biɡˈɑh
 106 | اَزْ گوشِ‌یِ چِشْمِ ذِهْنَشْ بِ وُجودِ آنْها پِیْ می‌بُرْدْ  | az ɡˈuːʃeːjˈe tʃˈeʃme zˈehnaʃ beː vodʒˈuːde ˌɑnhɑ pˈej mibˈord
 107 | عِیْنِ حَمّامْ کَرْدَنْ  | ˈejne hˈammɑm kˈardan
 108 | یا وَقْتی تَنْها دَرْ جادِ‌یِ رانَنْدِگی می‌کُنَدْ  | jɑː vˈaq1ti tˈanhɑ dˈar dʒˈɑdeːjˈe rˈɑnandˌeɡi mikˈonad
 109 | او دَرْ اینْ زَمانْ  | ˈuː dˈar iːn zamˈɑn
 110 | کارَشْ اَزْ تَرَحُّمْ بِ خوْدْ فَراتَرْ رَفْتِ  | kˈɑraʃ az tarˈahhom beː xod farˈɑtar rˈafteː
 111 | باوَری سَطْحی دَرْ او شِکْلْ گِرِفْتِ  | bɑvˈari sˈathi dˈar ˈuː ʃˈekl ɡerˈefteː
 112 | مَبْنی بَرْ اینْکِ آنْچِ بَرایِ او اِتِّفاقْ اُفْتادِ  | mˈabni bar ˈinkeː ˌɑntʃe bˌarɑjˈe ˈuː ettˈefɑq1 oftˈɑdeː
 113 | نادِرْ اَسْتْ وَ او سِزاوارَشْ نَبودِ_اَسْتْ  | nˈɑder ˈast vˈa ˈuː sˌezɑvˈɑraʃ nˈabuːdˌeː ˈast
 114 | او دیگَرْ بِ بی‌گُناهی وَ بی‌مانَنْدْ بودَنِ خوْدْ اِعْتِقادْ نَدارَدْ  | ˈuː dˈiɡar beː biɡonˈɑːhi vˈa bimˈɑnand buːdˈane xod ˌeʔteq1ˈɑd nˈadɑrˌad
 115 | اینْ بُحْرانی مُخْتَصِ میانْسالی نیسْتْ  | iːn bohrˈɑni moxtˈase mˌiɑnsˈɑli nˈist
 116 | قَضیِ فَراتَرْ اَزْ اینْ اَسْتْ کِ او باِلاَخَرِ  | q1azˈije farˈɑtar az iːn ˈast kˈeː ˈuː bˌelaxˈareː
 117 | بَعْدْ اَزْ سی سالْ  | bˈaʔd az sˈi sˈɑl
 118 | دَرْ حالِ پُشْتِ سَرْ گَذاشْتَنِ دوْرانِ بُلوغْ اَسْتْ  | dˈar hˈɑle pˈoʃte sˈar ɡazˈɑʃtanˌe doːrˈɑne bˈoluq1 ˈast
 119 | او خوْدَشْ را مَرْدی میبینَدْ  | ˈuː xˌodaʃ rɑ mˈardi mibˈinad
 120 | کِ اِشْتیاقیِ مُفْرَطْ بِ عِشْقِ رُمانْتیکْ دارَدْ  | kˈeː ˌeʃtijɑq1ˈie mˈofrat beː ˈeːʃq1e romˈɑntik dˈɑrad
 121 | کَسی کِ با اینْ حالْ چَنْدانْ اَزْ مُحَبَّتِ سَرْ دَرْ نِمی‌آوَرْدْ  | kˈasi kˈeː bɑ iːn hˈɑl tʃˈandɑn az mˌohabbˈate sˈar dˈar nˌemiˈɑvard
 122 | وَ حَتّی اَزْ بَرْقَراریِ اِرْتِباطْ هَمْ سَرِ رِشْتِ نَدارَدْ  | vˈa hˌattˈɑ az barq1arˈɑriˌe ˌertebˈɑt hˈam sˈare rˈeʃteː nˈadɑrˌad
 123 | او کَسیسْتْ کِ اَزْ تَلاشِ آشْکارْ  | ˈuː kˈasist kˈeː az talˈɑʃe ˈɑʃkɑr
 124 | بَرایِ کَسْبِ شادی می‌تَرْسَدْ  | bˌarɑjˈe kˈasbe ʃˈɑdi mitˈarsad
 125 | وَ دَرْ یَأْسْ وَ بِدُبّینیِ موْضِعْ پیش‌دَسْتانِ می‌گیرَدْ  | vˈa dˈar jˈaʔs vˈa bedˌobbinˈie mˈoːzeʔ pˈiʃdastˈɑneː miɡˈirad
 126 | وَ بِدین‌طَریقِ خوْدْ را مَصونْ نِگَهْ می‌دارَدْ  | vˈa bedˈintˌariq1ˈe xod rɑ mˈasun nˈeɡah midˈɑrad
 127 | دَرْ نَتیجِ  | dˈar nˈatidʒˌeː
 128 | اینْ خوْدْ شِکَسْتْ اَسْتْ  | iːn xod ʃˈekast ˈast
 129 | ویژِگیِ اَصْلی‌اَشْ شایَدْ سُکوتْ باشَدْ  | vˌiʒeɡˈie ˈaːsliaʃ ʃˈɑjad sˈokuːt bˈɑʃad
 130 | تِلِفُنْ زَنْگْ نِمی‌خوْرْدْ هیچْ پیشْنَهادی بِ او دادِ_نِمی‌شَوَدْ  | tˌelefˈon zˈanɡ nˌemixˈord hˈitʃ pˈiʃnahˈɑdi beː ˈuː dˈɑdeː nˌemiʃavˈad
 131 | هیچْ اِتِّفاقِ جَدیدی نِمی‌اُفْتَدْ  | hˈitʃ ˌettefˈɑq1e dʒadˈidi nˌemiˈoftad
 132 | دَرْ بیشْتَرِ عُمْرِ بُزُرْگْسالی‌اَشْ شِکَسْتْ را دَرْ شِکْلْ وَ شَمایِلِ فاجِعِ‌ای خارِقُ‌العادِّ تَصَوُّرْ می‌کَرْدِ  | dˈar biʃtˈare ˈomre bozorɡsˈɑliaʃ ʃˈekast rɑ dˈar ʃˈekl vˈa ʃamˈɑjelˌe fˈɑdʒeʔˈeːiː xˈɑreq1olˈɑdde tasˈavvor mikˈardeː
 133 | لیکِنْ باِلاَخَرِ دَرَمی‌یابَدْ کِ دَرْ حَقیقَتْ  | lˈiken bˌelaxˈareː darˈamijˈɑbad kˈeː dˈar haq1ˈiq1at
 134 | بِ خاطِرِ کاهِلی‌هایِ بُزْدِلانِ‌اَشْ  | beː xˈɑterˌe kˈɑhelˌihɑjˈe bˌozdelˈɑneˈaʃ
 135 | شِکَسْتْ بِ طَریقی نامَحْسوسْ  | ʃˈekast beː tarˈiq1i nɑmˈahsuːs
 136 | بِ سُراغِ او آمَدِ_اَسْتْ  | beː sorˈɑq1e ˈuː ɑmˈadeː ˈast
 137 | با اینْ حالْ شایَدْ عَجیبْ بِنَمایَدْ اَمّا ایرادی نَدارَدْ  | bɑ iːn hˈɑl ʃˈɑjad ˈaːdʒib benamˈɑjad ˈammˌɑ iːrˈɑdi nˈadɑrˌad
 138 | اِنْسانْ بِ هَمِ چیزْ عادَتْ می‌کُنَدْ حَتّی تَحْقیرْ  | ensˈɑn beː hˈameː tʃˈiz ˈɑdat mikˈonad hˌattˈɑ tˈahq1ir
 139 | چیزی کِ کامِلَاْ تَحَمُّل‌ناپَذیرْ می‌نَمایَدْ  | tʃˈizi kˈeː kɑmˈelan tahˈammolnɑpˌazir minamˈɑjad
 140 | هَمیشِ سَراَنْجامْ بِ نَظَرْ می‌رِسَدْ آنْقَدْرْها هَمْ بَدْ نیسْتْ  | hamˈiʃeː sarˈandʒɑm beː nˈazar mirˈesad ɑnq1ˈadrhɑ hˈam bˈad nˈist
 141 | او تاکُنونْ بِسْیاری اَزْ گُشادِ‌دَسْتی‌هایِ زِنْدِگی را بِ هَدَرْ دادِ_اَسْتْ  | ˈuː tɑkˈonun besjˈɑri az ɡoʃˈɑdeːdˈastihɑjˈe zˈendeɡˌi rɑ beː hˈadar dˈɑdeː ˈast
 142 | بِدونِ اینْکِ نَفْعِ خاصی بُرْدِ_باشَدْ  | bedˈuːne ˈinkeː nafʔˈe xˈɑsi bˈordeː bˈɑʃad
 143 | وَ بی آنْکِ تَأْثیرِ مُثْبَتی گِرِفْتِ_باشَدْ  | vˈa bi ˈɑnkeː taʔsˈire mosbˈati ɡerˈefteː bˈɑʃad
 144 | او سال‌هایِ زیادی رویِ اینْ کُرِ‌یِ خاکی زِنْدِگی کَرْدِ  | ˈuː sˈɑlhɑjˈe ziˈɑdi rujˈe iːn kˈoreːjˈe xˈɑki zˈendeɡˌi kˈardeː
 145 | هَرْگِزْ مَجْبورْ نَبودِ زَمینْ را شُخْمْ بِزَنَدْ  | hˈarɡez mˈadʒbur nˈabuːdˌeː zˈamin rɑ ʃˈoxm bezˈanad
 146 | یا با شِکَمِ گُرُسْنِ بِخوابَدْ  | jɑː bɑ ʃekˈame ɡorˈosneː bexˈɑbad
 147 | با اینْحالْ هَمْچوْنْ کودَکی لوسْ موهِبَت‌هایَشْ را عُمْدَتَاْ دَسْت‌نَخوْرْدِ رَها کَرْدِ_اَسْتْ  | bɑ ʔˈinhɑl hamtʃˈon kuːdˈaki lˈuːs muhˈebathˌɑjaʃ rɑ omdˈatan dˈastnˈaxordˌeː rahˈɑ kˈardeː ˈast
 148 | روْیاهایَشْ  | rˌojɑhˈɑjaʃ
 149 | بِ راسْتی زَمانی خِیْلی بُزُرْگْ بودَنْدْ  | beː rˈɑsti zamˈɑni xˈejli bozˈorɡ bˈuːdand
 150 | او می‌خواسْتْ لوئی کانِ دیگَری باشَدْ  | ˈuː mixˈɑst lˈoiː kˈɑne dˈiɡarˌi bˈɑʃad
 151 | یا لوکورْبوزیِ ، میسْ  | jɑː lˌuːkuːrbuːzˈije mˈis
 152 | فَنْ دِروهِ یا جَفَری باوا .  | fˈan derˈuːheː jɑː dʒafˈari bˈɑvˈɑ
 153 | او می‌خواسْتْ نوْعِ جَدیدی اَزْ مِعْماری را خَلْقْ کُنَدْ  | ˈuː mixˈɑst nˈoʔe dʒadˈidi az meʔmˈɑri rɑ xˈalq1 kˈonad
 154 | با مُشَخَّصِ‌یِ بومی  | bɑ mˌoʃaxxˈaseːjˈe bˈuːmi
 155 | باشُکوهْ هَماهَنْگْ وَ موْزونْ  | bɑʃˈokuh hamˈɑːhanɡ vˈa mˈoːzuːn
 156 | اَزْ نَظَرِ تِکْنوْلوْژیِ کامِلَاْ اِمْروزی وَ پیشْرَفْتِ وَ پیشْتازْ  | az nˈazarˌe tˌeknoloʒˈie kɑmˈelan emrˈuzi vˈa piʃrˈafteː vˈa pˈiʃtˈɑz
 157 | دَرْ عَوَضْ  | dˈar ˈavaz
 158 | مُعاوِنِ تَقْریبَاْ وَرْشِکَسْتِ‌یِ مُدیرِ یِکْ شِرْکَتِ طَرّاحیِ شَهْریِ دَرَجِ دوْ اَسْتْ  | mˌoʔɑvˈene taq1rˈiban vˌarʃekˈasteːjˈeː modˈire jˈek ʃerkˈate tˌarrɑhˈie ʃahrˈie darˈadʒeː dˈo ˈast
 159 | وَ تَنْها یِکْ ساخْتِمانْ بِ نامَشْ اَسْتْ  | vˈa tˈanhɑ jˈek sˈɑxtemˌɑn beː nˈɑmaʃ ˈast
 160 | کِ دَرْ واقِعْ  | kˈeː dˈar vˈɑq1eʔ
 161 | بِ آلونَکْ بیشْتَرْ شَبیهْ اَسْتْ  | beː ˈɑluːnˌak bˈiʃtar ʃˈabih ˈast
 162 | رویاهایِ مُصِرّانِ  | rujˈɑhˈɑje mˌoserrˈɑne
 163 | راجِعْ بِ موَفَّقیَتْ  | rˈɑdʒeʔ beː mˌovaffaq1ˈiːjat
 164 | ذاتَاْ دَرونِ ما وُجودْ دارَنْدْ  | zˈɑtan darˈune mɑ vˈodʒuːd dˈɑrand
 165 | بایَدْ مَزیَتیِ تَکامُلی  | bˈɑjad mˌaziːjatˈie takˈɑmolˌi
 166 | دَرْ اینْ تَلاش‌هایِ غَریزی بَرایِ گونه‌هایِ مُخْتَلِفْ وُجودْ داشْتِ_باشَدْ  | dˈar iːn talˈɑʃhɑjˈe q1arˈizi bˌarɑjˈe ɡˈuneːhɑjˈe moxtˈalef vˈodʒuːd dˈɑʃteː bˈɑʃad
 167 | فَعالیَتْ وَ تَکاپو بَرایِ ما  | fˌaːʔɑlˈiːjat vˈa takˈɑpuː bˌarɑjˈe mˈɑ
 168 | شَهْرْها وَ کِتابْخانه‌ها  | ʃˈahrhɑ vˈa kˌetɑbxˈɑnehˈɑ
 169 | وَ سَفینه‌هایِ فَضایی را بِ اَرْمَغانْ آوَرْدِ_اَسْتْ  | vˈa safˈineːhɑjˈe fazˈɑiː rɑ beː ˈaːrmaq1ˌɑn ɑvˈardeː ˈast
 170 | اَمّا اینْ مِیْلْ وَ اَنْگیزِ  | ˈammˌɑ iːn mˈeːjl vˈa ˈaːnɡizˌeː
 171 | فُرْصَتِ چَنْدانی  | forsˈate tʃandˈɑni
 172 | بَرایِ آرامِشِ روحیِ فَرْدْ باقی نِمی‌گُذارَدْ  | bˌarɑjˈe ˌɑrɑmˈeʃe ruːhˈie fˈard bˈɑq1i nˌemiɡozˈɑrad
 173 | بِهایِ چَنْدْ کارِ خَلاقانِ دَرْ طولِ تاریخْ  | behɑjˈe tʃˈand kˈɑre xalˈɑq1ɑnˌeː dˈar tˈuːle tˈɑrix
 174 | اینْ اَسْتْ کِ بَخْشِ عَظیمی اَزْ نِژادِ بَشَرْ  | iːn ˈast kˈeː bˈaxʃe aːzˈimi az neʒˈɑde bˈaʃar
 175 | هَرْ روزِ بِخاطِرِ اِضْطِرابْ وَ ناامیدی  | har rˈuːzeː bexˈɑterˌe eztˈerɑb vˈa nˈɑˈɑmidˌi
 176 | بیمارْ می‌شَوَنْدْ  | bimˈɑr miʃˈavand
 177 | رَبیعْ قَبْلَاْ تَصَوُّرْ می‌کَرْدْ  | rˈabiʔ q1ˈablan tasˈavvor mikˈard
 178 | هَرْ چیزْ دَرْ صورَتی اَرْزِشْمَنْدْ اَسْتْ کِ بی نَقْصْ باشَدْ  | har tʃˈiz dˈar surˈati arzˈeʃmand ˈast kˈeː bi nˈaq1s bˈɑʃad
 179 | او کَمالْگَرا بودْ  | ˈuː kˌamɑlɡˈarɑ bˈuːd
 180 | اَگَرْ ماشینِ خَراشْ بَرْداشْتِ بودْ  | ˌaɡˈar mˈɑʃinˌe xarˈɑʃ bardˈɑʃteː bˈuːd
